CaseID,Category,question,num_of_debates,sum_of_debates
7,professional_accounting,"A shoe retailer allows customers to return shoes within 90 days of purchase. The company estimates that 5% of sales will be returned within the 90-day period. During the month, the company has sales of $200,000 and returns of sales made in prior months of $5,000. What amount should the company record as net sales revenue for new sales made during the month? The options are: A) $185,000, B) $190,000, C) $195,000, D) $200,000",[2],2
8,professional_accounting,"Rune Co.'s checkbook balance on December 31 was $10000. On that date Rune held the following items in its safe: $4000 check payable to Rune postdated January 3 and not included in the December 31 checkbook balance in collection of a sale made in December. $1000 check payable to Rune deposited December 15 and included in the December 31 checkbook balance but returned by the bank on December 30 stamped ""NSF"". The check was redeposited on January 2 and cleared on January 9. What amount should Rune report as cash in its December 31 balance sheet? The options are: A) $9,000, B) $10,000, C) $13,000, D) 14000","[1, 1]",2
9,professional_accounting,"A partner in a general partnership is usually not entitled to which of the following? The options are: A) To participate in management., B) To review accounting records., C) To enter into a contract with a third party without the consent of the other partners., D) To be liable only for personal negligence.","[1, 1]",2
10,professional_accounting,"Long was a purchasing agent for Frost, a sole proprietor. Long had express authority to place purchase orders with Frost's suppliers. Long conducted business on the Internet and had little contact with Frost. After Frost was declared incompetent in a judicial proceeding, Long placed an order with Grant Corp. on Frost's behalf. Both Long and Grant were unaware of Frost's incompetence. Will Frost or Frost's legal representative be liable to Grant? The options are: A) Yes, because Long's agency survived Frost's incompetence., B) Yes, because the order was valid regardless of Frost's incompetence., C) No, because Grant dealt only with Long., D) No, because Long did not have authority to enter into the contract.",[1],1
11,professional_accounting,"Under state law Boca Co. may reimburse the state directly for actual unemployment claims or it may pay 3% of eligible gross wages. Boca believes that actual unemployment claims will be 2% of eligible gross wages and has chosen to reimburse the state. Eligible gross wages are defined as the first $15000 of gross wages paid to each employee. Boca had four employees each of whom earned $20000 during the year. What amount should Boca report as accrued liability for unemployment claims in its year-end balance sheet? The options are: A) $1,200, B) $1,600, C) $1,800, D) 2400",0,0
12,professional_accounting,"A bond issued on June 1, year 1, has interest payment dates of April 1 and October 1. Bond interest expense for the year ended December 31, year 1, is for a period of The options are: A) Three months., B) Four months., C) Six months., D) Seven months.",[1],1
13,professional_accounting,"A nongovernmental, not-for-profit organization held the following investments:
Investment Cost, Fair value (beginning of year), Fair value (end of year)
Stock A (100 shares), $50 per share, $45, $51
Stock B (200 shares), $40 per share, $41, $49
What amount of stock investments should be reported in the year-end statement of financial position? The options are: A) $12,700, B) $13,000, C) $13,800, D) $14,900",[1],1
14,professional_accounting,"A company last paid a dividend of $3. If the expected return on its equity is estimated at 12% and its shares are currently quoted on London Stock Exchange at $75, what should the dividend growth rate be to ensure that the price is consistent with the pricing of a growing perpetuity? The options are: A) 0%, B) 8%, C) 16%, D) -4%","[1, 1, 1]",3
15,professional_accounting,"On January 1, a company enters into an operating lease for office space and receives control of the property to make leasehold improvements. The company begins alterations to the property on March 1 and the company’s staff moves into the property on May 1. The monthly rental payments begin on July 1. The recognition of rental expense for the new offices should begin in which of the following months? The options are: A) January., B) March., C) May., D) July.",0,0
16,professional_accounting,"A company invested in a new machine that will generate revenues of $35,000 annually for seven years. The company will have annual operating expenses of $7,000 on the new machine. Depreciation expense, included in the operating expenses, is $4,000 per year. The expected payback period for the new machine is 5.2 years. What amount did the company pay for the new machine? The options are: A) $145,600, B) $161,200, C) $166,400, D) $182,000",0,0
0,professional_accounting,"Which of the following items is not subject to the application of intraperiod income tax allocation? The options are: A) Discontinued operations, B) Income from continuing operations., C) Extraordinary gains and losses, D) Operating income.",[1],1
2,professional_accounting,"Pine Co. purchased land for $450000 as a factory site. An existing building on the site was razed before construction began. Additional information is as follows: Cost of razing old building $60000 Title insurance and legal fees to purchase land $30000 Architect's fees $95000 New building construction cost $1850000 What amount should Pine capitalize as the cost of the completed factory building? The options are: A) $2,005,000, B) $1,975,000, C) $1,945,000, D) 1910000",0,0
19,professional_accounting,"A U.S. manufacturer has a production operation in Mexico. The product costs 116.50 pesos to produce and ship to Europe, where the product sells for 20 euros. If 0.1099 U.S. dollars are required to buy one Mexican peso, and 0.8928 U.S. dollars are required to buy one euro, what amount of U.S. dollars is the profit on the sale? The options are: A) $5.06, B) $6.11, C) $7.20, D) $9.60",0,0
5,professional_accounting,"The standard deviations of Stocks A and B are respectively 6% and 18%. If their correlation is 0.2 and an equal weighted portfolio is formed, what is the standard deviation of such a portfolio? The options are: A) 10%, B) 5%, C) 3.40%, D) 9.70%",0,0
21,professional_accounting,"A company exchanged land with an appraised value of $50,000 and an original cost of $20,000 for machinery with a fair value of $55,000. Assuming that the transaction has commercial substance, what is the gain on the exchange? The options are: A) $0, B) $5,000, C) $30,000, D) $35,000",0,0
22,professional_accounting,"The sole shareholder of an S corporation contributed equipment with a fair market value of $20,000 and a basis of $6,000 subject to $12,000 liability. What amount is the gain, if any, that the shareholder must recognize The options are: A) $0, B) $6,000, C) $8,000, D) $12,000",0,0
23,professional_accounting,"A company’s new time clock process requires hourly employees to select an identification number and then choose the clock-in or clock-out button. A video camera captures an image of the employee using the system. Which of the following exposures can the new system be expected to change the least? The options are: A) Fraudulent reporting of employees’ own hours., B) Errors in employees’ overtime computation, C) Inaccurate accounting of employees’ hours., D) Recording of other employees’ hours.",0,0
24,professional_accounting,"Gamma Co. a manufacturer of medical products had a 10% return on assets and an asset turnover of 4:1. What was Gamma's profit margin on sales? The options are: A) 40.00%, B) 10.00%, C) 4.00%, D) 0.025",0,0
10,professional_accounting,"Long was a purchasing agent for Frost, a sole proprietor. Long had express authority to place purchase orders with Frost's suppliers. Long conducted business on the Internet and had little contact with Frost. After Frost was declared incompetent in a judicial proceeding, Long placed an order with Grant Corp. on Frost's behalf. Both Long and Grant were unaware of Frost's incompetence. Will Frost or Frost's legal representative be liable to Grant? The options are: A) Yes, because Long's agency survived Frost's incompetence., B) Yes, because the order was valid regardless of Frost's incompetence., C) No, because Grant dealt only with Long., D) No, because Long did not have authority to enter into the contract.",0,0
26,elementary_mathematics,"The distance between Miriam’s house and Debbie’s house is 444.44 meters. Which statement about the values of the digits in the distance, in meters, between their houses is true? The options are: A) The value of the 4 in the tenths place is 1/10 the value of the 4 in the tens place., B) The value of the 4 in the hundredths place is 1/10 the value of the 4 in the ones place., C) The value of the 4 in the hundreds place is 10 times greater than the value of the 4 in the ones place., D) The value of the 4 in the tenths place is 10 times greater than the value of the 4 in the hundredths place.",[1],1
27,elementary_mathematics,"Last weekend Sanjay watched 3 television shows that were each 30 minutes long. He also watched 1 movie on television that was 90 minutes long. What is the total number of minutes Sanjay watched television last weekend? The options are: A) 100, B) 120, C) 150, D) 180",[1],1
28,college_mathematics,"If a real number x is chosen at random in the interval [0, 3] and a real number y is chosen at random in the interval [0, 4], what is the probability that x < y? The options are: A) 1/2, B) 7/12, C) 5/8, D) 2/3","[1, 1, 3]",5
29,college_mathematics,"Let y = f(x) be a solution of the differential equation x dy + (y - xe^x) dx = 0 such that y = 0 when x = 1. What is the value of f(2)? The options are: A) 1/(2e), B) 1/e, C) e^2/2, D) 2e","[1, 1, 1, 1, 1]",5
29,college_mathematics,"Let y = f(x) be a solution of the differential equation x dy + (y - xe^x) dx = 0 such that y = 0 when x = 1. What is the value of f(2)? The options are: A) 1/(2e), B) 1/e, C) e^2/2, D) 2e","[1, 1, 1]",3
31,college_mathematics,"How many positive numbers x satisfy the equation cos(97x) = x? The options are: A) 1, B) 15, C) 31, D) 49","[1, 1, 1]",3
32,college_mathematics,"For how many positive integers k does the ordinary decimal representation of the integer k! end in exactly 99 zeros? The options are: A) None, B) One, C) Four, D) Five","[1, 1, 1]",3
33,college_mathematics,"Up to isomorphism, how many additive abelian groups G of order 16 have the property that x + x + x + x = 0 for each x in G ? The options are: A) 0, B) 1, C) 2, D) 3","[1, 1, 1, 1]",4
31,college_mathematics,"How many positive numbers x satisfy the equation cos(97x) = x? The options are: A) 1, B) 15, C) 31, D) 49","[1, 1, 1, 1, 1]",5
33,college_mathematics,"Up to isomorphism, how many additive abelian groups G of order 16 have the property that x + x + x + x = 0 for each x in G ? The options are: A) 0, B) 1, C) 2, D) 3",0,0
36,college_mathematics,"A fair coin is to be tossed 100 times, with each toss resulting in a head or a tail. If H is the total number of heads and T is the total number of tails, which of the following events has the greatest probability? The options are: A) H = 50, B) T >= 60, C) 51 <= H <= 55, D) H >= 48 and T >= 48",0,0
37,college_mathematics,"The curves y = (sin x + cos x)^4 and y = (sin x - cos x)^4 intersect at x = 0. If a is the smallest positive value of x at which these curves next intersect, determine the area between these curves from x = 0 to x = a. The options are: A) 2, B) π, C) 4, D) 3π/2","[2, 1, 1, 1, 1]",6
38,college_mathematics,"If f : (0, 1) → (0, 1], then which of the following could be TRUE?
I. f is one-to-one and onto.
II. The image of f is compact.
III. f is continuous, one-to-one, and onto. The options are: A) I only, B) II only, C) I and II only, D) I and III only",0,0
39,college_mathematics,"If f is a linear transformation from the plane to the real numbers and if f(1, 1) = 1 and f(-1, 0) = 2, then f(3, 5) = The options are: A) 9, B) 8, C) 0, D) -5",[1],1
40,college_mathematics,"Statement 1 | If A is connected, the closure of A must be connected. Statement 2 | Every continuous function f : (0, 1) → (0, 1) has a fixed point. The options are: A) True, True, B) True, False, C) False, True, D) False, False",0,0
41,college_mathematics,"Sofia and Tess will each randomly choose one of the 10 integers from 1 to 10. What is the probability that neither integer chosen will be the square of the other? The options are: A) 0.64, B) 0.72, C) 0.81, D) 0.95","[1, 1, 3, 1, 1]",7
42,college_mathematics,"A university’s mathematics department has 10 professors and will offer 20 different courses next semester. Each professor will be assigned to teach exactly 2 of the courses, and each course will have exactly one professor assigned to teach it. If any professor can be assigned to teach any course, how many different complete assignments of the 10 professors to the 20 courses are possible? The options are: A) 20!/2^(10), B) 10!/2^9, C) 10^(20) - 2^(10), D) 10^(20) - 100",0,0
42,college_mathematics,"A university’s mathematics department has 10 professors and will offer 20 different courses next semester. Each professor will be assigned to teach exactly 2 of the courses, and each course will have exactly one professor assigned to teach it. If any professor can be assigned to teach any course, how many different complete assignments of the 10 professors to the 20 courses are possible? The options are: A) 20!/2^(10), B) 10!/2^9, C) 10^(20) - 2^(10), D) 10^(20) - 100","[1, 1, 1]",3
44,college_mathematics,"In the xy-plane, the graph of x^(log y) = y^log x is The options are: A) the open first quadrant, B) a closed curve, C) a ray in the open first quadrant, D) a single point",[1],1
45,college_mathematics,"For which value of n are there exactly two abelian groups of order n up to isomorphism? The options are: A) 4, B) 7, C) 8, D) 12",[1],1
44,college_mathematics,"In the xy-plane, the graph of x^(log y) = y^log x is The options are: A) the open first quadrant, B) a closed curve, C) a ray in the open first quadrant, D) a single point","[1, 1, 1, 1, 1]",5
47,college_mathematics,"Statement 1 |  Suppose ∑|a_i| diverges and ∑ a_i = 2. There is a rearrangement a_i_k of the terms such that ∑ a_i_k = 4. Statement 2 | There exists metric spaces X and Y with X closed and bounded and a continuous mapping f : X → Y such that f(X) is NOT “closed and bounded”. The options are: A) True, True, B) True, False, C) False, True, D) False, False",0,0
48,college_mathematics,"The shortest distance from the curve xy = 8 to the origin is The options are: A) 4, B) 8, C) 16, D) 2sqrt(2)","[1, 1]",2
49,college_mathematics,"A large class is to be divided into teams and each student must be a member of exactly one team. However, each student dislikes three of their classmates. Dislike between students need not be mutual. If the teams do not need to be equally sized, how many must be created so that no student is the teammate of someone they dislike? The options are: A) 4, B) 7, C) 10, D) 13","[1, 1, 1]",3
50,college_mathematics,"The map x -> axa^2 of a group G into itself is a homomorphism if and only if The options are: A) G is abelian, B) G = {e}, C) a^3 = e, D) a^2 = a","[3, 1, 1, 1, 1]",7
33,college_mathematics,"Up to isomorphism, how many additive abelian groups G of order 16 have the property that x + x + x + x = 0 for each x in G ? The options are: A) 0, B) 1, C) 2, D) 3",[1],1
52,college_mathematics,"If the finite group G contains a subgroup of order seven but no element (other than the identity) is its own inverse, then the order of G could be The options are: A) 27, B) 28, C) 35, D) 37","[1, 1, 1, 1]",4
38,college_mathematics,"If f : (0, 1) → (0, 1], then which of the following could be TRUE?
I. f is one-to-one and onto.
II. The image of f is compact.
III. f is continuous, one-to-one, and onto. The options are: A) I only, B) II only, C) I and II only, D) I and III only","[1, 3, 1]",5
54,college_mathematics,"Water drips out of a hole at the vertex of an upside down cone at a rate of 3 cm^3 per minute. The
cone’s height and radius are 2 cm and 1 cm, respectively. At what rate does the height of the water change
when the water level is half a centimeter below the top of the cone? The volume of a cone is V = (π/3)*r^2*h,
where r is the radius and h is the height of the cone. The options are: A) −48/π cm/min, B) −4/(3π) cm/min, C) −8/(3π) cm/min, D) −16/(3π) cm/min",[1],1
55,college_mathematics,"The region bounded by the curves y = x and y = x^2 in the first quadrant of the xy-plane is rotated about the y-axis. The volume of the resulting solid of revolution is The options are: A) π/12, B) π/6, C) π/3, D) 2π/3","[2, 1, 1, 3, 3]",10
48,college_mathematics,"The shortest distance from the curve xy = 8 to the origin is The options are: A) 4, B) 8, C) 16, D) 2sqrt(2)","[3, 2, 1, 1, 1]",8
57,college_mathematics,"Let (Z_{10} , +, x) be the ring of integers modulo 10, and let S be the subset of Z_{10} represented by {0, 2, 4, 6, 8}. Which of the following statements is FALSE? The options are: A) (S, +, x) is closed under addition modulo 10., B) (S, +, x) is closed under multiplication modulo 10., C) (S, +, x) has an identity under addition modulo 10., D) (S, +, x) has no identity under multiplication modulo 10.",0,0
48,college_mathematics,"The shortest distance from the curve xy = 8 to the origin is The options are: A) 4, B) 8, C) 16, D) 2sqrt(2)","[3, 3]",6
65,college_mathematics,"Let f(x, y) = x^3 + y^3 + 3xy for all real x and y. Then there exist distinct points P and Q such that f has a The options are: A) local maximum at P and at Q, B) saddle point at P and at Q, C) local maximum at P and a saddle point at Q, D) local minimum at P and a saddle point at Q","[3, 1, 2, 2]",8
66,college_computer_science,"Which of the following statements about horizontal versus vertical microarchitecture is (are) true?
I. Programs for horizontal architectures require more time steps than those for vertical architectures.
II. Horizontal microinstructions are unencoded.
III. Horizontal microinstructions usually have a single opcode and multiple operand specifiers. The options are: A) I only, B) II only, C) III only, D) II and III only","[1, 1]",2
67,college_computer_science,"Let A and B be two sets of words (strings) from Σ*, for some alphabet of symbols Σ. Suppose that B is a subset of A. Which of the following statements must always be true of A and B ?
I. If A is finite, then B is finite.
II. If A is regular, then B is regular.
III. If A is context-free, then B is context-free. The options are: A) I only, B) II only, C) III only, D) I and II only",[1],1
68,college_computer_science,"An integer c is a common divisor of two integers x and y if and only if c is a divisor of x and c is a divisor of y. Which of the following sets of integers could possibly be the set of all common divisors of two integers? The options are: A) {-6,-2, -1, 1, 2, 6}, B) {-6, -2, -1, 0, 1, 2, 6}, C) {-6, -3, -2, -1, 1, 2, 3, 6}, D) {-6, -3, -2, -1, 0, 1, 2, 3, 6}",[2],2
68,college_computer_science,"An integer c is a common divisor of two integers x and y if and only if c is a divisor of x and c is a divisor of y. Which of the following sets of integers could possibly be the set of all common divisors of two integers? The options are: A) {-6,-2, -1, 1, 2, 6}, B) {-6, -2, -1, 0, 1, 2, 6}, C) {-6, -3, -2, -1, 1, 2, 3, 6}, D) {-6, -3, -2, -1, 0, 1, 2, 3, 6}",0,0
70,college_computer_science,"Array A contains 256 elements of 4 bytes each. Its first element is stored at physical address 4,096.
Array B contains 512 elements of 4 bytes each. Its first element is stored at physical address 8,192.
Assume that only arrays A and B can be cached in an initially empty, physically addressed, physically tagged, direct-mapped, 2K-byte cache with an 8-byte block size. The following loop is then executed.
for (i = 0; i < 256; i++)
        A[i] = A[i] + B[2*i];
During the execution of the loop, how many bytes will be written to memory if the cache has a write-back policy? The options are: A) 0, B) 256, C) 1024, D) 2000",[1],1
71,college_computer_science,"A particular disk unit uses a bit string to record the occupancy or vacancy of its tracks, with O denoting vacant and 1 denoting occupied. A 32-bit segment of this string has the hexadecimal value D4FE2003. The percentage of occupied tracks for the corresponding part of the disk, to the nearest percent, is The options are: A) 12%, B) 25%, C) 38%, D) 44%",0,0
67,college_computer_science,"Let A and B be two sets of words (strings) from Σ*, for some alphabet of symbols Σ. Suppose that B is a subset of A. Which of the following statements must always be true of A and B ?
I. If A is finite, then B is finite.
II. If A is regular, then B is regular.
III. If A is context-free, then B is context-free. The options are: A) I only, B) II only, C) III only, D) I and II only",[1],1
73,college_computer_science,"In the NoNicks operating system, the time required by a single file-read operation has four nonoverlapping components:
disk seek time-25 msec
disk latency time-8 msec
disk transfer time- 1 msec per 1,000 bytes
operating system overhead-1 msec per 1,000 bytes + 10 msec
In version 1 of the system, the file read retrieved blocks of 1,000 bytes. In version 2, the file read (along with the underlying layout on disk) was modified to retrieve blocks of 4,000 bytes. The ratio of-the time required to read a large file under version 2 to the time required to read the same large file under version 1 is approximately The options are: A) 1:4, B) 1:3.5, C) 1:1, D) 1.1:1",[1],1
68,college_computer_science,"An integer c is a common divisor of two integers x and y if and only if c is a divisor of x and c is a divisor of y. Which of the following sets of integers could possibly be the set of all common divisors of two integers? The options are: A) {-6,-2, -1, 1, 2, 6}, B) {-6, -2, -1, 0, 1, 2, 6}, C) {-6, -3, -2, -1, 1, 2, 3, 6}, D) {-6, -3, -2, -1, 0, 1, 2, 3, 6}","[3, 1]",4
75,college_computer_science,"Consider the collection of all undirected graphs with 10 nodes and 6 edges. Let M and m, respectively, be the maximum and minimum number of connected components in any graph in the collection. If a graph has no selfloops and there is at most one edge between any pair of nodes, which of the following is true? The options are: A) M = 10, m = 10, B) M = 10, m = 1, C) M = 7, m = 4, D) M = 6, m = 4","[1, 1, 1, 1]",4
76,college_computer_science,"Let M be a single-tape, deterministic Turing machine with tape alphabet {blank,0,1}, and let C denote the (possibly infinite) computation of M starting with a blank tape. The input to each problem below is M, together with a positive integer n. Which of the following problems is (are) decidable?
I. The computation C lasts for at least n steps.
II. The computation C lasts for at least n steps, and M prints a 1 at some point after the nth step.
III. M scans at least n distinct tape squares during the computation C. The options are: A) None, B) III only, C) I and II only, D) I and III only",0,0
77,college_computer_science,"To compute the matrix product M_1M_2, where M_1 has p rows and q columns and where M_2 has q rows and r columns, takes time proportional to pqr, and the result is a matrix of p rows and r columns. Consider the product of three matrices N_1N_2N_3 that have, respectively, w rows and x columns, x rows and y columns, and y rows and z columns. Under what condition will it take less time to compute the product as (N_1N_2)N_3 (i.e., multiply the first two matrices first) than to compute it as N_1(N_2 N_3)? The options are: A) There is no such condition; i.e., they will always take the same time., B) 1/x + 1/z < 1/w + 1/y, C) x > y, D) 1/w + 1/x < 1/y + 1/z","[1, 1, 1, 1, 1]",5
78,college_computer_science,"Which of the following problems can be solved by a standard greedy algorithm?
I. Finding a minimum spanning tree in an undirected graph with positive-integer edge weights
II. Finding a maximum clique in an undirected graph
III. Finding a maximum flow from a source node to a sink node in a directed graph with positive-integer edge capacities The options are: A) I only, B) II only, C) III only, D) I and II only",0,0
79,college_computer_science,"A ""strictly binary tree"" is a binary tree in which every node that is not a leaf has two children. Suppose that for a class of strictly binary trees there exists c > 0 such that, for any tree in the class, the ratio of the lengths of any two root-to-leaf paths is bounded above by c. Which of the following best characterizes the height h of any tree in this class, where N is the number of nodes in the tree and N > 1 ? The options are: A) h <= log2(N), B) h = 1/c * log2(N), C) h < c log2(N), D) h > c log2(N)","[1, 1, 1, 1]",4
80,college_computer_science,"Of the following, which best approximates the ratio of the number of nonterminal nodes to the total number of nodes in a complete K-ary tree of depth N? The options are: A) 1/K, B) K-1/K, C) log_10 (1/N), D) N-1/m","[1, 1, 1]",3
81,Challenging Math,"consider the sets tn = { n , n + 1 , n + 2 , n + 3 , n + 4 ) , where n = 1 , 2 , 3 , … , 96 . how many of these sets contain 6 or any integral multiple thereof ( i . e . , any one of the numbers 6 , 12 , 18 , … ) ? The options are: a ) 80 , b ) 81 , c ) 82 , d ) 83 , e ) 84","[1, 1, 1]",3
