CaseID,Category,question,num_of_debates,sum_of_debates
82,Challenging Math,"a is a working partner and b is a sleeping partner in a business . a puts in 20,000 and b 90,000 . a gets 20 % of the profit for managing the business , and the rest is divided in proportion to their capitals . find the share of b in profit of 11000 . The options are: a ) 3500 , b ) 7200 , c ) 6800 , d ) 4800 , e ) none of these",[2],2
83,Challenging Math,"last year the price range ( per kg ) for 100 varieties of apples in wholesale market was $ 100 . if the prices of each of the 100 varieties increased by 10 percent this year over what it was last year , what is the range of the wholesale prices of the 1000 varieties of apples this year ? The options are: a ) $ 50 , b ) $ 100 , c ) $ 110 , d ) $ 600 , e ) $ 300",[1],1
84,Challenging Math,"if the price of a certain computer increased 30 percent from a dollars to 351 dollars , then 2 a = The options are: a ) 540 , b ) 570 , c ) 619 , d ) 649 , e ) 700",0,0
85,Challenging Math,"at a restaurant , glasses are stored in two different - sized boxes . one box contains 12 glasses , and the other contains 16 glasses . if the average number of glasses per box is 15 , and there are 16 more of the larger boxes , what is the total number of glasses w at the restaurant ? ( assume that all boxes are filled to capacity . ) The options are: a ) 96 , b ) 240 , c ) w = 256 , d ) w = 384 , e ) w = 480",[1],1
86,Challenging Math,"a is 30 % more efficient than b . how much time they will working together take to complete a job which a alone could have done in 23 days ? The options are: a ) 25 days , b ) 13 days , c ) 14 days , d ) 20 days , e ) 15 days","[1, 1, 1]",3
87,Challenging Math,"the product of two numbers is 2028 and their h . c . f is 13 . the number of such pairs is : The options are: a ) 1 , b ) 2 , c ) 3 , d ) 4 , e ) 5","[1, 1]",2
88,Challenging Math,"4 men and 6 women can complete a work in 8 days , while 3 men and 7 women can complete it in 10 days . in how many days will 10 women complete it ? The options are: a ) 21 days , b ) 40 days , c ) 27 days , d ) 18 days , e ) 17 days",[1],1
89,Challenging Math,"a sum of rs . 66000 is divided into 3 parts such that the simple interests accrued on them for 6 , two and 11 years respectively may be equal . find the amount deposited for 11 years . The options are: a ) 6500 , b ) 2000 , c ) 4500 , d ) 3000 , e ) 6000",[1],1
90,Challenging Math,"a man bought 20 shares of rs . 50 at 5 discount , the rate of dividend being 13 . the rate of interest obtained is : The options are: a ) 27 % , b ) 87 % , c ) 15 % , d ) 66 % , e ) 88 %",[1],1
91,Challenging Math,"miller street begins at baker street and runs directly east for 4.5 kilometers until it ends when it meets turner street . miller street is intersected every 250 meters by a perpendicular street , and each of those streets other than baker street and turner street is given a number beginning at 1 st street ( one block east of baker street ) and continuing consecutively ( 2 nd street , 3 rd street , etc . . . ) until the highest - numbered street one block west of turner street . what is the highest - numbered street that intersects miller street ? The options are: a ) 15 th , b ) 16 th , c ) 17 th , d ) 18 th , e ) 19 th",[1],1
92,Challenging Math,"alice and bob drive at constant speeds toward each other on a highway . alice drives at a constant speed of 30 km per hour . at a certain time they pass by each other , and then keep driving away from each other , maintaining their constant speeds . if alice is 100 km away from bob at 7 am , and also 100 km away from bob at 11 am , then how fast is bob driving ( in kilometers per hour ) ? The options are: a ) 20 , b ) 24 , c ) 28 , d ) 32 , e ) 36",[1],1
93,Challenging Math,"mathew is planning a vacation trip to london next year from today for 5 days , he has calculated he would need about $ 3000 for expenses , including a round - trip plane ticket from l . a to london . he nets around $ 1500 monthly in gross income , after all bills are paid , he is left with about $ 350 each month free for whatever he desires . how much money would mathew need to evenly save from his $ 350 to have $ 3000 in his bank within 12 months ? The options are: a ) $ 240 , b ) $ 350 , c ) $ 217 , d ) $ 250 , e ) $ 340",0,0
94,Challenging Math,"marty ' s pizza shop guarantees that their pizzas all have at least 75 % of the surface area covered with toppings , with a crust of uniform width surrounding them . if you order their best seller – a circular pizza with a diameter of 16 inches – what is the maximum width you can expect to see for the crust ? The options are: ['a ) 0.8 inches', 'b ) 1.1 inches', 'c ) 1.6 inches', 'd ) 2.0 inches', 'e ) 2.5 inches']",0,0
95,Challenging Math,"the tailor has a 10 meter long piece of fabric for which to sew a ball room dress . she has to cuts this fabric into strips of 200 centimeters each . how long will it take the tailor to complete this tasks if each 200 centimeter took 5 minutes to cut ? The options are: a ) 150 , b ) 200 , c ) 188 , d ) 245 , e ) 123",0,0
81,Challenging Math,"consider the sets tn = { n , n + 1 , n + 2 , n + 3 , n + 4 ) , where n = 1 , 2 , 3 , … , 96 . how many of these sets contain 6 or any integral multiple thereof ( i . e . , any one of the numbers 6 , 12 , 18 , … ) ? The options are: a ) 80 , b ) 81 , c ) 82 , d ) 83 , e ) 84","[3, 1, 1, 1, 1]",7
97,Challenging Math,"a is thrice as good as workman as b and therefore is able to finish a job in 60 days less than b . working together , they can do it in : The options are: a ) 20 days , b ) 22 1 / 2 days , c ) 24 days , d ) 25 days , e ) 30 days","[1, 1]",2
98,Challenging Math,"two consultants can type up a report in 12.5 hours and edit it in 7.5 hours . if mary needs 30 hours to type the report and jim needs 12 hours to edit it alone , how many t hours will it take if jim types the report and mary edits it immediately after he is done ? The options are: a ) 41.4 , b ) 34.1 , c ) 13.4 , d ) 12.4 , e ) 10.8","[3, 1, 1]",5
99,Challenging Math,"suppose you have three identical prisms with congruent equilateral triangles as the end - polygons . suppose you attach them by the rectangular faces so they are perfectly aligned . there will be some large faces created by two or more co - planar faces of the individual prisms : count each such large face as one . given that , how many faces does the resultant solid have ? The options are: a ) 4 , b ) 6 , c ) 9 , d ) 10 , e ) 12","[1, 1, 1, 1, 1]",5
100,Challenging Math,"find compound interest on rs . 7500 at 4 % per year for 2 years , compounded annually . The options are: a ) 812 , b ) 712 , c ) 412 , d ) 512 , e ) 612",0,0
101,Math,"the simple interest on a sum of money will be rs . 800 after 10 years . if the principal is trebled after 5 years what will be the total interest at the end of the tenth year ? The options are: a ) 8981 , b ) 3799 , c ) 1200 , d ) 1600 , e ) 1732","[1, 2]",3
102,Math,"Zayne sells bracelets for $5 each and two for $8. If he started with 30 bracelets and made $60 from selling bracelets for $5 each, how much in total did he make from selling his bracelets?",0,0
103,Math,"in digging a pond 20 m * 10 m * 5 m the volumes of the soil extracted will be ? The options are: a ) 100 cu . m , b ) 1000 cu . m , c ) 10000 cu . m , d ) 2000 cu . m , e ) 4000 cu . m",0,0
104,Math,"a and b can do a piece of work in 7 days , b and c in 8 days , c and a in 9 days . how long will c take to do it ? The options are: a ) 14.1 days , b ) 18.8 days , c ) 21.4 days , d ) 24.3 days , e ) 26.5 days","[1, 1, 3, 1, 1]",7
105,Math,"in the xy - coordinate plane , the graph of y = - x ^ 2 + 9 intersects line l at ( p , 5 ) and ( t , 7 ) . what is the least possible value of the slope of line l ? The options are: a ) 6 , b ) 2 , c ) - 2 , d ) 1 , e ) - 10","[1, 1, 1, 1, 1]",5
106,Math,"Brandon has been fired from half the businesses in town and has quit from a third of them. If there are 72 business in town, how many businesses can he still apply to?",0,0
107,Math,"a reduction of 25 % in the price of apples would enable a man to obtain 36 more for rs . 25 , what is reduced price per dozen ? The options are: a ) 2 , b ) 3 , c ) 6 , d ) 7 , e ) 10","[1, 1]",2
108,Math,"a train 150 m long is running at a speed of 68 kmph . how long does it take to pass a man who is running at 8 kmph in the same direction as the train ? The options are: a ) 2 sec , b ) 6 sec , c ) 8 sec , d ) 9 sec , e ) 5 sec",0,0
109,Math,"a rectangular tiled patio is composed of 48 square tiles . the rectangular patio will be rearranged so that there will be 2 fewer columns of tiles and 4 more rows of tiles . after the change in layout , the patio will still have 48 tiles , and it will still be rectangular . how many rows are in the tile patio before the change in layout ? The options are: a ) 5 , b ) 6 , c ) 10 , d ) 13 , e ) 28","[1, 1, 1, 1]",4
110,Math,"a can do a work in 6 days , b can do a work in 8 days and c can do it in 12 days . b left work after 5 days . for how many number of days should a and c should work together to complete the remaining work ? The options are: a ) 1 / 2 , b ) 2 / 3 , c ) 3 / 4 , d ) 4 / 3 , e ) 5 / 2",0,0
111,Math,"two trains , one from howrah to patna and the other from patna to howrah , start simultaneously . after they meet , the trains reach their destinations after 9 hours and 16 hours respectively . the ratio of their speeds is The options are: a ) 4 : 9 , b ) 4 : 3 , c ) 4 : 12 , d ) 4 : 8 , e ) 4 : 5",0,0
112,Math,"if 8 gallons of gasoline are added to a tank that is already filled to 3 / 4 of its capacity , the tank is then filled to 9 / 10 of its capacity . how many gallons does the tank hold ? The options are: a ) 20 , b ) 24 , c ) 36 , d ) 48 , e ) 60",[1],1
113,Math,Dimitri eats 3 burgers per day. Each burger has a total of 20 calories. How many calories will he get after two days?,0,0
114,Math,"what is the sum of all digits for the number 10 ^ 28 - 44 ? The options are: a ) 233 , b ) 245 , c ) 257 , d ) 270 , e ) 285","[1, 1, 1, 1, 1]",5
115,Math,"the average of 65 numbers is 40 . if two numbers , 83 and 30 are discarded , then the average of the remaining numbers is nearly The options are: a ) 28.32 , b ) 39 , c ) 38.78 , d ) 29 , e ) 39.47",[1],1
116,Math,"how many integers are divisible by 9 between 10 ! and 10 ! + 100 inclusive ? The options are: a ) 6 , b ) 7 , c ) 8 , d ) 9 , e ) 10","[1, 1, 1, 1]",4
117,Math,"how many positive integers less than 5,000 are evenly divisible by neither 15 nor 22 ? The options are: a ) 4,514 , b ) 4,475 , c ) 4,521 , d ) 4,428 , e ) 4,349","[1, 3, 1, 1]",6
118,Math,"if - 3 x + 5 y = 48 and 3 x - 2 y = 6 , what is the product of x and y ? The options are: a ) 252 , b ) 428 , c ) 464 . , d ) 200 , e ) 642",0,0
119,Math,44 seniors need to receive awards.  Each senior receives a picture frame that costs $20.  Each picture frame needs to be etched with the logo for an additional 20% cost per frame.  2 of the seniors will also receive pins that are $5.  1/4 of the seniors are officers and they will need to receive cords that are $12 each.  How much will be spent on the senior gifts?,0,0
120,Math,"how many numbers up to 300 and 700 are divisible by 2 , 3 and 7 both together ? The options are: a ) 9 , b ) 10 , c ) 11 , d ) 12 , e ) 13",0,0
121,Math,"if 0.3 of a number is equal to 0.06 of another number , the ratio of the numbers i The options are: a ) 3 : 15 , b ) 1 : 2 , c ) 3 : 20 , d ) 20 : 3 , e ) none","[3, 1]",4
