,CaseID,Category,Question,Correct Answer,Raw COT Answer,Corrected COT Answer,Hallu Seq,raw_cot,corrected_cot
0,0,philosophy,"Feinberg claims that the story about Abraham Lincoln: The options are: A) provides some evidence for psychological egoism., B) provides some evidence against psychological egoism., C) provides no evidence for or against psychological egoism., D) actually involves a confusion between ethical egoism and psychological egoism.",b,a,a,"['NO', 'NO', 'NO', 'NO', 'NO']","Step 1: Understand the concepts involved. Psychological egoism is the theory that people always act in their own self-interest, even when they appear to be acting altruistically. Ethical egoism, on the other hand, is the normative ethical theory that suggests individuals should act in their own self-interest.
Step 2: Recall the story about Abraham Lincoln, which involves him stopping to help piglets stuck in a mud pit, despite being late for an important engagement. Lincoln reportedly said he did it to avoid feeling bad about not helping.
Step 3: Analyze the story in the context of psychological egoism. Lincoln's actions could be seen as self-interested because he helped the piglets to avoid feeling bad about himself, which aligns with the theory of psychological egoism.
Step 4: Consider the options given in light of the analysis. The story does not confuse psychological egoism with ethical egoism, as it does not discuss what Lincoln should do, but rather why he did it (his motivations).
Step 5: Determine the relevance of the story to psychological egoism. Since the story illustrates a case where an action that appears altruistic is motivated by self-interest, it provides some evidence for psychological egoism.","Step 1: Understand the concepts involved. Psychological egoism is the theory that people always act in their own self-interest, even when they appear to be acting altruistically. Ethical egoism, on the other hand, is the normative ethical theory that suggests individuals should act in their own self-interest.
Step 2: Recall the story about Abraham Lincoln, which involves him stopping to help piglets stuck in a mud pit, despite being late for an important engagement. Lincoln reportedly said he did it to avoid feeling bad about not helping.
Step 3: Analyze the story in the context of psychological egoism. Lincoln's actions could be seen as self-interested because he helped the piglets to avoid feeling bad about himself, which aligns with the theory of psychological egoism.
Step 4: Consider the options given in light of the analysis. The story does not confuse psychological egoism with ethical egoism, as it does not discuss what Lincoln should do, but rather why he did it (his motivations).
Step 5: Determine the relevance of the story to psychological egoism. Since the story illustrates a case where an action that appears altruistic is motivated by self-interest, it provides some evidence for psychological egoism."
1,1,philosophy,"According to Bentham, considerations of pain and pleasure determine: The options are: A) what we ought to do., B) what we will do., C) both a and b., D) neither a nor b.",c,c,c,"['NO', 'NO', 'NO', 'NO', 'NO']","Step 1: Understand the philosophical perspective of Jeremy Bentham. Bentham is a key figure in the development of utilitarianism, a theory in ethics that suggests the best action is the one that maximizes utility, usually defined as that which produces the greatest well-being of the greatest number of people.
Step 2: Recognize the role of pain and pleasure in Bentham's utilitarianism. For Bentham, the principle of utility is an ethical principle that approves or disapproves of every action whatsoever, according to the tendency it appears to have to augment or diminish the happiness of the party whose interest is in question.
Step 3: Analyze the options in the context of Bentham's philosophy. Option A suggests that considerations of pain and pleasure determine what we ought to do. This aligns with Bentham's utilitarian principle, which uses the balance of pleasure over pain to determine the moral rightness of an action.
Step 4: Consider option B, which suggests that considerations of pain and pleasure determine what we will do. While Bentham's theory is normative, focusing on what we ought to do, it also acknowledges human nature's tendency to seek pleasure and avoid pain, which influences behavior.
Step 5: Conclude that both A and B are correct in the context of Bentham's philosophy. Considerations of pain and pleasure not only guide moral decisions about what we ought to do (as per utilitarian ethics) but also influence human behavior in practice, reflecting what we will do.","Step 1: Understand the philosophical perspective of Jeremy Bentham. Bentham is a key figure in the development of utilitarianism, a theory in ethics that suggests the best action is the one that maximizes utility, usually defined as that which produces the greatest well-being of the greatest number of people.
Step 2: Recognize the role of pain and pleasure in Bentham's utilitarianism. For Bentham, the principle of utility is an ethical principle that approves or disapproves of every action whatsoever, according to the tendency it appears to have to augment or diminish the happiness of the party whose interest is in question.
Step 3: Analyze the options in the context of Bentham's philosophy. Option A suggests that considerations of pain and pleasure determine what we ought to do. This aligns with Bentham's utilitarian principle, which uses the balance of pleasure over pain to determine the moral rightness of an action.
Step 4: Consider option B, which suggests that considerations of pain and pleasure determine what we will do. While Bentham's theory is normative, focusing on what we ought to do, it also acknowledges human nature's tendency to seek pleasure and avoid pain, which influences behavior.
Step 5: Conclude that both A and B are correct in the context of Bentham's philosophy. Considerations of pain and pleasure not only guide moral decisions about what we ought to do (as per utilitarian ethics) but also influence human behavior in practice, reflecting what we will do."
2,2,philosophy,"Butler claims that, strictly speaking, the only thing that anyone has a right to is: The options are: A) life., B) liberty., C) property., D) happiness.",d,"the question seems to be based on a misunderstanding or misattribution of philosophical ideas to butler, as his work does not directly address these rights in the manner suggested.","the question seems to be based on a misunderstanding or misattribution of philosophical ideas to butler, as his work does not directly address these rights in the manner suggested.","['NO', 'NO', 'NO', 'NO', 'NO', 'NO', 'NO']","Step 1: Understand the question, which is about identifying what Butler claims is the only thing anyone has a right to.
Step 2: Recall Joseph Butler's philosophical views. Butler was an 18th-century philosopher and bishop known for his ethical writings and sermons. His work often focused on human nature, morality, and the role of conscience.
Step 3: Review Butler's key ideas to find any direct reference to rights. Butler's philosophy does not directly align with the later development of rights as understood in the context of life, liberty, property, or happiness in the same way as, for example, John Locke or the framers of the U.S. Declaration of Independence.
Step 4: Given the lack of a direct match between Butler's philosophical discussions and the options provided, consider the broader context of ethical and philosophical discussions about rights during and after Butler's time.
Step 5: Recall that the concept of 'rights' to life, liberty, property, and happiness are more closely associated with the works of other philosophers like John Locke (life, liberty, and property) and the U.S. Declaration of Independence (life, liberty, and the pursuit of happiness).
Step 6: Since the question specifically asks about Butler's claim, and given Butler's focus on moral behavior and the role of conscience rather than explicit rights to life, liberty, property, or happiness, it's challenging to directly attribute any of these rights specifically to Butler without more context.
Step 7: Without a clear connection between Butler's philosophical writings and the options provided, the question might be based on a misunderstanding or misattribution of philosophical ideas.","Step 1: Understand the question, which is about identifying what Butler claims is the only thing anyone has a right to.
Step 2: Recall Joseph Butler's philosophical views. Butler was an 18th-century philosopher and bishop known for his ethical writings and sermons. His work often focused on human nature, morality, and the role of conscience.
Step 3: Review Butler's key ideas to find any direct reference to rights. Butler's philosophy does not directly align with the later development of rights as understood in the context of life, liberty, property, or happiness in the same way as, for example, John Locke or the framers of the U.S. Declaration of Independence.
Step 4: Given the lack of a direct match between Butler's philosophical discussions and the options provided, consider the broader context of ethical and philosophical discussions about rights during and after Butler's time.
Step 5: Recall that the concept of 'rights' to life, liberty, property, and happiness are more closely associated with the works of other philosophers like John Locke (life, liberty, and property) and the U.S. Declaration of Independence (life, liberty, and the pursuit of happiness).
Step 6: Since the question specifically asks about Butler's claim, and given Butler's focus on moral behavior and the role of conscience rather than explicit rights to life, liberty, property, or happiness, it's challenging to directly attribute any of these rights specifically to Butler without more context.
Step 7: Without a clear connection between Butler's philosophical writings and the options provided, the question might be based on a misunderstanding or misattribution of philosophical ideas."
3,3,philosophy,"Epictetus claims that if the wife and children of a virtuous man were to die, he should feel: The options are: A) righteous indignation., B) moderate grief., C) undisturbed., D) envy of those who still have their loved ones.",c,c,c,"['NO', 'NO', 'NO', 'NO', 'NO', 'NO', 'NO']","Step 1: Understand the philosophical background of Epictetus. Epictetus was a Stoic philosopher. Stoicism teaches the development of self-control and fortitude as a means of overcoming destructive emotions. Step 2: Consider the Stoic view on external events. Stoics believe that external events are beyond our control and should not disturb our inner peace. Step 3: Reflect on the Stoic approach to emotions. Stoics aim to maintain a state of tranquility and are encouraged to accept whatever happens with equanimity. Step 4: Analyze the options in light of Stoic philosophy. A) Righteous indignation would imply a judgment that something unjust has occurred, which is contrary to accepting events as they are. B) Moderate grief acknowledges human emotions but suggests they should be kept in check, aligning with Stoic moderation. C) Being undisturbed is the ideal Stoic response, reflecting acceptance and inner peace despite external events. D) Envy of others goes against Stoic teachings of focusing on what is within one's control and maintaining equanimity. Step 5: Conclude which option best aligns with Stoic philosophy and Epictetus's teachings. While Stoicism acknowledges the naturalness of emotions, it emphasizes not being controlled by them and maintaining inner peace.","Step 1: To accurately address the question regarding Epictetus's claim that if the wife and children of a virtuous man were to die, he should feel moderate grief, it is essential to understand Epictetus's Stoic philosophy. Stoicism advocates for self-control and emotional resilience, suggesting that a virtuous man would likely experience moderate grief. This response reflects a balanced emotional state that is in line with Stoic principles of not allowing emotions to overwhelm oneself while also not completely suppressing them. *<verified>*
Step 2: Epictetus, as a Stoic philosopher, emphasizes the importance of focusing on what is within our control and accepting what is not. The death of loved ones is beyond one's control, and thus, a Stoic response would be to accept this fact without letting it disturb one's peace of mind excessively.
Step 3: According to Stoicism, experiencing emotions such as grief is natural, but one should not allow these emotions to dominate their reason or disrupt their ability to live according to virtue. Therefore, a virtuous man would aim to manage his grief in a way that is rational and aligned with Stoic values.
Step 4: The option of righteous indignation (A) would imply a sense of moral outrage, which does not align with the Stoic acceptance of events beyond one's control. Thus, this option is inconsistent with Epictetus's teachings.
Step 5: The option of undisturbed (C) suggests a complete lack of emotional response, which, while seemingly Stoic, actually contradicts the Stoic acknowledgment of natural emotions. Stoics do not advocate for emotional suppression to the point of apathy but rather for emotional regulation.
Step 6: The option of envy (D) of those who still have their loved ones is contrary to Stoic principles, as it involves desiring something outside one's control and fostering negative emotions towards others' fortunes, which Stoicism advises against.
Step 7: Given the Stoic philosophy's emphasis on moderation and rational control of emotions, the most appropriate response for a virtuous man, as per Epictetus, would be to experience moderate grief (B). This option best reflects the Stoic balance between acknowledging natural emotions and maintaining virtue and reason."
4,4,philosophy,"Nussbaum claims that at the first stage of ethical inquiry, terms for the virtues should be: The options are: A) as descriptive as possible., B) those that are conventionally used., C) neutral between competing specifications of the virtue., D) none of the above.",c,a,c,"['NO', 'NO', 'NO', 'NO', 'NO', 'NO', 'NO', 'NO']","Step 1: Understand the question, which is about Nussbaum's view on the initial stage of ethical inquiry, specifically regarding how terms for virtues should be characterized.
Step 2: Recall Nussbaum's approach to ethics, which is heavily influenced by Aristotle and emphasizes the complexity and context-dependency of ethical virtues.
Step 3: Consider the options given. A descriptive approach (Option A) aligns with the need to capture the nuanced and context-dependent nature of virtues in ethical inquiry.
Step 4: Reflect on the importance of being as descriptive as possible in the initial stages of ethical inquiry. This allows for a more nuanced understanding and avoids premature narrowing of the concept's scope.
Step 5: Evaluate the other options in light of Nussbaum's emphasis on the rich, detailed understanding of virtues. Using conventionally used terms (Option B) might not capture the nuances Nussbaum advocates for. Being neutral between competing specifications (Option C) could be too vague for the initial detailed exploration Nussbaum suggests.
Step 6: Conclude that being as descriptive as possible (Option A) best aligns with Nussbaum's approach to the initial stage of ethical inquiry, as it allows for a rich, detailed exploration of virtues.","Step 1: Understand the question, which is about Nussbaum's view on the initial stage of ethical inquiry, specifically regarding how terms for virtues should be characterized. The options given are A) as descriptive as possible, B) those that are conventionally used, C) neutral between competing specifications of the virtue, D) none of the above. The task is to identify which option correctly reflects Nussbaum's stance. *<verified>*
Step 2: Recall Nussbaum's approach to ethics, which emphasizes the complexity of human life and the importance of context in ethical discussions. *<verified>*
Step 3: Consider that Nussbaum often critiques the idea of using overly rigid or predefined terms in ethical inquiry, suggesting a preference for flexibility and adaptability in understanding virtues. *<verified>*
Step 4: Analyze the options in light of Nussbaum's philosophy. Option A suggests descriptiveness, which aligns with the need for detailed understanding in ethical discussions. *<verified>*
Step 5: Option B, which suggests using conventional terms, might not fully capture the nuanced approach Nussbaum advocates, as it could limit the scope of inquiry to existing frameworks. *<verified>*
Step 6: Option C, being neutral between competing specifications, seems to resonate with Nussbaum's emphasis on acknowledging the complexity and variability of virtues, allowing for a more inclusive and adaptable approach. *<verified>*
Step 7: Option D, none of the above, would only be correct if none of the other options align with Nussbaum's views, which is not the case based on the analysis. *<verified>*
Step 8: Given Nussbaum's emphasis on the importance of context, flexibility, and a nuanced understanding of virtues, Option C appears to be the most aligned with her approach to the initial stage of ethical inquiry. *<verified>*"
5,5,philosophy,"Gauthier claims that there is nothing for practical rationality to be besides: The options are: A) moral justification., B) deliberative justification., C) epistemic justification., D) an illusion.",b,b,b,"['NO', 'NO', 'NO', 'NO', 'NO', 'NO', 'NO']","step 1: Understand the question, which is about Gauthier's view on practical rationality. 
step 2: Recall that David Gauthier is a philosopher known for his work in ethics and rational choice theory. 
step 3: Recognize that Gauthier's work often focuses on the concept of rationality in the context of social contracts and cooperation among rational agents. 
step 4: Understand that practical rationality refers to the reasoning process involved in making decisions that are effective in achieving one's goals. 
step 5: Recall that Gauthier's views on rationality are closely tied to the idea of cooperation and agreements among rational agents, rather than purely moral considerations. 
step 6: Note that moral justification refers to actions being right or wrong based on moral principles, which is not the sole focus of Gauthier's conception of practical rationality. 
step 7: Deliberative justification, on the other hand, involves reasoning about the best means to achieve one's ends, which aligns more closely with Gauthier's emphasis on rational cooperation and agreements. 
step 8: Epistemic justification and the idea of practical rationality being an illusion do not directly align with Gauthier's emphasis on rational cooperation for mutual benefit. 
step 9: Conclude that the option that best fits Gauthier's view on what practical rationality is, is 'deliberative justification', as it encompasses the reasoning process about the best means to achieve one's goals within the context of cooperation and agreements among rational agents.","Step 1: Understand the question, which is about Gauthier's view on practical rationality. *<verified>*
Step 2: Recall that David Gauthier is a philosopher known for his work in ethics and rational choice theory. To accurately address the question regarding Gauthier's view on practical rationality, it is essential to delve into his writings and arguments. This will enable us to determine which of the given options - (A) moral justification, (B) deliberative justification, (C) epistemic justification, or (D) an illusion - Gauthier advocates for. *<verified>*
Step 3: Remember that Gauthier is best known for his book 'Morals by Agreement', where he argues that individuals can derive moral principles from rational agreements that serve their self-interest. This suggests a connection between rationality and moral justification. *<verified>*
Step 4: Consider that Gauthier's emphasis on rational agreements for deriving moral principles indicates a strong link between practical rationality and the formulation of moral justifications. This is because these agreements are made in a practical context, where rationality guides individuals towards cooperation for mutual benefit. *<verified>*
Step 5: Note that while Gauthier discusses rational choice and its implications for ethics, his focus is not primarily on epistemic justification, which is more concerned with the justification of beliefs rather than actions or decisions. *<verified>*
Step 6: Acknowledge that Gauthier does not view practical rationality as merely an illusion. Instead, he sees it as a fundamental aspect of human interaction and cooperation, which can lead to the establishment of moral principles. *<verified>*
Step 7: Given Gauthier's emphasis on rational agreements leading to moral principles as discussed in 'Morals by Agreement', it is more accurate to conclude that Gauthier views practical rationality as being synonymous with moral justification. This is because the process of reaching rational agreements for mutual benefit inherently involves moral considerations. *<verified>*"
6,6,philosophy,"Wolf argues that the unattractiveness of the moral saint: The options are: A) gives us reason to abandon utilitarianism., B) gives us reason to abandon Kantianism., C) both a and b., D) neither a nor b.",d,d,d,"['NO', 'NO', 'NO', 'NO', 'NO']","Step 1: Understand the concept of the 'unattractiveness of the moral saint' as presented by Susan Wolf. Wolf argues that a moral saint, someone whose every action is as morally good as possible, might not be a very attractive human being in terms of personality, interests, and other human characteristics. This is because their life would be dominated by the pursuit of moral goodness to the exclusion of personal interests, hobbies, and perhaps even personal relationships.
Step 2: Analyze how this concept applies to utilitarianism. Utilitarianism is a moral theory that focuses on the outcomes of actions, specifically aiming to maximize overall happiness or utility. A moral saint, from a utilitarian perspective, would constantly strive to maximize happiness for the greatest number of people, potentially at the cost of their own personal well-being or interests.
Step 3: Analyze how this concept applies to Kantianism. Kantianism, based on the moral philosophy of Immanuel Kant, emphasizes duty, moral laws, and the categorical imperative. A moral saint, in the Kantian sense, would act out of duty and adhere strictly to moral laws, possibly leading to a similar neglect of personal interests and well-being.
Step 4: Consider Wolf's argument in the context of the options provided. Wolf's critique is not specifically aimed at utilitarianism or Kantianism but rather at the idea of moral sainthood itself and its implications for what it means to live a good life. Her argument suggests that the concept of a moral saint is unattractive because it leads to a one-dimensional life, not necessarily because of the flaws in utilitarianism or Kantianism per se.
Step 5: Choose the best option based on the analysis. Since Wolf's argument is about the broader concept of moral sainthood and its implications for living a well-rounded life, rather than a direct critique of utilitarianism or Kantianism, the best option is 'D) neither a nor b.'","Step 1: Understand the concept of the 'unattractiveness of the moral saint' as presented by Susan Wolf. Wolf argues that a moral saint, someone whose every action is as morally good as possible, might not be a very attractive human being in terms of personality, interests, and other human characteristics. This is because their life would be dominated by the pursuit of moral goodness to the exclusion of personal interests, hobbies, and perhaps even personal relationships.
Step 2: Analyze how this concept applies to utilitarianism. Utilitarianism is a moral theory that focuses on the outcomes of actions, specifically aiming to maximize overall happiness or utility. A moral saint, from a utilitarian perspective, would constantly strive to maximize happiness for the greatest number of people, potentially at the cost of their own personal well-being or interests.
Step 3: Analyze how this concept applies to Kantianism. Kantianism, based on the moral philosophy of Immanuel Kant, emphasizes duty, moral laws, and the categorical imperative. A moral saint, in the Kantian sense, would act out of duty and adhere strictly to moral laws, possibly leading to a similar neglect of personal interests and well-being.
Step 4: Consider Wolf's argument in the context of the options provided. Wolf's critique is not specifically aimed at utilitarianism or Kantianism but rather at the idea of moral sainthood itself and its implications for what it means to live a good life. Her argument suggests that the concept of a moral saint is unattractive because it leads to a one-dimensional life, not necessarily because of the flaws in utilitarianism or Kantianism per se.
Step 5: Choose the best option based on the analysis. Since Wolf's argument is about the broader concept of moral sainthood and its implications for living a well-rounded life, rather than a direct critique of utilitarianism or Kantianism, the best option is 'D) neither a nor b.'"
