,CaseID,Category,Question,Correct Answer,Raw COT Answer,Corrected COT Answer,Hallu Seq,raw_cot,corrected_cot
36,36,college_chemistry,"Nitronyl nitroxides are stable radicals in which the unpaired electron is coupled to two equivalent nitrogen nuclei. How many lines will appear in the EPR spectrum of a solution of a rigid nitronyl nitroxide diradical with J >> a? The options are: A) 3 lines, B) 9 lines, C) 5 lines, D) 7 lines",d,c,a,"['NO', 'NO', 'NO', 'NO', 'NO', 'NO', 'NO', 'NO', 'NO', 'NO', 'NO', 'NO']","Step 1: Understand the question. We are dealing with a nitronyl nitroxide diradical, which means there are two unpaired electrons, each coupled to two equivalent nitrogen nuclei. The condition J >> a indicates that the exchange interaction (J) is much larger than the hyperfine coupling constant (a), suggesting that the two unpaired electrons are strongly coupled to each other.
Step 2: Recall the formula for calculating the number of lines in an EPR spectrum due to hyperfine splitting, which is 2nI + 1, where n is the number of equivalent nuclei coupled to the unpaired electron, and I is the spin of the nuclei. For nitrogen, I = 1.
Step 3: Since the diradical is strongly coupled (J >> a), we treat the two unpaired electrons as a single entity. This means we consider the coupling of this entity to the four nitrogen nuclei (two from each radical part).
Step 4: However, because the electrons are strongly coupled, the hyperfine splitting due to each nitrogen nucleus will be the same for both electrons, effectively making the nitrogen nuclei equivalent in terms of EPR spectroscopy.
Step 5: Therefore, we calculate the number of lines as if there were two equivalent sets of nitrogen nuclei, each set containing two nuclei. This means n = 2 (for two sets of equivalent nuclei) and I = 1.
Step 6: Apply the formula 2nI + 1 with n = 2 and I = 1, which gives us 2*2*1 + 1 = 5 lines.","Step 1: Understand the question. We are dealing with a nitronyl nitroxide diradical, which means there are two unpaired electrons, each coupled to two equivalent nitrogen nuclei. The condition J >> a indicates that the exchange interaction (J) is much larger than the hyperfine coupling constant (a), suggesting that the two unpaired electrons are strongly coupled to each other. *<verified>*
Step 2: Recall the formula for calculating the number of lines in an EPR spectrum due to hyperfine splitting, which is 2nI + 1, where n is the number of equivalent nuclei coupled to the unpaired electron, and I is the spin of the nuclei. For nitrogen, I = 1. *<verified>*
Step 3: Since the diradical is strongly coupled (J >> a), we treat the two unpaired electrons as a single entity. This means we consider the coupling of this entity to the four nitrogen nuclei (two from each radical part). Applying the formula for calculating the number of lines in an EPR spectrum due to hyperfine splitting, which is 2nI + 1, where n is the number of equivalent nuclei coupled to the unpaired electron(s), and I is the spin of the nuclei, we get 2(4)(1) + 1 = 9 lines. *<verified>*
Step 4: However, it's important to consider the effect of strong coupling (J >> a) on the EPR spectrum. In such cases, the individual hyperfine interactions can merge, leading to a simplified spectrum. This is because the strong exchange interaction effectively averages out the hyperfine interactions over the molecule.
Step 5: Given the strong coupling, the EPR spectrum will not simply reflect the hyperfine interactions as if the electrons were independent. Instead, the spectrum will be dominated by the overall magnetic behavior of the coupled system.
Step 6: Therefore, the calculation in Step 3 might overestimate the number of lines if it assumes independent hyperfine interactions without considering the effect of strong coupling.
Step 7: Re-evaluating the situation, we should consider the strong coupling leading to a single spin system. This simplifies the calculation, as we no longer treat the electrons as independently interacting with the nitrogen nuclei.
Step 8: Given this, the correct approach is to consider the total spin system as a whole. However, the initial calculation directly applied the formula without adjusting for the strong coupling effect, which would simplify the spectrum.
Step 9: The correct interpretation under strong coupling (J >> a) would lead to a spectrum that reflects the overall behavior of the coupled system rather than individual interactions. This could result in fewer lines than calculated by simply applying the formula.
Step 10: Unfortunately, without further specific details on how the strong coupling modifies the hyperfine interactions in this particular case, we cannot directly calculate the exact number of lines. However, the reasoning suggests that the number might be less than the 9 lines calculated in Step 3.
Step 11: Considering the options provided and the effect of strong coupling, the most likely answer would be fewer lines than the 9 calculated, suggesting that the correct answer would be one of the options with fewer lines than 9.
Step 12: Among the options provided, the only ones with fewer lines than 9 are 3 lines (A), 5 lines (C), and 7 lines (D). Given the strong coupling effect and the simplification it causes, the most logical choice would be 3 lines (A), as it represents a significant simplification of the spectrum due to strong coupling."
37,37,college_chemistry,"The magnetic moment (μI) of an unknown nuclide is 2.884 x 10^-27 J T-1. Given the nuclear spin is known to be 1, identify the unknown nuclide. The options are: A) 14N, B) 2H, C) 19F, D) 6Li",b,b,d,"['NO', 'NO', 'NO', 'NO', 'NO', 'NO', 'NO']","Step 1: Recall the formula for the magnetic moment of a nucleus, which is given by μI = gI ∙ μN ∙ I, where μI is the magnetic moment, gI is the g-factor (or gyromagnetic ratio) for the nucleus, μN is the nuclear magneton (5.050783699 × 10^-27 J T^-1), and I is the nuclear spin.
Step 2: Given that I = 1 for the unknown nuclide, we can simplify the formula to μI = gI ∙ μN. This means we can calculate the g-factor for the unknown nuclide using the given magnetic moment and the value of the nuclear magneton.
Step 3: Rearrange the formula to solve for gI, which gives gI = μI / μN.
Step 4: Substitute the given values into the formula: gI = (2.884 × 10^-27 J T^-1) / (5.050783699 × 10^-27 J T^-1).
Step 5: Calculate gI, which gives gI = 0.571.
Step 6: Compare the calculated g-factor with known g-factors for the given options. The g-factor is a unique property of each nuclide, so the nuclide with a g-factor closest to the calculated value is the unknown nuclide.
Step 7: Known g-factors for the options are approximately: A) 14N: 0.403, B) 2H: 0.857, C) 19F: 5.257, D) 6Li: -0.822. The g-factor closest to the calculated value of 0.571 is for 2H (Deuterium).
Step 8: Therefore, the unknown nuclide is most likely 2H, given its g-factor is closest to the calculated value.","Step 1: Recall the formula for the magnetic moment of a nucleus, which is given by μI = gI ⋅ μN ⋅ I, where μI is the magnetic moment, gI is the g-factor (or gyromagnetic ratio) for the nucleus, μN is the nuclear magneton (5.050783699 × 10^-27 J T^-1), and I is the nuclear spin. *<verified>*
Step 2: Given that I = 1 for the unknown nuclide, the formula remains μI = gI ⋅ μN ⋅ I. Since I = 1, this does not change the calculation but is important to include for completeness and accuracy. This means we can calculate the g-factor for the unknown nuclide using the given magnetic moment and the value of the nuclear magneton. *<verified>*
Step 3: Substitute the given values into the formula to find the g-factor. The magnetic moment (μI) is given as 2.884 x 10^-27 J T^-1, and the nuclear magneton (μN) is 5.050783699 × 10^-27 J T^-1. Using the formula μI = gI ⋅ μN ⋅ I, we can rearrange to solve for gI: gI = μI / (μN ⋅ I).
Step 4: Plug in the values: gI = (2.884 x 10^-27) / (5.050783699 × 10^-27 ⋅ 1) = 0.571.
Step 5: Now that we have the g-factor (gI) for the unknown nuclide, we can compare this value with known g-factors for the given options. The g-factors for the nuclides are as follows: 14N has a g-factor of approximately 0.403, 2H (Deuterium) has a g-factor of approximately 0.857, 19F has a g-factor of approximately 5.257, and 6Li has a g-factor of approximately 0.822.
Step 6: Comparing the calculated g-factor (0.571) with the known g-factors, it is clear that none of the given options exactly match the calculated value. However, the closest match is 6Li, which has a g-factor of approximately 0.822. Considering the precision and possible experimental errors in measuring magnetic moments, 6Li is the closest match among the given options.
Step 7: Therefore, based on the closest g-factor comparison, the unknown nuclide is most likely 6Li."
38,38,college_chemistry,"Which of the following is a true statement about optical isomerism of complexes containing achiral ligands? The options are: A) Square planar complexes can display optical isomerism only if all four ligands are identical., B) Tetrahedral complexes never display optical isomerism., C) Linear complexes can display optical isomerism when both ligands are different., D) Octahedral complexes of monodentate ligands can display optical isomerism only when they have at least three different ligands.",d,d,none of the options accurately describe the conditions for optical isomerism in complexes with achiral ligands.,"['NO', 'NO', 'NO', 'NO', 'NO', 'NO']","Step 1: Understand what optical isomerism means. Optical isomerism occurs when a molecule has a non-superimposable mirror image, also known as a chiral molecule. This property allows the molecule to rotate plane-polarized light, which is the basis of optical activity.
Step 2: Analyze option A. Square planar complexes can indeed display optical isomerism, but not only when all four ligands are identical. In fact, having all identical ligands would make it impossible for the complex to be chiral, as there would be no way to create a non-superimposable mirror image. Thus, option A is incorrect.
Step 3: Consider option B. Tetrahedral complexes can display optical isomerism if they have four different ligands, creating a chiral center. Therefore, the statement that tetrahedral complexes never display optical isomerism is incorrect.
Step 4: Evaluate option C. Linear complexes, by definition, cannot display optical isomerism because they do not have a center of chirality. The spatial arrangement of only two ligands, regardless of their identity, does not allow for non-superimposable mirror images. Thus, option C is incorrect.
Step 5: Examine option D. Octahedral complexes with monodentate ligands can display optical isomerism, but not only when they have at least three different ligands. In fact, an octahedral complex can exhibit optical isomerism with as few as two types of ligands, provided they are arranged in such a way as to create a non-superimposable mirror image (e.g., cis-trans isomerism in octahedral complexes). However, the statement is somewhat misleading because it suggests a minimum requirement that isn't strictly true for optical isomerism. The more accurate condition would involve specific arrangements of ligands rather than just their count. However, among the given options and considering the general understanding of optical isomerism in coordination chemistry, option D is the closest to a true statement, albeit with nuances not fully captured in the option.","Step 1: Understand what optical isomerism means. Optical isomerism occurs when a molecule has a non-superimposable mirror image, also known as a chiral molecule. This property allows the molecule to rotate plane-polarized light, which is the basis of optical activity. *<verified>*
Step 2: Analyze option A. Square planar complexes generally do not display optical isomerism because they lack a chiral center, making it impossible for them to have non-superimposable mirror images. Thus, option A is incorrect as it suggests that square planar complexes can display optical isomerism only if all four ligands are identical, which misrepresents the nature of optical isomerism in such complexes. *<verified>*
Step 3: Consider option B. Tetrahedral complexes can display optical isomerism if they have four different ligands, creating a chiral center. This contradicts the statement in option B that tetrahedral complexes never display optical isomerism, making option B incorrect.
Step 4: Evaluate option C. Linear complexes, by definition, cannot be chiral because they do not have a center of asymmetry; they are symmetrical along the axis connecting the two ligands. Therefore, option C is incorrect as it suggests linear complexes can display optical isomerism when both ligands are different, which is not possible due to their inherent symmetry.
Step 5: Examine option D. Octahedral complexes with monodentate ligands can display optical isomerism, but they do not require at least three different ligands to do so. They can exhibit optical isomerism with just two types of ligands arranged in a way that creates a non-superimposable mirror image. Therefore, option D is also incorrect because it inaccurately states the conditions under which octahedral complexes can exhibit optical isomerism.
Step 6: After analyzing all options, it's clear that none of the statements provided accurately describe the conditions under which optical isomerism occurs in complexes containing achiral ligands. Each option contains a fundamental misunderstanding or misrepresentation of how optical isomerism can be exhibited in different types of complexes."
39,39,college_chemistry,"The 99Ru chemical shift of [Ru(H2O)6]2+ is 16,050 ppm relative to [Ru(CN)6]2- at 0 ppm. The electronic excitation energies of [Ru(H2O)6]2+, [Ru(CN)6]2- and [Ru(NH3)6]2+ are 18,900, 40,000 and 25,600 cm-1 respectively. Assuming that the chemical shift differences are dominated by paramagnetic currents, determine the chemical shift of [Ru(NH3)6]2+. The options are: A) 7,530 ppm, B) 8,090 ppm, C) 11,070 ppm, D) 14,840 ppm",b,c,"the steps provided do not include the specific calculations needed to arrive at a final answer. to complete the thought process, detailed calculations based on the inverse square values and ratios mentioned in steps 8, 9, and 10 are required. without these calculations, a final answer cannot be accurately determined.","['NO', 'NO', 'NO', 'NO', 'NO', 'NO', 'NO', 'NO', 'NO', 'NO', 'NO', 'NO']","step 1: Understand that the chemical shift differences are assumed to be dominated by paramagnetic currents, which are inversely proportional to the square of the electronic excitation energy (E). This means we can use the formula Δσ ∝ 1/E^2 to compare the chemical shifts of different complexes.
step 2: Calculate the inverse square of the electronic excitation energy for [Ru(H2O)6]2+ using its given energy of 18,900 cm-1. This is (1/(18,900)^2).
step 3: Calculate the inverse square of the electronic excitation energy for [Ru(CN)6]2- using its given energy of 40,000 cm-1. This is (1/(40,000)^2).
step 4: Calculate the inverse square of the electronic excitation energy for [Ru(NH3)6]2+ using its given energy of 25,600 cm-1. This is (1/(25,600)^2).
step 5: Determine the ratio of the inverse squares for [Ru(H2O)6]2+ and [Ru(CN)6]2-. This ratio will be used as a reference to calculate the chemical shift of [Ru(NH3)6]2+.
step 6: Calculate the ratio of the inverse squares for [Ru(NH3)6]2+ and [Ru(CN)6]2-. This will give us the relative chemical shift difference between [Ru(NH3)6]2+ and [Ru(CN)6]2-.
step 7: Use the ratio from step 5 and the known chemical shift of [Ru(H2O)6]2+ (16,050 ppm) to determine the chemical shift of [Ru(NH3)6]2+ relative to [Ru(CN)6]2-.
step 8: Apply the calculated ratios to find the chemical shift of [Ru(NH3)6]2+.","Step 1: Understand that the chemical shift differences are assumed to be dominated by paramagnetic currents, which are inversely proportional to the square of the electronic excitation energy (E). This means we can use the formula Δσ ∝ 1/E^2 to compare the chemical shifts of different complexes. *<verified>*
Step 2: Calculate the inverse square of the electronic excitation energy for [Ru(H2O)6]2+ using its given energy of 18,900 cm-1. This is (1/(18,900)^2). *<verified>*
Step 3: Calculate the inverse square of the electronic excitation energy for [Ru(CN)6]2- using its given energy of 40,000 cm-1. This is (1/(40,000)^2). *<verified>*
Step 4: Calculate the inverse square of the electronic excitation energy for [Ru(NH3)6]2+ using its given energy of 25,600 cm-1. This is (1/(25,600)^2). *<verified>*
Step 5: Determine the ratio of the inverse squares for [Ru(H2O)6]2+ and [Ru(CN)6]2-. This ratio will be used as a reference to calculate the chemical shift of [Ru(NH3)6]2+. *<verified>*
Step 6: Calculate the ratio of the inverse squares for [Ru(NH3)6]2+ and [Ru(CN)6]2-. This will give us the relative chemical shift difference between [Ru(NH3)6]2+ and [Ru(CN)6]2-. *<verified>*
Step 7: Use the ratio from step 5 and the known chemical shift of [Ru(H2O)6]2+ (16,050 ppm) to determine the chemical shift of [Ru(NH3)6]2+ relative to [Ru(CN)6]2-. *<verified>*
Step 8: Calculate the inverse square values from steps 2, 3, and 4. *<verified>*
Step 9: Calculate the ratio of inverse squares for [Ru(H2O)6]2+ and [Ru(CN)6]2- from step 5. *<verified>*
Step 10: Calculate the ratio of inverse squares for [Ru(NH3)6]2+ and [Ru(CN)6]2- from step 6. *<verified>*
Step 11: Apply the ratio from step 10 to the known chemical shift of [Ru(H2O)6]2+ to find the chemical shift of [Ru(NH3)6]2+. This involves multiplying the ratio from step 10 by the chemical shift difference (16,050 ppm) between [Ru(H2O)6]2+ and [Ru(CN)6]2-. *<verified>*
Step 12: After calculating the chemical shift of [Ru(NH3)6]2+ in step 11, compare the result with the given options to find the correct answer."
40,40,college_chemistry,"Calculate the equilibrium polarization of 13C nuclei in a 20.0 T magnetic field at 300 K. The options are: A) 10.8 x 10^-5, B) 4.11 x 10^-5, C) 3.43 x 10^-5, D) 1.71 x 10^-5",d,d,d,"['NO', 'NO', 'NO', 'NO', 'NO', 'NO', 'NO', 'NO', 'NO', 'NO', 'NO', 'NO']","Step 1: Understand that the equilibrium polarization of nuclei in a magnetic field is given by the Boltzmann distribution. The polarization is the difference in population between the lower and higher energy states divided by the total population. 
Step 2: The energy difference (ΔE) between the two spin states in a magnetic field is given by ΔE = γhB, where γ is the gyromagnetic ratio for 13C (10.71 x 10^7 rad s^-1 T^-1), h is Planck's constant (6.626 x 10^-34 J s), and B is the magnetic field strength (20.0 T). 
Step 3: Calculate ΔE using the values from step 2: ΔE = 10.71 x 10^7 rad s^-1 T^-1 * 6.626 x 10^-34 J s * 20.0 T = 1.42 x 10^-25 J. 
Step 4: The Boltzmann factor, which gives the ratio of populations in the two energy levels, is given by exp(-ΔE/kT), where k is the Boltzmann constant (1.38 x 10^-23 J/K) and T is the temperature (300 K). 
Step 5: Calculate the Boltzmann factor: exp(-1.42 x 10^-25 J / (1.38 x 10^-23 J/K * 300 K)) = exp(-0.0343) ≈ 0.966. 
Step 6: The polarization is given by (N_high - N_low) / (N_high + N_low), where N_high and N_low are the populations of the higher and lower energy states, respectively. Since the Boltzmann factor is the ratio of N_low to N_high, we can express polarization as (1 - exp(-ΔE/kT)) / (1 + exp(-ΔE/kT)). 
Step 7: Substitute the Boltzmann factor calculated in step 5 into the polarization formula: (1 - 0.966) / (1 + 0.966) = 0.034 / 1.966 ≈ 0.0173. 
Step 8: Realize that the polarization calculated in step 7 is the fraction of the total population, to convert it to a percentage we multiply by 100. 
Step 9: The final polarization percentage is 0.0173 * 100 = 1.73 x 10^-2 or 1.73%.","Step 1: Understand that the equilibrium polarization of nuclei in a magnetic field is given by the Boltzmann distribution. The polarization is the difference in population between the lower and higher energy states divided by the total population. *<verified>*
Step 2: The energy difference (ΔE) between the two spin states in a magnetic field is given by ΔE = γhB, where γ is the gyromagnetic ratio for 13C (10.71 x 10^7 rad s^-1 T^-1), h is Planck's constant (6.626 x 10^-34 J s), and B is the magnetic field strength (20.0 T). *<verified>*
Step 3: Calculate ΔE using the values from Step 2. ΔE = γhB = (10.71 x 10^7 rad s^-1 T^-1) * (6.626 x 10^-34 J s) * (20.0 T) = 1.42 x 10^-25 J *<verified>*
Step 4: The Boltzmann factor, which gives the ratio of populations in the two energy states, is given by exp(-ΔE/kT), where k is the Boltzmann constant (1.38 x 10^-23 J/K) and T is the temperature (300 K). *<verified>*
Step 5: Calculate the Boltzmann factor using the ΔE from Step 3, k, and T. exp(-ΔE/kT) = exp(-1.42 x 10^-25 J / (1.38 x 10^-23 J/K * 300 K)) = exp(-0.0343). *<verified>*
Step 6: Approximate the value of exp(-0.0343) using a calculator or a mathematical software to find the Boltzmann factor. exp(-0.0343) ≈ 0.9664. *<verified>*
Step 7: The polarization is given by (1 - exp(-ΔE/kT))/(1 + exp(-ΔE/kT)). Substitute the Boltzmann factor from Step 6 into this formula. *<verified>*
Step 8: Calculate the polarization using the formula from Step 7. Polarization = (1 - 0.9664)/(1 + 0.9664) = 0.0172. To match the format of the answer options, convert this result into the same order of magnitude, resulting in a polarization of 1.72 x 10^-2. However, this still does not match any of the provided options, indicating a potential error in the calculation or understanding of the question.
Step 9: Realize the mistake in Step 8 involves a misunderstanding of the magnitude of polarization typically observed in NMR experiments. The polarization calculated as 1.72 x 10^-2 is the fraction of excess nuclei in the lower energy state, not the absolute polarization in terms of nuclear magnetization.
Step 10: Understand that the actual polarization in NMR is often much smaller and is given by the formula P = (γħB)/(2kT), where ħ (h-bar) is the reduced Planck's constant (ħ = h/2π).
Step 11: Calculate the actual polarization using the corrected formula from Step 10. P = (10.71 x 10^7 rad s^-1 T^-1 * 6.626 x 10^-34 J s / (2π))/(2 * 1.38 x 10^-23 J/K * 300 K) = 3.43 x 10^-5.
Step 12: Match the calculated polarization to the given options, finding that 3.43 x 10^-5 corresponds to option C."
41,41,college_chemistry,"What is the strength (B1) of a 13C 90° pulse of duration 1 μs? The options are: A) 3.72 mT, B) 5.18 mT, C) 17.0 mT, D) 23.3 mT",b,d,d,"['NO', 'NO', 'NO', 'NO', 'NO', 'NO', 'NO']","Step 1: Understand that the strength of a pulse in NMR (Nuclear Magnetic Resonance) can be calculated using the formula for the Larmor frequency, which is ω = γB, where ω is the angular frequency in radians per second, γ is the gyromagnetic ratio in radians per second per tesla, and B is the magnetic field strength in tesla.
Step 2: Recognize that for a 90° pulse, the pulse duration (τ) is related to the angular frequency by the equation ωτ = π/2, because a 90° pulse corresponds to a quarter of a full precession cycle (2π radians).
Step 3: Substitute the given pulse duration of 1 μs (1x10^-6 s) into the equation from step 2 to find the angular frequency. ω = (π/2) / (1x10^-6 s).
Step 4: Calculate the angular frequency, ω = (3.14159/2) / (1x10^-6 s) = 1.570795x10^6 radians/s.
Step 5: Use the gyromagnetic ratio for 13C, which is 67.2828 MHz/T or 67.2828x10^6 radians/s/T (since 1 MHz = 1x10^6 radians/s), to find the magnetic field strength B. Rearrange the Larmor frequency formula to B = ω / γ.
Step 6: Substitute the values for ω and γ into the equation to find B. B = 1.570795x10^6 radians/s / 67.2828x10^6 radians/s/T.
Step 7: Calculate the magnetic field strength, B = 0.02333 T.
Step 8: Convert the magnetic field strength from tesla to millitesla by multiplying by 1000 (since 1 T = 1000 mT). B = 0.02333 T * 1000 = 23.33 mT.","Step 1: To find the strength (B1) of a 13C 90° pulse of duration 1 μs, we need to consider the relationship between the pulse duration (δ), the flip angle (θ), and the magnetic field strength (B1). The formula to use is θ = γB1δ, where θ is the flip angle in radians (90° = π/2 radians), γ is the gyromagnetic ratio of 13C, B1 is the magnetic field strength in tesla, and δ is the pulse duration in seconds (1 μs = 1e-6 s). *<verified>*
Step 2: Convert the flip angle from degrees to radians. Since 90° equals π/2 radians, θ = π/2. *<verified>*
Step 3: Convert the pulse duration from microseconds to seconds. Since 1 μs equals 1e-6 seconds, δ = 1e-6 s. *<verified>*
Step 4: The gyromagnetic ratio (γ) of 13C is 10.705 MHz/T. This needs to be converted to radians per second per tesla (rad/s/T) for use in the formula. Since 1 MHz = 1e6 Hz, and 1 Hz = 2π rad/s, γ = 10.705e6 * 2π rad/s/T. *<verified>*
Step 5: Substitute the values of θ, δ, and γ into the formula θ = γB1δ. So, π/2 = (10.705e6 * 2π)B1 * 1e-6. *<verified>*
Step 6: Solve the equation for B1. B1 = (π/2) / ((10.705e6 * 2π) * 1e-6). *<verified>*
Step 7: Calculate B1 correctly. B1 = (π/2) / ((10.705e6 * 2π) * 1e-6) = 1/(10.705 * 4) ≈ 0.0235 T or 23.5 mT. Therefore, the correct option closest to this value is D) 23.3 mT. *<verified>*"
