,CaseID,Category,Question,Correct Answer,Raw COT Answer,Corrected COT Answer,Hallu Seq,raw_cot,corrected_cot
72,72,professional_law,"In which of the following situations is the defendant most likely guilty of manslaughter? The options are: A) A defendant was a guide on a nature walk in a national park. The group was traversing a mountainous path when a mountain lion suddenly appeared. The defendant, who was carrying a loaded gun, knew that mountain lions and coyotes were in the area. The defendant saw that the mountain lion was about to attack one of the hikers. Although the defendant could have easily shot and killed it, he did nothing. The wild animal pounced on the hiker. As she was being savaged, the defendant and the other members of the group ran to safety., B) A defendant, a registered nurse, asked her friend out to lunch. While eating, the friend suddenly began choking on a chicken bone. The defendant did nothing to help her friend. The friend choked to death., C) A defendant, a physician, was walking home from his office one afternoon when he saw a car hit a man who was trying to cross the street. The victim was knocked to the ground and seriously injured, while the car sped away. The defendant, who could have saved the man's life if he had treated him, continued walking home without rendering assistance. The man died from loss of blood., D) A defendant took his four-year-old daughter out in the yard to play. As they were playing catch, the telephone began to ring. The defendant ran into the house to answer the phone. While he was inside, the daughter's ball rolled into the street. As she went to retrieve it, the daughter was struck and killed by a car.",a,b,a,"['NO', 'NO', 'NO', 'NO', 'NO', 'NO']","To determine which situation most likely results in a manslaughter charge, we need to understand the basic legal definition of manslaughter. Manslaughter is typically defined as the unlawful killing of a human being without malice aforethought. It can be voluntary, where the defendant has an intention to kill or cause serious harm but does so under circumstances that can partially excuse their actions, or involuntary, where there is no intention to kill or cause serious harm, but the defendant's actions were negligent or reckless, leading to someone's death. Let's analyze each option: 

Step 1: Analyze option A - The defendant, knowing the presence of dangerous animals, failed to act when a mountain lion attacked a hiker. This could be seen as negligence, especially given the defendant's role as a guide and their ability to prevent the attack. However, the legal duty to act and the expectations in a wilderness setting might complicate this scenario. 

Step 2: Analyze option B - The registered nurse, by profession, has a duty to act in emergencies. Failing to assist someone choking, especially when trained to do so, could be seen as gross negligence leading to involuntary manslaughter. 

Step 3: Analyze option C - Similar to option B, a physician has a professional duty to provide aid in emergencies. Walking away from a severely injured person, especially when capable of providing life-saving treatment, could be considered gross negligence or reckless disregard for human life, potentially leading to a charge of involuntary manslaughter. 

Step 4: Analyze option D - This situation involves a tragic accident where a child is killed after chasing a ball into the street. While the defendant's action (or inaction) led to a dangerous situation, it might be viewed more as a tragic accident rather than criminal negligence. The expectation for constant supervision can vary, and this scenario might not meet the threshold for manslaughter. 

Considering the legal principles and the details provided in each scenario, the situation where the defendant's actions (or lack thereof) most clearly align with the definitions of manslaughter, particularly involuntary manslaughter due to negligence or failure to perform a duty, are options B and C. However, the registered nurse's failure to act in a situation where they are specifically trained to respond (option B) seems to be the most direct form of negligence leading to death.","Step 1: Analyze option A - The defendant, knowing the presence of dangerous animals, failed to act when a mountain lion attacked a hiker. This could potentially be seen as involuntary manslaughter, especially given the defendant's role as a guide and their ability to prevent the attack by using the loaded gun they carried. The legal duty to act and the expectations in a wilderness setting might complicate this scenario, but the defendant's inaction in the face of known danger could lead to liability for the hiker's death. *<verified>*
Step 2: Analyze option B - The registered nurse, by virtue of her profession, has a duty to act in emergencies where her skills can prevent harm. The failure to assist her choking friend, especially in a situation where her professional skills could have made a difference, might be seen as a breach of this duty, potentially leading to charges of involuntary manslaughter due to her inaction.
Step 3: Analyze option C - The physician, upon witnessing a severe accident, had the professional capability and arguably a moral duty to provide assistance. His decision to not render aid, especially when his intervention could have saved the victim's life, presents a strong case for involuntary manslaughter due to gross negligence.
Step 4: Analyze option D - While tragic, the defendant's temporary absence to answer a phone call, leading to his daughter's accidental death, may not constitute manslaughter. This situation lacks the direct negligence or failure to fulfill a known duty that is present in the other scenarios.
Step 5: Compare and contrast the scenarios - Options B and C involve professionals who failed to act within their capacity to save a life, which could be seen as gross negligence. However, option A involves a specific duty of care in a dangerous setting, where the defendant's inaction directly led to the hiker's death. Option D, though tragic, involves an unforeseeable accident without clear negligence.
Step 6: Determine the most likely scenario for manslaughter - Considering the legal principles of duty to act, negligence, and the directness of the defendant's inaction leading to death, option A presents the strongest case for manslaughter. The defendant's specific role and the preventability of the hiker's death through direct action distinguish it from the other scenarios."
73,73,professional_law,"Government drug officials from a neighboring country contacted a federal agency notifying the agency that drugs were being shipped by express mail next-day service to a defendant. The federal agency contacted the local police with the information regarding the defendant. The local police had long suspected the defendant of dealing drugs. The next day, two undercover police officers drove to the defendant's home and waited outside. A couple of hours later, the officers saw an express mail delivery truck pull up outside the defendant's home. The delivery person carried an express mail box to the front door and rang the doorbell. The officers then witnessed the defendant answer the door and take the package inside. Approximately 20 minutes later, the defendant left the house carrying the express mail box. She walked to her car, placed the package in the trunk, and drove off. The police followed in the squad car and pulled her over at the next traffic signal. The officers placed the defendant under arrest and instructed her to open the trunk. They confiscated the express mail box and opened it. Inside was a package of white powder, which lab tests later confirmed to be cocaine. The defendant was charged with illegal possession of cocaine. While awaiting trial, her attorney filed a motion to suppress the introduction of the cocaine into evidence. The motion will be The options are: A) granted, because the police failed to obtain a search warrant before opening the trunk of the vehicle., B) granted, because the police failed to obtain a search warrant before opening the package., C) denied, because the police had probable cause to conduct the search., D) denied, because the search was incident to a lawful arrest.",c,d,d,"['NO', 'NO', 'NO', 'NO', 'NO', 'NO', 'NO', 'NO']","Step 1: Understand the scenario where the police had information from a federal agency about the defendant receiving drugs through express mail, observed the delivery, and later arrested the defendant after she took the package and drove away. Step 2: Consider the legal requirement for a search warrant. Generally, police need a search warrant to conduct searches, but there are exceptions, such as searches incident to a lawful arrest or if there is probable cause. Step 3: Analyze the arrest situation. The police arrested the defendant after she took the package suspected to contain drugs and drove away, which could potentially justify the search of the vehicle and the package as incident to a lawful arrest or based on probable cause. Step 4: Evaluate option A, which suggests the motion to suppress will be granted because the police failed to obtain a search warrant before opening the trunk. This option does not consider the exceptions to the search warrant requirement. Step 5: Evaluate option B, which suggests the motion to suppress will be granted because the police failed to obtain a search warrant before opening the package. This option also does not consider the exceptions to the search warrant requirement. Step 6: Evaluate option C, which suggests the motion will be denied because the police had probable cause to conduct the search. This option aligns with the idea that the police had sufficient reason to believe the package contained illegal drugs based on the information received and their observations. Step 7: Evaluate option D, which suggests the motion will be denied because the search was incident to a lawful arrest. This option considers the fact that the search of the package could be justified as part of the arrest process. Step 8: Decide between options C and D based on the specifics of the case. Given the police had probable cause and the search could be considered incident to the arrest, both options seem viable. However, the key factor is whether the search of the package directly followed the arrest and was related to it. Since the search of the package in the trunk was directly related to the reason for the arrest (possession of drugs), option D seems more specifically applicable.","Step 1: Understand the scenario where the police had information from a federal agency about the defendant receiving drugs through express mail, observed the delivery, and later arrested the defendant after she took the package and drove away. Step 2: Consider the legal requirement for a search warrant. Generally, police need a search warrant to conduct searches, but there are exceptions, such as searches incident to a lawful arrest or if there is probable cause. Step 3: Analyze the arrest situation. The police arrested the defendant after she took the package suspected to contain drugs and drove away, which could potentially justify the search of the vehicle and the package as incident to a lawful arrest or based on probable cause. Step 4: Evaluate option A, which suggests the motion to suppress will be granted because the police failed to obtain a search warrant before opening the trunk. This option does not consider the exceptions to the search warrant requirement. Step 5: Evaluate option B, which suggests the motion to suppress will be granted because the police failed to obtain a search warrant before opening the package. This option also does not consider the exceptions to the search warrant requirement. Step 6: Evaluate option C, which suggests the motion will be denied because the police had probable cause to conduct the search. This option aligns with the idea that the police had sufficient reason to believe the package contained illegal drugs based on the information received and their observations. Step 7: Evaluate option D, which suggests the motion will be denied because the search was incident to a lawful arrest. This option considers the fact that the search of the package could be justified as part of the arrest process. Step 8: Decide between options C and D based on the specifics of the case. Given the police had probable cause and the search could be considered incident to the arrest, both options seem viable. However, the key factor is whether the search of the package directly followed the arrest and was related to it. Since the search of the package in the trunk was directly related to the reason for the arrest (possession of drugs), option D seems more specifically applicable."
74,74,professional_law,"A plaintiff sued the insurer of her home after the insurer denied coverage for water damage to the home allegedly caused by a frozen plastic pipe that burst. At trial, the insurer called as an expert witness an engineer, who testified that the pipe had burst because of age rather than freezing. On cross-examination, the engineer admitted that five years earlier, he had been convicted of tax fraud, even though he had asserted that it was his accountant's error. In response, the insurer calls a witness, who is well acquainted with the engineer and his reputation, to testify that (1) in the witness's opinion, the engineer is a truthful person, and (2) the engineer's neighbors all describe him as a truthful person. How much, if any, of the witness's testimony is admissible? The options are: A) All of the testimony is admissible to support the engineer's credibility., B) Only the portion concerning the engineer's reputation is admissible, because where both opinion and reputation evidence are available, only the latter is admissible under a rule of preference., C) Only the portion concerning the witness's opinion of the engineer's character, because the witness's reporting of the neighbors' comments is hearsay., D) None of the testimony is admissible, because it is collateral, having no bearing on the engineer's qualifications as an expert.",a,c,c,"['NO', 'NO', 'NO', 'NO', 'NO', 'NO', 'NO']","Step 1: Understand the context. The insurer's expert witness, an engineer, had his credibility questioned due to a past conviction for tax fraud. The insurer seeks to bolster the engineer's credibility by introducing testimony about his truthfulness.
Step 2: Analyze the admissibility of testimony about the engineer's character for truthfulness. In legal proceedings, character evidence can be introduced to support a witness's credibility, especially after it has been attacked.
Step 3: Distinguish between opinion and reputation evidence. Opinion evidence is a witness's personal view of another's character, while reputation evidence reflects a community's perception of the person.
Step 4: Consider the hearsay issue. Hearsay is an out-of-court statement offered to prove the truth of the matter asserted and is generally inadmissible unless an exception applies. The neighbor's comments, as reported by the witness, could be considered hearsay.
Step 5: Evaluate the relevance of the testimony to the engineer's qualifications as an expert. The issue at hand is the engineer's credibility, not his technical expertise.
Step 6: Apply the analysis to the options. Option A suggests all testimony is admissible, which overlooks the hearsay problem. Option B suggests a preference for reputation over opinion, which is not a standard rule in this context. Option C recognizes the hearsay issue with the neighbors' comments and the admissibility of personal opinion on truthfulness. Option D considers the testimony irrelevant, which is incorrect because the testimony aims to address the engineer's credibility, not his expertise.
Step 7: Conclude that the most appropriate option is C, as it correctly identifies the admissibility of the witness's personal opinion and the hearsay problem with reporting the neighbors' comments.","Step 1: Understand the context. The insurer's expert witness, an engineer, had his credibility questioned due to a past conviction for tax fraud. The insurer seeks to bolster the engineer's credibility by introducing testimony about his truthfulness.
Step 2: Analyze the admissibility of testimony about the engineer's character for truthfulness. In legal proceedings, character evidence can be introduced to support a witness's credibility, especially after it has been attacked.
Step 3: Distinguish between opinion and reputation evidence. Opinion evidence is a witness's personal view of another's character, while reputation evidence reflects a community's perception of the person.
Step 4: Consider the hearsay issue. Hearsay is an out-of-court statement offered to prove the truth of the matter asserted and is generally inadmissible unless an exception applies. The neighbor's comments, as reported by the witness, could be considered hearsay.
Step 5: Evaluate the relevance of the testimony to the engineer's qualifications as an expert. The issue at hand is the engineer's credibility, not his technical expertise.
Step 6: Apply the analysis to the options. Option A suggests all testimony is admissible, which overlooks the hearsay problem. Option B suggests a preference for reputation over opinion, which is not a standard rule in this context. Option C recognizes the hearsay issue with the neighbors' comments and the admissibility of personal opinion on truthfulness. Option D considers the testimony irrelevant, which is incorrect because the testimony aims to address the engineer's credibility, not his expertise.
Step 7: Conclude that the most appropriate option is C, as it correctly identifies the admissibility of the witness's personal opinion and the hearsay problem with reporting the neighbors' comments."
75,75,professional_law,"In 1996, a developer purchased a 100-acre tract located in a northern county in a state. Shortly thereafter, the developer prepared a subdivision plan that created 100 one-acre residential building lots on this tract. In 1997, the subdivision plan was recorded with the county recorder's office. During the next few years, the developer sold 60 residential lots to individual purchasers. Each deed specified that every lot designated on the subdivision plan was to be recorded in the county recorder's office. Each deed also provided the following:""No house trailer or mobile home shall be built or maintained on any lot within the subdivision. ""In 2003, the developer conveyed the remaining 40 lots to a builder by deed that included language identical to that contained in the first 60 deeds. This deed from the developer to the builder was recorded. By 2008, the builder had sold all of the 40 lots. Each of these deeds identified each lot as being a part of the subdivision, but did not include the clause relating to mobile homes. On January 30, 2009, a buyer, who had purchased one of the residential lots from the builder, placed a mobile home on his property. Which of the following statements is LEAST accurate with respect to the buyer's deed? The options are: A) The covenant prohibiting mobile homes ran with the land as far as the builder, but not as far as the buyer., B) The covenant prohibiting mobile homes could be enforced by any subdivision lot owner., C) The buyer should have had constructive notice of the restriction against mobile homes., D) All subsequent grantees of the builder would be in privity of estate.",a,d,d,"['NO', 'NO', 'NO', 'NO', 'NO', 'NO', 'NO']","Step 1: Understand that a covenant that runs with the land is a restriction that is attached to the property and is passed on to subsequent owners. 
Step 2: Recognize that for a covenant to run with the land, it must be in writing, touch and concern the land, and there must be intent for it to run with the land, along with notice to the party against whom the covenant is enforced and privity of estate. 
Step 3: Note that the original deeds from the developer to the first 60 buyers and the deed to the builder included the covenant against mobile homes, indicating an intent for this covenant to run with the land. 
Step 4: Acknowledge that the builder's deeds to the final 40 buyers did not include the covenant, but since the builder's deed from the developer did, the covenant still runs with the land to these 40 lots. 
Step 5: Understand that constructive notice means that a person should have known of a restriction through due diligence, such as by checking recorded deeds. Since the covenant was recorded with the county, the buyer had constructive notice. 
Step 6: Privity of estate refers to a direct relationship between the parties in the transfer of the property. The builder and the initial developer had privity of estate, as do the builder and the final buyers. 
Step 7: Evaluate the options based on the above analysis. A) is incorrect because the covenant does run with the land to both the builder and the buyer, given the recording of the original covenant. B) is correct because the covenant was intended to run with the land, and all lot owners would have the right to enforce it. C) is correct because the covenant was recorded, providing constructive notice. D) is the least accurate because privity of estate exists between the builder and the final buyers, but not necessarily among all subsequent grantees of the builder unless the covenant is included in their deeds or otherwise known.","Step 1: Understand that a covenant that runs with the land is a restriction that is attached to the property and is passed on to subsequent owners. 
Step 2: Recognize that for a covenant to run with the land, it must be in writing, touch and concern the land, and there must be intent for it to run with the land, along with notice to the party against whom the covenant is enforced and privity of estate. 
Step 3: Note that the original deeds from the developer to the first 60 buyers and the deed to the builder included the covenant against mobile homes, indicating an intent for this covenant to run with the land. 
Step 4: Acknowledge that the builder's deeds to the final 40 buyers did not include the covenant, but since the builder's deed from the developer did, the covenant still runs with the land to these 40 lots. 
Step 5: Understand that constructive notice means that a person should have known of a restriction through due diligence, such as by checking recorded deeds. Since the covenant was recorded with the county, the buyer had constructive notice. 
Step 6: Privity of estate refers to a direct relationship between the parties in the transfer of the property. The builder and the initial developer had privity of estate, as do the builder and the final buyers. 
Step 7: Evaluate the options based on the above analysis. A) is incorrect because the covenant does run with the land to both the builder and the buyer, given the recording of the original covenant. B) is correct because the covenant was intended to run with the land, and all lot owners would have the right to enforce it. C) is correct because the covenant was recorded, providing constructive notice. D) is the least accurate because privity of estate exists between the builder and the final buyers, but not necessarily among all subsequent grantees of the builder unless the covenant is included in their deeds or otherwise known."
