,CaseID,Category,Question,Correct Answer,Raw COT Answer,Corrected COT Answer,Hallu Seq,raw_cot,corrected_cot
113,113,formal_logic," Select the best translation into predicate logic. Some CEO is wealthier than everyone. (Cx: x is a CEO; Px: x is a person; Wxy: x is wealthier than y) The options are: A) (âˆƒx)[Cx â€¢ (âˆ€y)(Py â€¢ Wxy)], B) (âˆƒx)[Cx âŠƒ (âˆ€y)(Py âŠƒ Wxy)], C) (âˆƒx)[Cx â€¢ (âˆ€y)(Py âŠƒ Wxy)], D) (âˆ€x)[Px âŠƒ (âˆƒy)(Cy âŠƒ Wxy)]",c,c,c,"['NO', 'NO', 'NO', 'NO', 'NO', 'NO']","step 1: Identify the main components of the sentence. The sentence 'Some CEO is wealthier than everyone' has two main components: a) there exists at least one CEO, and b) this CEO is wealthier than every person.
step 2: Translate 'Some CEO' into predicate logic. This translates to 'there exists at least one x such that x is a CEO', which is represented as (âˆƒx)[Cx].
step 3: Translate 'is wealthier than everyone' into predicate logic. This means for all persons y, the CEO x is wealthier than y, which is represented as (âˆ€y)(Py â†’ Wxy).
step 4: Combine the translations from steps 2 and 3. Since both conditions must be true for the same CEO, we use the conjunction operator (â€¢) between them, resulting in (âˆƒx)[Cx â€¢ (âˆ€y)(Py â†’ Wxy)].
step 5: Review the options to find a match. Option A) (âˆƒx)[Cx â€¢ (âˆ€y)(Py â€¢ Wxy)] uses the conjunction operator (â€¢) incorrectly in the context of 'wealthier than everyone'. Option B) (âˆƒx)[Cx âŠƒ (âˆ€y)(Py âŠƒ Wxy)] uses the conditional (âŠƒ) instead of the conjunction (â€¢), which does not fit the sentence structure. Option C) (âˆƒx)[Cx â€¢ (âˆ€y)(Py âŠƒ Wxy)] correctly uses the conjunction (â€¢) to connect the CEO part and the conditional (âŠƒ) for the wealth comparison, matching our translation. Option D) (âˆ€x)[Px âŠƒ (âˆƒy)(Cy âŠƒ Wxy)] suggests a different meaning, implying that for every person, there exists some CEO wealthier than them, which is not the same as saying 'Some CEO is wealthier than everyone'.
step 6: Conclude that option C) is the correct translation based on the analysis.","Step 1: Identify the main components of the sentence. The sentence 'Some CEO is wealthier than everyone' has two main components: a) there exists at least one CEO, and b) this CEO is wealthier than every person. *<verified>*
Step 2: Translate 'Some CEO is wealthier than everyone' into predicate logic. This translates to 'there exists at least one x such that x is a CEO and for all y, if y is a person, then x is wealthier than y', which is represented as (âˆƒx)[Cx â€¢ (âˆ€y)(Py âŠƒ Wxy)]. *<verified>*
Step 3: Compare the translation with the given options. The correct translation matches option C: (âˆƒx)[Cx â€¢ (âˆ€y)(Py âŠƒ Wxy)].
Step 4: Verify the logical structure of option C. It correctly uses the existential quantifier (âˆƒx) to indicate that there is at least one CEO. The conjunction (â€¢) correctly links the CEO predicate with the universal quantification over all people (âˆ€y)(Py âŠƒ Wxy), indicating that for every person y, if y is a person, then the CEO x is wealthier than y.
Step 5: Confirm that the other options do not accurately represent the sentence. Option A uses a conjunction where the implication should be, making it too strong. Option B incorrectly uses implication (âŠƒ) after the existential quantifier, suggesting a conditional relationship that does not exist. Option D incorrectly suggests that for every person, there exists a CEO wealthier than them, which reverses the intended meaning.
Step 6: Conclude that option C is the only option that accurately translates the original sentence into predicate logic."
114,114,formal_logic," Which of the given formulas of PL is the best symbolization of the following sentence?
Either England's importing beef is not a necessary condition for France's subsidizing agriculture, or China promotes human rights if South Africa supplies diamonds. The options are: A) (~F âŠƒ E) âˆ¨ (C â‰¡ ~S), B) (~E âŠƒ F) âˆ¨ (C âŠƒ S), C) (~F âŠƒ E) âˆ¨ (C â‰¡ S), D) ~(F âŠƒ E) âˆ¨ (S âŠƒ C)",d,b,d,"['NO', 'NO', 'NO', 'NO', 'NO', 'NO', 'NO']","step 1: Break down the sentence into its logical components. The sentence has two main parts, connected by 'or'. The first part is about England's importing beef and France's subsidizing agriculture, and the second part is about China promoting human rights and South Africa supplying diamonds.
step 2: Analyze the first part of the sentence. 'England's importing beef is not a necessary condition for France's subsidizing agriculture' means that France subsidizing agriculture does not necessarily depend on England importing beef. In logical terms, this can be represented as ~(F âŠƒ E), which means it is not the case that if France subsidizes agriculture (F), then England imports beef (E).
step 3: Realize there's a mistake in step 2's interpretation. The correct interpretation of 'not a necessary condition' should be understood as the negation of the implication being reversed. That is, if E is not a necessary condition for F, it means F does not imply E, which is correctly symbolized as ~E âŠƒ F.
step 4: Analyze the second part of the sentence. 'China promotes human rights if South Africa supplies diamonds' is a straightforward conditional statement, which can be symbolized as C âŠƒ S.
step 5: Combine the two parts with 'or' as indicated in the original sentence. The correct symbolization combining steps 3 and 4 is (~E âŠƒ F) âˆ¨ (C âŠƒ S).
step 6: Match the combined symbolization with the given options. The correct match is found in option B) (~E âŠƒ F) âˆ¨ (C âŠƒ S).","Step 1: Analyze the sentence to identify its logical components accurately. The sentence consists of two parts connected by 'or'. The first part negates a conditional relationship, indicating that England's importing beef is not a necessary condition for France's subsidizing agriculture. This can be symbolized as a negation of a conditional statement. The second part establishes a conditional relationship, stating that if South Africa supplies diamonds, then China promotes human rights. This can be symbolized as a straightforward conditional statement. *<verified>*
Step 2: Assign symbols to the components. Let E represent 'England's importing beef', F represent 'France's subsidizing agriculture', C represent 'China promotes human rights', and S represent 'South Africa supplies diamonds'. *<verified>*
Step 3: Symbolize the first part of the sentence. Since England's importing beef is not a necessary condition for France's subsidizing agriculture, this translates to the negation of 'E is a necessary condition for F', which is symbolized as ~(E âŠƒ F). *<verified>*
Step 4: Correct the misunderstanding in Step 3. The correct symbolization of 'England's importing beef is not a necessary condition for France's subsidizing agriculture' should be the negation of 'F is a necessary condition for E', which is symbolized as ~(F âŠƒ E). This is because a necessary condition is symbolized as the consequent in a conditional statement.
Step 5: Symbolize the second part of the sentence. The conditional relationship 'if South Africa supplies diamonds, then China promotes human rights' can be directly symbolized as S âŠƒ C.
Step 6: Combine the two parts using 'or'. The complete sentence can be symbolized as ~(F âŠƒ E) âˆ¨ (S âŠƒ C).
Step 7: Match the complete symbolization with the given options. The correct symbolization is found in option D) ~(F âŠƒ E) âˆ¨ (S âŠƒ C)."
115,115,formal_logic,"Use indirect truth tables to determine whether the following argument is valid. If the argument is invalid, choose an option which presents a counterexample. (There may be other counterexamples as well.)
P âŠƒ (Q âˆ¨ R)
(Q Â· S) âŠƒ ~P
~(~Q âˆ¨ R) / ~P The options are: A) Valid, B) Invalid. Counterexample when P, Q, R, and S are true, C) Invalid. Counterexample when P and Q are true and R and S are false, D) Invalid. Counterexample when P, R, and S are true and Q is false",c,c,c,"['NO', 'NO', 'NO', 'NO', 'NO', 'NO', 'NO', 'NO', 'NO', 'NO', 'NO']","Step 1: Understand the argument structure. The argument consists of three premises and a conclusion. The premises are: 1) P implies (Q or R), 2) (Q and S) implies not P, and 3) not (not Q or R). The conclusion is not P.
Step 2: Set up an indirect truth table. We start by assuming the conclusion is false, meaning we assume P is true. This is because we're trying to find a counterexample where the premises can all be true but the conclusion is false.
Step 3: Analyze the first premise under the assumption that P is true. If P is true, then (Q or R) must also be true for the first premise to hold. This doesn't immediately restrict Q or R, as either or both could be true.
Step 4: Analyze the third premise under the assumption that P is true. The third premise is not (not Q or R), which simplifies to Q and not R. This means Q must be true and R must be false for the third premise to hold.
Step 5: Given that Q is true, we look at the second premise. For (Q and S) implies not P to be true when P is true, S must be false. This is because if S were true, then (Q and S) would be true, which would imply not P, contradicting our assumption that P is true.
Step 6: Summarize the conditions found: P is true, Q is true, R is false, and S is false. These conditions satisfy all the premises under the assumption that the conclusion is false (P is true).
Step 7: Since we found a set of conditions where all the premises are true but the conclusion is false, the argument is invalid.
Step 8: Match the conditions found with the given options. The conditions match option C) Invalid. Counterexample when P and Q are true and R and S are false.","Step 1: Understand the argument structure. The argument consists of three premises and a conclusion. The premises are: 1) P implies (Q or R), 2) (Q and S) implies not P, and 3) not (not Q or R). The conclusion is not P. *<verified>*
Step 2: Set up an indirect truth table. We start by assuming the conclusion is false, meaning we assume P is true. This is because we're trying to find a counterexample where the premises can all be true but the conclusion is false. *<verified>*
Step 3: Analyze the first premise under the assumption that P is true. If P is true, then (Q or R) must also be true for the first premise to hold. This doesn't immediately restrict Q or R, as either or both could be true. *<verified>*
Step 4: Analyze the third premise under the assumption that P is true. The third premise is not (not Q or R), which simplifies to Q and not R. This means for the third premise to hold, Q must be true and R must be false. *<verified>*
Step 5: Given that Q must be true and R must be false from the analysis of the third premise, we now look at the second premise. The second premise is (Q and S) implies not P. Since Q is true, for this premise to potentially hold, it does not require S to be true; rather, it requires that if both Q and S are true, then P must not be true. However, our initial assumption was that P is true, which leads to a contradiction only if S is also true, making (Q and S) true. Therefore, the correct analysis should focus on whether the premises can all be true without leading to a contradiction, rather than assuming S must be true. *<verified>*
Step 6: To find a counterexample, we need to check if there's a scenario where all premises are true but the conclusion is false. Given our analysis, we assume P is true, Q is true, R is false, and we need to determine the truth value of S. If S is true, then the second premise (Q and S) implies not P would also be true, leading to a contradiction with our assumption that P is true. *<verified>*
Step 7: To avoid contradiction, we must consider the implications of the premises on S without making unwarranted assumptions. Given our analysis, assuming P is true and Q is true leads to a scenario where the second premise, (Q and S) implies not P, becomes relevant. For this premise to hold true without contradicting our assumption that P is true, we must carefully consider the conditions under which (Q and S) implies not P can be true. This requires a more nuanced analysis of S's role in the argument. *<verified>*
Step 8: Since we have established that P is true, Q is true, and R is false, the only way for the second premise to not lead to a contradiction is if S is false. This is because if S were true, then (Q and S) would imply not P, contradicting our assumption that P is true.
Step 9: With S being false, all premises can be true without leading to a contradiction. The first premise is satisfied because Q is true, making (Q or R) true. The second premise is satisfied because with S being false, (Q and S) does not hold, and thus does not imply not P. The third premise is satisfied because Q is true and R is false, making not (not Q or R) true.
Step 10: Since we have found a scenario where all premises are true but the conclusion (not P) is false (because we assumed P is true), the argument is invalid.
Step 11: The counterexample that invalidates the argument is when P and Q are true, R is false, and S is false. This matches option C."
116,116,formal_logic," Which of the following propositions is not an immediate (one-step) consequence in PL of the given premises?
I âŠƒ (J â‰¡ K)
(J â‰¡ K) âŠƒ (L âˆ¨ M)
I âŠƒ ~L The options are: A) ~L, B) J â‰¡ K, C) I âŠƒ (L âˆ¨ M), D) ~L âŠƒ (J â‰¡ K)",d,d,d,"['NO', 'NO', 'NO', 'NO', 'NO', 'NO', 'NO', 'NO']","step 1: Analyze the given premises in propositional logic (PL). The premises are: 1) I âŠƒ (J â‰¡ K), 2) (J â‰¡ K) âŠƒ (L âˆ¨ M), 3) I âŠƒ ~L.
step 2: Understand the question. We need to find which option is not an immediate (one-step) consequence of the given premises. This means we are looking for an option that cannot be directly inferred from the premises without additional steps or assumptions.
step 3: Evaluate option A (~L). Given the third premise (I âŠƒ ~L), if I is true, then ~L is directly inferred. However, ~L itself is not an immediate consequence of the premises without assuming I is true. This option requires an additional step (assuming I is true) to reach ~L, making it a potential answer.
step 4: Evaluate option B (J â‰¡ K). From the first premise (I âŠƒ (J â‰¡ K)), if I is true, then J â‰¡ K is directly inferred. This is an immediate consequence of the premises, assuming I is true.
step 5: Evaluate option C (I âŠƒ (L âˆ¨ M)). By combining the first two premises, if I is true, then J â‰¡ K is true (from the first premise), which then implies L âˆ¨ M is true (from the second premise). This is a direct consequence of the premises through chaining, making it an immediate consequence.
step 6: Evaluate option D (~L âŠƒ (J â‰¡ K)). This option suggests that if ~L is true, then J â‰¡ K is true. However, there is no direct premise linking ~L to J â‰¡ K without additional steps or assumptions. This option does not follow directly from the premises and requires an inference that is not provided by the given premises.
step 7: Conclude that while options A, B, and C can be seen as immediate consequences of the premises with the right context or chaining, option D (~L âŠƒ (J â‰¡ K)) does not directly follow from the given premises without additional steps or assumptions, making it the correct answer.","step 1: Analyze the given premises in propositional logic (PL). The premises are: 1) I âŠƒ (J â‰¡ K), 2) (J â‰¡ K) âŠƒ (L âˆ¨ M), 3) I âŠƒ ~L. *<verified>*
step 2: Understand the question. We need to find which option is not an immediate (one-step) consequence of the given premises. This means we are looking for an option that cannot be directly inferred from the premises without additional steps or assumptions. *<verified>*
step 3: Evaluate option A (~L). Given the third premise (I âŠƒ ~L), if I is true, then ~L is directly inferred. However, ~L itself is not an immediate consequence of the premises without assuming I is true. This option requires an additional step (assuming I is true) to reach ~L, making it a potential answer. *<verified>*
Step 4: Evaluate option B (J â‰¡ K). The first premise (I âŠƒ (J â‰¡ K)) does not allow us to directly infer J â‰¡ K without assuming I is true. Therefore, J â‰¡ K is not an immediate consequence of the premises by itself, making it a potential answer. *<verified>*
Step 5: Evaluate option C (I âŠƒ (L âˆ¨ M)). By applying hypothetical syllogism to the first two premises, if I, then (J â‰¡ K), and if (J â‰¡ K), then (L âˆ¨ M), we can directly infer that if I, then (L âˆ¨ M). This makes option C an immediate consequence of the premises, eliminating it as the correct answer.
Step 6: Evaluate option D (~L âŠƒ (J â‰¡ K)). This option suggests a conditional relationship between ~L and (J â‰¡ K) that is not directly stated or implied by the premises. To infer this relationship, additional steps beyond the given premises would be required, making it a potential answer.
Step 7: Compare the potential answers (A, B, and D) based on the requirement for an option to not be an immediate consequence of the premises. Options A and B require the assumption that I is true to reach their conclusions, which adds an extra step. Option D introduces a conditional relationship not directly supported by the premises, indicating it requires more than an immediate inference.
Step 8: Conclude that option D (~L âŠƒ (J â‰¡ K)) is the correct answer because it introduces a new conditional relationship not directly inferable from the given premises without additional logical steps or assumptions."
117,117,formal_logic,"Construct a complete truth table for the following argument. Then, using the truth table, determine whether the argument is valid or invalid. If the argument is invalid, choose an option which presents a counterexample. (There may be other counterexamples as well.)
~G âŠƒ H
~H / G The options are: A) Valid, B) Invalid. Counterexample when G and H are true, C) Invalid. Counterexample when G is true and H is false, D) Invalid. Counterexample when H is true and G is false",a,c,d,"['NO', 'NO', 'NO', 'NO', 'NO', 'NO', 'NO', 'NO']","step 1: Identify the premises and conclusion. The premise is '~G âŠƒ H' and the conclusion is 'G'.
step 2: Determine the variables involved. Here, we have two variables: G and H.
step 3: Construct a truth table with all possible truth values for G and H. This results in 4 combinations: TT, TF, FT, FF.
step 4: Evaluate the premise '~G âŠƒ H' for each combination. Remember, 'âŠƒ' means 'if...then', and '~' means 'not'.
step 5: For TT, '~G' is false, so '~G âŠƒ H' is true (since 'if false then true' is true).
step 6: For TF, '~G' is false, so '~G âŠƒ H' is true (since 'if false then anything' is true).
step 7: For FT, '~G' is true and H is false, so '~G âŠƒ H' is false (since 'if true then false' is false).
step 8: For FF, '~G' is true and H is true, so '~G âŠƒ H' is true (since 'if true then true' is true).
step 9: Check if there are any cases where the premise is true and the conclusion is false. This happens when G is true and H is false (TF), which is a counterexample to the argument being valid.
step 10: Therefore, the argument is invalid with a counterexample when G is true and H is false.","Step 1: Identify the premises and conclusion. The premise is '~G âŠƒ H' and the conclusion is 'G'. *<verified>*
Step 2: Determine the variables involved. Here, we have two variables: G and H. *<verified>*
Step 3: Construct a truth table that includes columns for ~G, H, ~G âŠƒ H, ~H, and G. Fill in the truth values for each column based on the logical operations involved. This will accurately reflect the logical structure of the argument and allow for the determination of the argument's validity. *<verified>*
Step 4: Fill in the truth values for G and H. There are four possible combinations: (T, T), (T, F), (F, T), and (F, F). *<verified>*
Step 5: Calculate the truth values for ~G. This will be the opposite of G's values: For G = T, ~G = F and for G = F, ~G = T. Therefore, the correct truth values for ~G, corresponding to the combinations of G and H given in Step 4, are: (F), (F), (T), (T). *<verified>*
Step 6: Calculate the truth values for ~H. This will be the opposite of H's values: For H = T, ~H = F and for H = F, ~H = T. Therefore, the correct truth values for ~H, corresponding to the combinations of G and H given in Step 4, are: (F), (T), (F), (T). *<verified>*
Step 7: Determine the truth values for '~G âŠƒ H'. The conditional statement is true unless the antecedent is true and the consequent is false. Therefore, the truth values for '~G âŠƒ H', based on the combinations of ~G and H from Steps 5 and 4, are: (T), (T), (T), (F). *<verified>*
Step 8: Analyze the truth table to determine the validity of the argument. An argument is valid if and only if, whenever the premises are all true, the conclusion is also true. Based on the truth table constructed in the previous steps, we find that there is a scenario where the premise '~G âŠƒ H' is true (T, T, T, F), but the conclusion 'G' is not true (F). Therefore, the argument is invalid. The correct option is D) Invalid. Counterexample when H is true and G is false. *<verified>*"
118,118,formal_logic,"Identify the antecedent of the following conditional proposition: The Bees winning their first game is necessary for either the Aardvarks or the Chipmunks not winning their first game. The options are: A) The Aardvarks do not win their first game., B) The Bees win their first game., C) The Chipmunks do not win their first game., D) Either the Aardvarks or the Chipmunks do not win their first game.",d,d,b,"['NO', 'NO', 'NO', 'NO', 'NO', 'NO', 'NO', 'NO']","step 1: Understand the structure of a conditional proposition, which is typically in the form 'If P, then Q', where P is the antecedent and Q is the consequent.
step 2: Identify the proposition given: 'The Bees winning their first game is necessary for either the Aardvarks or the Chipmunks not winning their first game.'
step 3: Recognize that 'necessary for' indicates that the first part (The Bees winning their first game) is the consequent of the conditional proposition, not the antecedent.
step 4: Understand that in logic, saying 'X is necessary for Y' is equivalent to saying 'If Y, then X'. Therefore, the antecedent is 'either the Aardvarks or the Chipmunks not winning their first game'.
step 5: Match the antecedent identified in step 4 with the given options.
step 6: Conclude that the correct option is D) Either the Aardvarks or the Chipmunks do not win their first game, as it directly matches the antecedent identified.","Step 1: Understand the structure of a conditional proposition, which is typically in the form 'If P, then Q', where P is the antecedent and Q is the consequent. *<verified>*
Step 2: Identify the antecedent of the given proposition: 'The Bees winning their first game is necessary for either the Aardvarks or the Chipmunks not winning their first game.' The correct antecedent is 'The Bees winning their first game'. *<verified>*
Step 3: Review the options provided to find the one that matches the identified antecedent.
Step 4: Option A) The Aardvarks do not win their first game. - This is not the antecedent but a part of the consequent.
Step 5: Option B) The Bees win their first game. - This matches the identified antecedent from Step 2.
Step 6: Option C) The Chipmunks do not win their first game. - Similar to Option A, this is part of the consequent, not the antecedent.
Step 7: Option D) Either the Aardvarks or the Chipmunks do not win their first game. - This is the consequent of the conditional proposition, not the antecedent.
Step 8: Conclude that the correct option that matches the antecedent 'The Bees winning their first game' is Option B."
