,CaseID,Category,Question,Correct Answer,Raw COT Answer,Corrected COT Answer,Hallu Seq,raw_cot,corrected_cot
70,70,professional_law,"A car manufacturer produced a car that was sold nationwide. Problems with the car's brakes allegedly caused several accidents and injuries. Two individual buyers of the car each filed a class action, in different states, against the manufacturer, asserting the same products liability claims on behalf of all buyers nationwide. One class action was filed in federal court and the other was filed in state court. The parties in the federal action reached a court- approved settlement, and the court entered judgment dismissing the action with prejudice. The manufacturer's attorney has moved to dismiss the state court action on the basis of res judicata (claim preclusion). Should the state court look to federal or state law to decide the effect of the judgment? The options are: A) Federal law, because the judgment was entered in federal court., B) Federal law, because the judgment was the result of a nationwide action governed by the federal class action rule., C) State law, because the judgment is being asserted in a state court., D) State law, because there is no general federal common law and preclusion is a common law doctrine.",a,b,b,"['NO', 'NO', 'NO', 'NO', 'NO', 'NO', 'NO', 'NO']","Step 1: Understand the concept of res judicata (claim preclusion), which prevents the same parties or their privies from relitigating a claim that has already been finally adjudicated by a competent court.
Step 2: Recognize that the issue at hand involves the preclusive effect of a federal court judgment in a subsequent state court proceeding.
Step 3: Recall that the Full Faith and Credit Clause of the U.S. Constitution requires state courts to recognize and give effect to the judgments of federal courts.
Step 4: Note that the Supreme Court has held that the preclusive effect of a federal court's judgment is determined by federal law when the federal court's jurisdiction was based on federal question jurisdiction. However, when a federal court exercises diversity jurisdiction, it applies state law, including the state's law of res judicata.
Step 5: Identify that the scenario does not specify the basis of the federal court's jurisdiction (federal question or diversity). However, the nationwide scope of the class action and the nature of the claims (products liability) suggest that federal question jurisdiction could be involved, especially if the claims are based on violations of federal statutes or regulations.
Step 6: Consider that the class action was described as a nationwide action, which implies that it likely involved federal class action rules, suggesting the involvement of federal law.
Step 7: Conclude that, given the nationwide scope of the action and the potential involvement of federal law, the preclusive effect of the federal court judgment should be determined by federal law.
Step 8: Decide between the options provided, focusing on the ones that suggest the application of federal law due to the nature of the judgment and the nationwide scope of the action.","Step 1: Understand the concept of res judicata (claim preclusion), which prevents the same parties or their privies from relitigating a claim that has already been finally adjudicated by a competent court.
Step 2: Recognize that the issue at hand involves the preclusive effect of a federal court judgment in a subsequent state court proceeding.
Step 3: Recall that the Full Faith and Credit Clause of the U.S. Constitution requires state courts to recognize and give effect to the judgments of federal courts.
Step 4: Note that the Supreme Court has held that the preclusive effect of a federal court's judgment is determined by federal law when the federal court's jurisdiction was based on federal question jurisdiction. However, when a federal court exercises diversity jurisdiction, it applies state law, including the state's law of res judicata.
Step 5: Identify that the scenario does not specify the basis of the federal court's jurisdiction (federal question or diversity). However, the nationwide scope of the class action and the nature of the claims (products liability) suggest that federal question jurisdiction could be involved, especially if the claims are based on violations of federal statutes or regulations.
Step 6: Consider that the class action was described as a nationwide action, which implies that it likely involved federal class action rules, suggesting the involvement of federal law.
Step 7: Conclude that, given the nationwide scope of the action and the potential involvement of federal law, the preclusive effect of the federal court judgment should be determined by federal law.
Step 8: Decide between the options provided, focusing on the ones that suggest the application of federal law due to the nature of the judgment and the nationwide scope of the action."
71,71,professional_law,"A homeowner was holding his annual party at his home. His parties attracted a wide variety of diverse individuals. On the night in question, a defendant was loafing at the local bar when a number of the invited guests came in to purchase spirits for the party. The defendant decided to crash the party. He arrived at the homeowner's house around midnight when the party was in full swing. He went in through the front door, which was unlocked, and easily mingled with the other partygoers. During the party, the defendant wandered through the house and came upon a baseball, signed by a famous baseball player, in a glass case. Knowing the ball to be very valuable, the defendant put it under his jacket and made his way down the stairs and out the front door. If the defendant is subsequently charged with burglary, he will probably be found The options are: A) guilty, because he crashed the party., B) guilty, because he intended to steal the baseball., C) not guilty, because he crashed the party only to have a good time., D) not guilty, because the front door was unlocked.",c,d,d,"['NO', 'NO', 'NO', 'NO', 'NO']","step 1: Understand the definition of burglary. Burglary typically involves entering a building unlawfully with intent to commit a crime, especially theft, inside.
step 2: Analyze the defendant's actions against the definition of burglary. The defendant entered the homeowner's house without permission (unlawfully), even though the door was unlocked.
step 3: Determine the defendant's intent upon entering the house. The intent to steal (commit a crime) was not present upon entry; the decision to steal the baseball occurred after entering the house.
step 4: Consider the relevance of the defendant's initial intent. For a burglary charge, the intent to commit a crime inside must exist at the time of entry.
step 5: Evaluate the options given in light of the analysis. Option A is incorrect because merely crashing the party does not fulfill the criteria for burglary. Option B is incorrect because the intent to steal was formed after entering the house, not at the time of entry. Option C is incorrect because the reason for crashing the party is irrelevant to the charge of burglary. Option D is the most accurate because the fact that the door was unlocked and the lack of intent to commit a crime upon entry are crucial factors that do not support a burglary charge.","step 1: Understand the definition of burglary. Burglary typically involves entering a building unlawfully with intent to commit a crime, especially theft, inside.
step 2: Analyze the defendant's actions against the definition of burglary. The defendant entered the homeowner's house without permission (unlawfully), even though the door was unlocked.
step 3: Determine the defendant's intent upon entering the house. The intent to steal (commit a crime) was not present upon entry; the decision to steal the baseball occurred after entering the house.
step 4: Consider the relevance of the defendant's initial intent. For a burglary charge, the intent to commit a crime inside must exist at the time of entry.
step 5: Evaluate the options given in light of the analysis. Option A is incorrect because merely crashing the party does not fulfill the criteria for burglary. Option B is incorrect because the intent to steal was formed after entering the house, not at the time of entry. Option C is incorrect because the reason for crashing the party is irrelevant to the charge of burglary. Option D is the most accurate because the fact that the door was unlocked and the lack of intent to commit a crime upon entry are crucial factors that do not support a burglary charge."
72,72,professional_law,"In which of the following situations is the defendant most likely guilty of manslaughter? The options are: A) A defendant was a guide on a nature walk in a national park. The group was traversing a mountainous path when a mountain lion suddenly appeared. The defendant, who was carrying a loaded gun, knew that mountain lions and coyotes were in the area. The defendant saw that the mountain lion was about to attack one of the hikers. Although the defendant could have easily shot and killed it, he did nothing. The wild animal pounced on the hiker. As she was being savaged, the defendant and the other members of the group ran to safety., B) A defendant, a registered nurse, asked her friend out to lunch. While eating, the friend suddenly began choking on a chicken bone. The defendant did nothing to help her friend. The friend choked to death., C) A defendant, a physician, was walking home from his office one afternoon when he saw a car hit a man who was trying to cross the street. The victim was knocked to the ground and seriously injured, while the car sped away. The defendant, who could have saved the man's life if he had treated him, continued walking home without rendering assistance. The man died from loss of blood., D) A defendant took his four-year-old daughter out in the yard to play. As they were playing catch, the telephone began to ring. The defendant ran into the house to answer the phone. While he was inside, the daughter's ball rolled into the street. As she went to retrieve it, the daughter was struck and killed by a car.",a,b,a,"['NO', 'NO', 'NO', 'NO', 'NO', 'NO', 'NO', 'NO']","To determine which situation most likely results in a manslaughter charge, we need to understand the basic legal definition of manslaughter. Manslaughter is typically defined as the unlawful killing of a human being without malice aforethought. It can be voluntary, where the defendant has an intention to kill or cause serious harm but does so under circumstances that can partially excuse their actions, or involuntary, where there is no intention to kill or cause serious harm, but the defendant's actions were negligent or reckless, leading to someone's death. Let's analyze each option: 

Step 1: Analyze option A - The defendant, knowing the presence of dangerous animals, failed to act when a mountain lion attacked a hiker. This could be seen as negligence, especially given the defendant's role as a guide and their ability to prevent the attack. However, the legal duty to act and the expectations in a wilderness setting might complicate this scenario. 

Step 2: Analyze option B - The registered nurse, by profession, has a duty to act in emergencies. Failing to assist someone choking, especially when trained to do so, could be seen as gross negligence leading to involuntary manslaughter. 

Step 3: Analyze option C - Similar to option B, a physician has a professional duty to provide aid in emergencies. Walking away from a severely injured person, especially when capable of providing life-saving treatment, could be considered gross negligence or reckless disregard for human life, potentially leading to a charge of involuntary manslaughter. 

Step 4: Analyze option D - This situation involves a tragic accident where a child is killed after chasing a ball into the street. While the defendant's action (or inaction) led to a dangerous situation, it might be viewed more as a tragic accident rather than criminal negligence. The expectation for constant supervision can vary, and this scenario might not meet the threshold for manslaughter. 

Considering the legal principles and the details provided in each scenario, the situation where the defendant's actions (or lack thereof) most clearly align with the definitions of manslaughter, particularly involuntary manslaughter due to negligence or failure to perform a duty, are options B and C. However, the registered nurse's failure to act in a situation where they are specifically trained to respond (option B) seems to be the most direct form of negligence leading to death.","Step 1: Analyze option A - The defendant, knowing the presence of dangerous animals, failed to act when a mountain lion attacked a hiker. This could potentially be seen as gross negligence or recklessness, especially given the defendant's role as a guide and their ability to prevent the attack with a loaded gun. The failure to act in this situation, resulting in the hiker's death, could make the defendant most likely guilty of manslaughter, considering the legal expectations of someone in their position in a wilderness setting. *<verified>*
Step 2: Analyze option B - The defendant, a registered nurse, did not assist her friend who was choking. Given the defendant's medical training and knowledge, the failure to act could be seen as a breach of duty that a reasonable person with similar training would have acted upon. However, the legal obligation to act in a personal, non-professional setting may not be as clear-cut as in a professional setting.
Step 3: Analyze option C - The defendant, a physician, did not render aid to a seriously injured man after witnessing a car accident. Despite having the skills to potentially save the man's life, the physician chose to walk away. This situation raises questions about the moral and possibly legal duty of a medical professional to render aid in emergencies, even outside of a professional setting.
Step 4: Analyze option D - The defendant left his young daughter unattended, leading to her tragic death. While this is a heartbreaking situation, the legal responsibility for the child's death may hinge on the concept of negligence and whether the defendant's actions were a direct cause of the accident.
Step 5: Compare the scenarios - All options involve a failure to act, but the legal implications and the degree of responsibility may vary. Option A involves a professional duty in a specific setting, options B and C involve medical professionals outside of their professional settings, and option D involves parental supervision.
Step 6: Legal principles - Manslaughter typically involves unlawful killing without malice aforethought. It can be voluntary, where the defendant has an intention to cause serious harm or death, or involuntary, where the death results from recklessness or criminal negligence.
Step 7: Apply legal principles to options - Option A's scenario most closely aligns with the definition of involuntary manslaughter due to the defendant's professional role, knowledge of the risk, and failure to prevent harm in a situation where they had a duty to act.
Step 8: Conclusion - Based on the analysis of the scenarios and the application of legal principles, option A presents the strongest case for manslaughter due to the combination of professional duty, knowledge of the risk, and failure to act resulting in death."
73,73,professional_law,"Government drug officials from a neighboring country contacted a federal agency notifying the agency that drugs were being shipped by express mail next-day service to a defendant. The federal agency contacted the local police with the information regarding the defendant. The local police had long suspected the defendant of dealing drugs. The next day, two undercover police officers drove to the defendant's home and waited outside. A couple of hours later, the officers saw an express mail delivery truck pull up outside the defendant's home. The delivery person carried an express mail box to the front door and rang the doorbell. The officers then witnessed the defendant answer the door and take the package inside. Approximately 20 minutes later, the defendant left the house carrying the express mail box. She walked to her car, placed the package in the trunk, and drove off. The police followed in the squad car and pulled her over at the next traffic signal. The officers placed the defendant under arrest and instructed her to open the trunk. They confiscated the express mail box and opened it. Inside was a package of white powder, which lab tests later confirmed to be cocaine. The defendant was charged with illegal possession of cocaine. While awaiting trial, her attorney filed a motion to suppress the introduction of the cocaine into evidence. The motion will be The options are: A) granted, because the police failed to obtain a search warrant before opening the trunk of the vehicle., B) granted, because the police failed to obtain a search warrant before opening the package., C) denied, because the police had probable cause to conduct the search., D) denied, because the search was incident to a lawful arrest.",c,d,d,"['NO', 'NO', 'NO', 'NO', 'NO', 'NO', 'NO', 'NO']","Step 1: Understand the scenario where the police had information from a federal agency about the defendant receiving drugs through express mail, observed the delivery, and later arrested the defendant after she took the package and drove away. Step 2: Consider the legal requirement for a search warrant. Generally, police need a search warrant to conduct searches, but there are exceptions, such as searches incident to a lawful arrest or if there is probable cause. Step 3: Analyze the arrest situation. The police arrested the defendant after she took the package suspected to contain drugs and drove away, which could potentially justify the search of the vehicle and the package as incident to a lawful arrest or based on probable cause. Step 4: Evaluate option A, which suggests the motion to suppress will be granted because the police failed to obtain a search warrant before opening the trunk. This option does not consider the exceptions to the search warrant requirement. Step 5: Evaluate option B, which suggests the motion to suppress will be granted because the police failed to obtain a search warrant before opening the package. This option also does not consider the exceptions to the search warrant requirement. Step 6: Evaluate option C, which suggests the motion will be denied because the police had probable cause to conduct the search. This option aligns with the idea that the police had sufficient reason to believe the package contained illegal drugs based on the information received and their observations. Step 7: Evaluate option D, which suggests the motion will be denied because the search was incident to a lawful arrest. This option considers the fact that the search of the package could be justified as part of the arrest process. Step 8: Decide between options C and D based on the specifics of the case. Given the police had probable cause and the search could be considered incident to the arrest, both options seem viable. However, the key factor is whether the search of the package directly followed the arrest and was related to it. Since the search of the package in the trunk was directly related to the reason for the arrest (possession of drugs), option D seems more specifically applicable.","Step 1: Understand the scenario where the police had information from a federal agency about the defendant receiving drugs through express mail, observed the delivery, and later arrested the defendant after she took the package and drove away. Step 2: Consider the legal requirement for a search warrant. Generally, police need a search warrant to conduct searches, but there are exceptions, such as searches incident to a lawful arrest or if there is probable cause. Step 3: Analyze the arrest situation. The police arrested the defendant after she took the package suspected to contain drugs and drove away, which could potentially justify the search of the vehicle and the package as incident to a lawful arrest or based on probable cause. Step 4: Evaluate option A, which suggests the motion to suppress will be granted because the police failed to obtain a search warrant before opening the trunk. This option does not consider the exceptions to the search warrant requirement. Step 5: Evaluate option B, which suggests the motion to suppress will be granted because the police failed to obtain a search warrant before opening the package. This option also does not consider the exceptions to the search warrant requirement. Step 6: Evaluate option C, which suggests the motion will be denied because the police had probable cause to conduct the search. This option aligns with the idea that the police had sufficient reason to believe the package contained illegal drugs based on the information received and their observations. Step 7: Evaluate option D, which suggests the motion will be denied because the search was incident to a lawful arrest. This option considers the fact that the search of the package could be justified as part of the arrest process. Step 8: Decide between options C and D based on the specifics of the case. Given the police had probable cause and the search could be considered incident to the arrest, both options seem viable. However, the key factor is whether the search of the package directly followed the arrest and was related to it. Since the search of the package in the trunk was directly related to the reason for the arrest (possession of drugs), option D seems more specifically applicable."
