,CaseID,Category,Question,Correct Answer,Raw COT Answer,Corrected COT Answer,Hallu Seq,raw_cot,corrected_cot
35,35,college_chemistry,"When the following equation is balanced, which of the following is true?
__ MnO4âˆ’ + __ Iâˆ’ + __ H+ <-> __ Mn2+ + __ IO3âˆ’ + __ H2O The options are: A) The Iâˆ’ : IO3âˆ’ ratio is 3:1., B) The MnO4- : I- ratio is 6:5., C) The MnO4- : Mn2+ ratio is 3:1., D) The H+ : Iâˆ’ ratio is 2:1.",b,a,a,"['NO', 'NO', 'NO', 'NO', 'YES']","Step 1: Balance the atoms other than oxygen and hydrogen. In this case, we balance Mn and I first. Since there is 1 Mn on both sides, Mn is already balanced. For iodine, since it changes from I- to IO3-, we need to balance the iodine atoms. We put a coefficient of 3 in front of I- to have 3 iodine atoms on both sides.
Step 2: Balance the oxygen atoms by adding water molecules. There are 4 oxygen atoms on the left (from MnO4-) and 3 on the right (from IO3-), so we add 1 H2O molecule on the right side to balance the oxygen atoms.
Step 3: Balance the hydrogen atoms by adding H+ ions. Since we added 1 H2O molecule on the right, we need to add 2 H+ ions on the left to balance the hydrogen atoms.
Step 4: Finally, balance the charge. The left side has a total charge of 2- (1- from MnO4- and 3- from 3 I-) plus 2+ from 2 H+, resulting in a net charge of 0. The right side has a charge of 2+ from Mn2+ and a net charge of 0 from 3 I- converted into 1 IO3- and 1 H2O. Thus, the charges are balanced without further adjustments.
Step 5: Review the balanced equation: 1 MnO4- + 3 I- + 2 H+ <-> 1 Mn2+ + 1 IO3- + 1 H2O. Now, compare this with the given options.
A) The I- : IO3- ratio is indeed 3:1, which matches our balanced equation.
B) The MnO4- : I- ratio is 1:3, not 6:5.
C) The MnO4- : Mn2+ ratio is 1:1, not 3:1.
D) The H+ : I- ratio is 2:3, not 2:1.","Step 1: Balance the atoms other than oxygen and hydrogen. In this case, we balance Mn and I first. Since there is 1 Mn on both sides, Mn is already balanced. For iodine, since it changes from I- to IO3-, we need to balance the iodine atoms. We put a coefficient of 3 in front of I- to have 3 iodine atoms on both sides. *<verified>*
Step 2: Balance the oxygen atoms by adding water molecules. To correctly balance the oxygen atoms, we need to consider the entire reaction, including balancing hydrogen atoms and ensuring that the overall charge is balanced. This step requires a comprehensive approach that might involve adding water molecules, hydrogen ions, or electrons to fully balance the equation. A specific correction to this step cannot be accurately provided without further steps that include balancing hydrogen atoms and the overall charge. *<verified>*
Step 3: To balance the oxygen atoms, consider all sources of oxygen in the reaction. This may involve adding water molecules to the side lacking oxygen and subsequently balancing hydrogen atoms and charges through the addition of H+ ions or electrons. The exact correction requires a comprehensive approach that considers the entire equation. *<verified>*
Step 4: To balance the oxygen atoms, we observe that there are 4 oxygen atoms in MnO4- and 3 oxygen atoms in IO3-. To balance the oxygen atoms, we add 3 water (H2O) molecules on the right side for the 3 oxygen atoms in IO3- and an additional water molecule on the left side to account for the oxygen atom difference, ensuring the oxygen atoms are balanced across the equation. Next steps will involve balancing hydrogen atoms and the overall charge. *<verified>*
Step 5: Balance the hydrogen atoms by adding H+ ions. Since we added 3 water molecules on the right side, this introduces 6 hydrogen atoms. To balance these, we add 6 H+ ions on the right side of the equation to maintain the charge balance and correctly balance the hydrogen atoms. *<verified>*
Step 6: Balance the overall charge. Initially, we have MnO4- (charge of -1) and 3 I- (charge of -3) on the left side, totaling a charge of -4. On the right side, we have Mn2+ (charge of +2), IO3- (charge of -1), and 6 H+ (charge of +6), totaling a charge of +7. To balance the charge, we need to add electrons to the more positive side of the equation.
Step 7: Add 5 electrons to the right side to balance the charge, making the total charge on both sides equal to -4.
Step 8: Verify the balance of the entire equation. We now have 1 MnO4-, 3 I-, and 6 H+ on the left side; and 1 Mn2+, 1 IO3-, 3 H2O, and 5 electrons on the right side. The atoms and charge are now balanced.
Step 9: Review the options given in the question based on the balanced equation. The I- : IO3- ratio is indeed 3:1, making option A correct.
Step 10: The MnO4- : I- ratio is 1:3, not 6:5, making option B incorrect.
Step 11: The MnO4- : Mn2+ ratio is 1:1, not 3:1, making option C incorrect.
Step 12: The H+ : I- ratio is 6:3 or 2:1, making option D also correct. However, since the question seems to imply a single correct answer and option A was directly verified through the balancing process, we prioritize it."
36,36,college_chemistry,"Nitronyl nitroxides are stable radicals in which the unpaired electron is coupled to two equivalent nitrogen nuclei. How many lines will appear in the EPR spectrum of a solution of a rigid nitronyl nitroxide diradical with J >> a? The options are: A) 3 lines, B) 9 lines, C) 5 lines, D) 7 lines",d,c,a,"['NO', 'NO', 'NO', 'NO', 'NO', 'NO', 'NO', 'NO', 'NO', 'NO', 'NO', 'NO']","Step 1: Understand the question. We are dealing with a nitronyl nitroxide diradical, which means there are two unpaired electrons, each coupled to two equivalent nitrogen nuclei. The condition J >> a indicates that the exchange interaction (J) is much larger than the hyperfine coupling constant (a), suggesting that the two unpaired electrons are strongly coupled to each other.
Step 2: Recall the formula for calculating the number of lines in an EPR spectrum due to hyperfine splitting, which is 2nI + 1, where n is the number of equivalent nuclei coupled to the unpaired electron, and I is the spin of the nuclei. For nitrogen, I = 1.
Step 3: Since the diradical is strongly coupled (J >> a), we treat the two unpaired electrons as a single entity. This means we consider the coupling of this entity to the four nitrogen nuclei (two from each radical part).
Step 4: However, because the electrons are strongly coupled, the hyperfine splitting due to each nitrogen nucleus will be the same for both electrons, effectively making the nitrogen nuclei equivalent in terms of EPR spectroscopy.
Step 5: Therefore, we calculate the number of lines as if there were two equivalent sets of nitrogen nuclei, each set containing two nuclei. This means n = 2 (for two sets of equivalent nuclei) and I = 1.
Step 6: Apply the formula 2nI + 1 with n = 2 and I = 1, which gives us 2*2*1 + 1 = 5 lines.","Step 1: Understand the question. We are dealing with a nitronyl nitroxide diradical, which means there are two unpaired electrons, each coupled to two equivalent nitrogen nuclei. The condition J >> a indicates that the exchange interaction (J) is much larger than the hyperfine coupling constant (a), suggesting that the two unpaired electrons are strongly coupled to each other. *<verified>*
Step 2: Recall the formula for calculating the number of lines in an EPR spectrum due to hyperfine splitting, which is 2nI + 1, where n is the number of equivalent nuclei coupled to the unpaired electron, and I is the spin of the nuclei. For nitrogen, I = 1. *<verified>*
Step 3: Since the diradical is strongly coupled (J >> a), we treat the two unpaired electrons as a single entity. This means we consider the coupling of this entity to the four nitrogen nuclei (two from each radical part). Applying the formula '2nI + 1' for calculating the number of lines in an EPR spectrum, where n=4 (the number of equivalent nitrogen nuclei) and I=1 (spin of the nitrogen nuclei), we get 2*4*1 + 1 = 9 lines. *<verified>*
Step 4: However, it's important to consider the effect of strong coupling (J >> a) on the EPR spectrum. In such cases, the individual hyperfine interactions can merge, leading to a simplified spectrum. *<verified>*
Step 5: Given the strong coupling between the two unpaired electrons, the system behaves more like a single entity with a total spin resulting from the combination of the two electron spins. *<verified>*
Step 6: The total spin of this entity, considering the strong coupling and assuming parallel spins for a triplet state, can be considered as S = 1, since each electron has a spin of 1/2 and their spins are aligned parallelly. *<verified>*
Step 7: For a system with a total spin S = 1, the possible mS values are -1, 0, and +1. This results in transitions that can be observed in the EPR spectrum.
Step 8: Considering the strong coupling and the total spin of S = 1, the hyperfine splitting due to the interaction with the nitrogen nuclei might not follow the simple '2nI + 1' rule strictly due to the merging of lines.
Step 9: The presence of strong coupling (J >> a) simplifies the spectrum, reducing the number of observable hyperfine lines.
Step 10: Given the simplification and the total spin of the system, the EPR spectrum is expected to show fewer lines than calculated by the simple hyperfine splitting formula for four equivalent nitrogen nuclei.
Step 11: The correct answer must reflect the effect of strong coupling on the EPR spectrum, leading to a simplified pattern due to the merging of hyperfine lines.
Step 12: Considering the strong coupling and the total spin state, the most reasonable expectation is that the EPR spectrum will show three lines corresponding to the transitions between the mS values of the total spin S = 1 system."
37,37,college_chemistry,"The magnetic moment (Î¼I) of an unknown nuclide is 2.884 x 10^-27 J T-1. Given the nuclear spin is known to be 1, identify the unknown nuclide. The options are: A) 14N, B) 2H, C) 19F, D) 6Li",b,b,b,"['NO', 'NO', 'NO', 'NO', 'NO', 'NO', 'NO', 'NO', 'NO', 'NO']","Step 1: Recall the formula for the magnetic moment of a nucleus, which is given by Î¼I = gI âˆ™ Î¼N âˆ™ I, where Î¼I is the magnetic moment, gI is the g-factor (or gyromagnetic ratio) for the nucleus, Î¼N is the nuclear magneton (5.050783699 Ã— 10^-27 J T^-1), and I is the nuclear spin.
Step 2: Given that I = 1 for the unknown nuclide, we can simplify the formula to Î¼I = gI âˆ™ Î¼N. This means we can calculate the g-factor for the unknown nuclide using the given magnetic moment and the value of the nuclear magneton.
Step 3: Rearrange the formula to solve for gI, which gives gI = Î¼I / Î¼N.
Step 4: Substitute the given values into the formula: gI = (2.884 Ã— 10^-27 J T^-1) / (5.050783699 Ã— 10^-27 J T^-1).
Step 5: Calculate gI, which gives gI = 0.571.
Step 6: Compare the calculated g-factor with known g-factors for the given options. The g-factor is a unique property of each nuclide, so the nuclide with a g-factor closest to the calculated value is the unknown nuclide.
Step 7: Known g-factors for the options are approximately: A) 14N: 0.403, B) 2H: 0.857, C) 19F: 5.257, D) 6Li: -0.822. The g-factor closest to the calculated value of 0.571 is for 2H (Deuterium).
Step 8: Therefore, the unknown nuclide is most likely 2H, given its g-factor is closest to the calculated value.","Step 1: Recall the formula for the magnetic moment of a nucleus, which is given by Î¼I = gI â‹… Î¼N â‹… I, where Î¼I is the magnetic moment, gI is the g-factor (or gyromagnetic ratio) for the nucleus, Î¼N is the nuclear magneton (5.050783699 Ã— 10^-27 J T^-1), and I is the nuclear spin. *<verified>*
Step 2: Given that I = 1 for the unknown nuclide, we can simplify the formula to Î¼I = gI â‹… Î¼N. To calculate the g-factor for the unknown nuclide, we use the formula gI = Î¼I / Î¼N, where Î¼I is the given magnetic moment (2.884 x 10^-27 J T^-1) and Î¼N is the nuclear magneton (5.050783699 Ã— 10^-27 J T^-1). *<verified>*
Step 3: Substitute the given values into the formula to find the g-factor: gI = (2.884 x 10^-27 J T^-1) / (5.050783699 Ã— 10^-27 J T^-1). *<verified>*
Step 4: Calculate the g-factor: gI = 0.571. *<verified>*
Step 5: Compare the calculated g-factor (0.571) with the typical g-factors for the given nuclides: A) 14N, B) 2H, C) 19F, D) 6Li. [Here, insert the typical g-factors for each nuclide and identify which one matches or is closest to the calculated g-factor, then conclude the identity of the unknown nuclide.] *<verified>*
Step 6: The typical g-factors for the given nuclides are approximately: A) 14N: 0.403, B) 2H: 0.857, C) 19F: 5.257, D) 6Li: 0.822. *<verified>*
Step 7: Compare the calculated g-factor (0.571) with the typical g-factors of the given nuclides. *<verified>*
Step 8: The g-factor of 0.571 is closest to that of 2H (0.857) among the options provided, considering the numerical difference between the calculated g-factor and the typical g-factors of the given nuclides. *<verified>*
Step 9: Since the g-factor calculated from the magnetic moment and nuclear spin matches most closely with that of 2H (deuterium), we can conclude that the unknown nuclide is most likely 2H based on the given options and the calculated g-factor.
Step 10: Therefore, the correct option, based on the closest g-factor match to the calculated value, is B) 2H."
38,38,college_chemistry,"Which of the following is a true statement about optical isomerism of complexes containing achiral ligands? The options are: A) Square planar complexes can display optical isomerism only if all four ligands are identical., B) Tetrahedral complexes never display optical isomerism., C) Linear complexes can display optical isomerism when both ligands are different., D) Octahedral complexes of monodentate ligands can display optical isomerism only when they have at least three different ligands.",d,d,none of the options accurately describe the conditions for optical isomerism in complexes containing achiral ligands.,"['NO', 'NO', 'NO', 'NO', 'NO', 'NO', 'NO']","Step 1: Understand what optical isomerism means. Optical isomerism occurs when a molecule has a non-superimposable mirror image, also known as a chiral molecule. This property allows the molecule to rotate plane-polarized light, which is the basis of optical activity.
Step 2: Analyze option A. Square planar complexes can indeed display optical isomerism, but not only when all four ligands are identical. In fact, having all identical ligands would make it impossible for the complex to be chiral, as there would be no way to create a non-superimposable mirror image. Thus, option A is incorrect.
Step 3: Consider option B. Tetrahedral complexes can display optical isomerism if they have four different ligands, creating a chiral center. Therefore, the statement that tetrahedral complexes never display optical isomerism is incorrect.
Step 4: Evaluate option C. Linear complexes, by definition, cannot display optical isomerism because they do not have a center of chirality. The spatial arrangement of only two ligands, regardless of their identity, does not allow for non-superimposable mirror images. Thus, option C is incorrect.
Step 5: Examine option D. Octahedral complexes with monodentate ligands can display optical isomerism, but not only when they have at least three different ligands. In fact, an octahedral complex can exhibit optical isomerism with as few as two types of ligands, provided they are arranged in such a way as to create a non-superimposable mirror image (e.g., cis-trans isomerism in octahedral complexes). However, the statement is somewhat misleading because it suggests a minimum requirement that isn't strictly true for optical isomerism. The more accurate condition would involve specific arrangements of ligands rather than just their count. However, among the given options and considering the general understanding of optical isomerism in coordination chemistry, option D is the closest to a true statement, albeit with nuances not fully captured in the option.","Step 1: Understand what optical isomerism means. Optical isomerism occurs when a molecule has a non-superimposable mirror image, also known as a chiral molecule. This property allows the molecule to rotate plane-polarized light, which is the basis of optical activity. *<verified>*
Step 2: Analyze option A. Square planar complexes generally do not display optical isomerism because they are symmetrical and cannot form non-superimposable mirror images. The statement that square planar complexes can display optical isomerism only if all four ligands are identical is incorrect, not because of the reason provided, but because square planar complexes, in general, do not exhibit optical isomerism regardless of the ligands' identity. *<verified>*
Step 3: Analyze option B. Tetrahedral complexes can display optical isomerism if they have four different ligands, making them chiral. Therefore, the statement that tetrahedral complexes never display optical isomerism is incorrect. *<verified>*
Step 4: Analyze option C. Linear complexes, due to their geometry, cannot be chiral as they will always be superimposable on their mirror images. Therefore, they cannot display optical isomerism, making this option incorrect. *<verified>*
Step 5: Analyze option D. Octahedral complexes with monodentate ligands can display optical isomerism, but the condition for optical isomerism is not accurately described by the requirement of having at least three different ligands. Optical isomerism in octahedral complexes is more about the spatial arrangement that creates non-superimposable mirror images, which can be achieved even with two types of ligands if arranged in a chiral manner. The mention of cis-trans isomerism is incorrect in the context of optical isomerism, as cis-trans isomerism pertains to geometrical isomerism. *<verified>*
Step 6: Re-evaluate option D in light of the correct understanding of optical isomerism. For octahedral complexes to exhibit optical isomerism, it is not strictly necessary to have at least three different ligands. The key is the arrangement of the ligands in such a way that it results in a non-superimposable mirror image. This can occur, for example, with two types of ligands arranged in a specific manner that breaks any plane of symmetry and creates chirality. Therefore, the statement in option D is not entirely accurate regarding the requirements for optical isomerism in octahedral complexes.
Step 7: Conclude that none of the provided options accurately describe the conditions under which optical isomerism occurs in complexes containing achiral ligands. The correct understanding of optical isomerism involves the spatial arrangement and the presence of non-superimposable mirror images, which was not correctly captured by any of the options."
39,39,college_chemistry,"The 99Ru chemical shift of [Ru(H2O)6]2+ is 16,050 ppm relative to [Ru(CN)6]2- at 0 ppm. The electronic excitation energies of [Ru(H2O)6]2+, [Ru(CN)6]2- and [Ru(NH3)6]2+ are 18,900, 40,000 and 25,600 cm-1 respectively. Assuming that the chemical shift differences are dominated by paramagnetic currents, determine the chemical shift of [Ru(NH3)6]2+. The options are: A) 7,530 ppm, B) 8,090 ppm, C) 11,070 ppm, D) 14,840 ppm",b,c,b,"['NO', 'NO', 'NO', 'NO', 'NO', 'NO', 'NO', 'NO', 'NO', 'NO', 'NO', 'NO']","step 1: Understand that the chemical shift differences are assumed to be dominated by paramagnetic currents, which are inversely proportional to the square of the electronic excitation energy (E). This means we can use the formula Î”Ïƒ âˆ 1/E^2 to compare the chemical shifts of different complexes.
step 2: Calculate the inverse square of the electronic excitation energy for [Ru(H2O)6]2+ using its given energy of 18,900 cm-1. This is (1/(18,900)^2).
step 3: Calculate the inverse square of the electronic excitation energy for [Ru(CN)6]2- using its given energy of 40,000 cm-1. This is (1/(40,000)^2).
step 4: Calculate the inverse square of the electronic excitation energy for [Ru(NH3)6]2+ using its given energy of 25,600 cm-1. This is (1/(25,600)^2).
step 5: Determine the ratio of the inverse squares for [Ru(H2O)6]2+ and [Ru(CN)6]2-. This ratio will be used as a reference to calculate the chemical shift of [Ru(NH3)6]2+.
step 6: Calculate the ratio of the inverse squares for [Ru(NH3)6]2+ and [Ru(CN)6]2-. This will give us the relative chemical shift difference between [Ru(NH3)6]2+ and [Ru(CN)6]2-.
step 7: Use the ratio from step 5 and the known chemical shift of [Ru(H2O)6]2+ (16,050 ppm) to determine the chemical shift of [Ru(NH3)6]2+ relative to [Ru(CN)6]2-.
step 8: Apply the calculated ratios to find the chemical shift of [Ru(NH3)6]2+.","Step 1: Understand that the chemical shift differences are assumed to be dominated by paramagnetic currents, which are inversely proportional to the square of the electronic excitation energy (E). This means we can use the formula Î”Ïƒ âˆ 1/E^2 to compare the chemical shifts of different complexes. *<verified>*
Step 2: Calculate the inverse square of the electronic excitation energy for [Ru(H2O)6]2+ using its given energy of 18,900 cm-1. This is (1/(18,900)^2). *<verified>*
Step 3: Calculate the inverse square of the electronic excitation energy for [Ru(CN)6]2- using its given energy of 40,000 cm-1. This is (1/(40,000)^2). *<verified>*
Step 4: Calculate the inverse square of the electronic excitation energy for [Ru(NH3)6]2+ using its given energy of 25,600 cm-1. This is (1/(25,600)^2). *<verified>*
Step 5: Determine the ratio of the inverse squares for [Ru(H2O)6]2+ and [Ru(CN)6]2-. This ratio will be used as a reference to calculate the chemical shift of [Ru(NH3)6]2+. *<verified>*
Step 6: Calculate the ratio of the inverse squares for [Ru(NH3)6]2+ and [Ru(CN)6]2-. This will give us the relative chemical shift difference between [Ru(NH3)6]2+ and [Ru(CN)6]2-. *<verified>*
Step 7: Use the ratio from step 5 and the known chemical shift of [Ru(H2O)6]2+ (16,050 ppm) to determine the chemical shift of [Ru(NH3)6]2+ relative to [Ru(CN)6]2-. *<verified>*
Step 8: Use the ratio calculated in step 6 and apply it to the known chemical shift of [Ru(H2O)6]2+ (16,050 ppm) to find the chemical shift of [Ru(NH3)6]2+. This involves multiplying the ratio by 16,050 ppm to get the chemical shift of [Ru(NH3)6]2+ relative to [Ru(CN)6]2-. *<verified>*
Step 9: Calculate the actual ratio values from steps 5 and 6. For [Ru(H2O)6]2+, the ratio is (1/(18,900)^2) / (1/(40,000)^2). For [Ru(NH3)6]2+, the ratio is (1/(25,600)^2) / (1/(40,000)^2).
Step 10: Use these ratios to find the proportional chemical shifts. Since [Ru(H2O)6]2+ has a chemical shift of 16,050 ppm, we can use the ratio from step 9 to calculate the chemical shift of [Ru(NH3)6]2+.
Step 11: After calculating the proportional chemical shifts using the ratios, compare the result to the options provided to find the closest match.
Step 12: The calculation will show that the chemical shift of [Ru(NH3)6]2+ is closest to option B) 8,090 ppm."
