,CaseID,Category,Question,Correct Answer,Raw COT Answer,Corrected COT Answer,Hallu Seq,raw_cot,corrected_cot
97,97,formal_logic," Construct a complete truth table for the following argument. Then, using the truth table, determine whether the argument is valid or invalid. If the argument is invalid, choose an option which presents a counterexample. (There may be other counterexamples as well.)
~X ⊃ Y
Y ⊃ Z
~Z / ~X The options are: A) Valid, B) Invalid. Counterexample when X, Y, and Z are true, C) Invalid. Counterexample when Y and Z are true and Z is false, D) Invalid. Counterexample when X is true and Y and Z are false",d,a,a,"['NO', 'NO', 'NO', 'NO', 'NO', 'NO', 'NO', 'NO', 'NO']","step 1: Identify the premises and conclusion. The premises are ~X ⊃ Y and Y ⊃ Z, and the conclusion is ~X. 
step 2: Construct a truth table that includes all combinations of truth values for X, Y, and Z. There are 2^3 = 8 combinations because there are three variables. 
step 3: Evaluate the truth values of the premises (~X ⊃ Y and Y ⊃ Z) and the conclusion (~X) for each combination of X, Y, and Z. 
step 4: Look for rows where both premises are true but the conclusion is false. If such a row exists, the argument is invalid, and that row represents a counterexample. 
step 5: If no such row exists (i.e., every time the premises are true, the conclusion is also true), then the argument is valid. 
step 6: After constructing and analyzing the truth table, it's found that there is no row where both premises are true and the conclusion is false, indicating that the argument is valid. Therefore, the correct option is A) Valid.","Step 1: Identify the premises and conclusion. The premises are ~X ⊃ Y and Y ⊃ Z, and the conclusion is, given ~Z, conclude ~X. *<verified>*
Step 2: Construct a truth table for all possible truth values of X, Y, and Z, resulting in 2^3 = 8 different rows. Then, use the truth table to determine whether the argument (~X ⊃ Y, Y ⊃ Z, ~Z / ~X) is valid or invalid. If invalid, identify a counterexample. *<verified>*
Step 3: For each row in the truth table, evaluate the truth value of the premises and the conclusion based on the truth values of X, Y, and Z. *<verified>*
Step 4: The first premise ~X ⊃ Y means if X is false, then Y must be true. If X is true, Y can be either true or false. *<verified>*
Step 5: The second premise Y ⊃ Z means if Y is true, then Z must be true. If Y is false, Z can be either true or false. *<verified>*
Step 6: The conclusion ~Z / ~X means if Z is false, then we can conclude ~X is true, which means X must be false. *<verified>*
Step 7: Analyze the truth table to find rows where both premises are true but the conclusion is false, as these rows represent potential counterexamples to the argument's validity. *<verified>*
Step 8: If there are no such rows, the argument is valid. If there are rows where both premises are true and the conclusion is false, the argument is invalid, and those rows are counterexamples. *<verified>*
Step 9: Upon analysis, no row where both premises (~X ⊃ Y and Y ⊃ Z) are true and the conclusion (~Z / ~X) is false can be found, because for the premises to hold true, if Z is false (~Z is true), then Y must also be false to maintain the truth of Y ⊃ Z. This directly contradicts the scenario where Y is assumed to be true when Z is false. Therefore, the argument is valid, as there are no counterexamples to its validity. *<verified>*"
98,98,formal_logic,"Select the best translation into predicate logic. David teaches Chris. (c: Chris; d: David; Txy: x teaches y) The options are: A) Tdc, B) Tcd, C) Tcc, D) dTc",a,b,b,"['NO', 'NO', 'NO', 'NO', 'NO']","step 1: Identify the subject and the object in the sentence. In 'David teaches Chris', David is the subject (the one doing the teaching) and Chris is the object (the one being taught).
step 2: Match the subject and object with their respective symbols. David is represented by 'd' and Chris is represented by 'c'.
step 3: Understand the predicate 'Txy', which means 'x teaches y'. This indicates that the first variable (x) is the teacher and the second variable (y) is the student.
step 4: Apply the information from steps 1-3 to select the correct translation. Since David (d) is teaching Chris (c), David should be the first variable and Chris should be the second variable in the predicate 'Txy'.
step 5: From the given options, select the one that correctly places David as the first variable and Chris as the second variable in the predicate 'Txy'.","step 1: Identify the subject and the object in the sentence. In 'David teaches Chris', David is the subject (the one doing the teaching) and Chris is the object (the one being taught).
step 2: Match the subject and object with their respective symbols. David is represented by 'd' and Chris is represented by 'c'.
step 3: Understand the predicate 'Txy', which means 'x teaches y'. This indicates that the first variable (x) is the teacher and the second variable (y) is the student.
step 4: Apply the information from steps 1-3 to select the correct translation. Since David (d) is teaching Chris (c), David should be the first variable and Chris should be the second variable in the predicate 'Txy'.
step 5: From the given options, select the one that correctly places David as the first variable and Chris as the second variable in the predicate 'Txy'."
99,99,formal_logic," Construct a complete truth table for the following argument. Then, using the truth table, determine whether the argument is valid or invalid. If the argument is invalid, choose an option which presents a counterexample. (There may be other counterexamples as well.)
~X ⊃ Y
Y ⊃ Z
~Z / ~X The options are: A) Valid, B) Invalid. Counterexample when X, Y, and Z are true, C) Invalid. Counterexample when Y and Z are true and Z is false, D) Invalid. Counterexample when X is true and Y and Z are false",d,a,a,"['NO', 'NO', 'NO', 'NO', 'NO', 'NO', 'NO', 'NO', 'NO', 'NO']","step 1: Identify the premises and conclusion. The premises are '~X ⊃ Y' and 'Y ⊃ Z', and the conclusion is '~X'.
step 2: Construct a truth table that includes all combinations of truth values for X, Y, and Z. This means we need 2^3 = 8 rows for all possible combinations.
step 3: Evaluate the truth values of the premises and the conclusion for each row. The material conditional (⊃) is false only when the antecedent is true and the consequent is false; otherwise, it is true.
step 4: Look for rows where both premises are true but the conclusion is false. These rows would indicate a counterexample, showing the argument is invalid.
step 5: If no such row exists, the argument is valid.
step 6: Construct the truth table:
X | Y | Z | ~X | ~X ⊃ Y | Y ⊃ Z | Conclusion (~X)
T | T | T | F  | T       | T     | F
T | T | F | F  | T       | F     | F
T | F | T | F  | T       | T     | F
T | F | F | F  | T       | T     | F
F | T | T | T  | T       | T     | T
F | T | F | T  | T       | F     | T
F | F | T | T  | F       | T     | T
F | F | F | T  | F       | T     | T
step 7: Analyze the truth table. The argument is valid if and only if, whenever both premises are true, the conclusion is also true. From the table, we see that there is no row where both premises are true and the conclusion is false.
step 8: Therefore, the argument is valid because there is no counterexample where both premises are true and the conclusion is false.","Step 1: Identify the premises and conclusion correctly. The premises are '~X ⊃ Y' and 'Y ⊃ Z', and the correct conclusion, based on the argument structure provided in the question, should be '~Z / ~X'. *<verified>*
Step 2: Construct a truth table that includes all possible combinations of truth values for X, Y, and Z. This results in 2^3 = 8 different combinations because there are three variables. Use the truth table to assess the validity of the argument given the premises '~X ⊃ Y', 'Y ⊃ Z', and the conclusion '~Z / ~X'. *<verified>*
Step 3: Evaluate the truth values of the premises and the conclusion for each combination of truth values for X, Y, and Z. This involves applying the truth conditions for the material conditional (⊃), where 'P ⊃ Q' is false only when P is true and Q is false, and true in all other cases. *<verified>*
Step 4: Identify any rows in the truth table where both premises are true. These rows are critical for assessing the validity of the argument, as an argument is valid if and only if it is impossible for the premises to be true and the conclusion false. *<verified>*
Step 5: For each row identified in Step 4, check whether the conclusion '~Z ⊃ ~X' is also true. If there are any rows where the premises are true and the conclusion is false, the argument is invalid. *<verified>*
Step 6: Realize that the conclusion should be directly '~Z / ~X', not '~Z ⊃ ~X' as mistakenly mentioned in Step 5. The correct interpretation of the conclusion is that if Z is false, then X must be false. *<verified>*
Step 7: Correct the evaluation in Step 5 according to the proper understanding of the conclusion. This involves checking if, in rows where both premises are true, the conclusion that if Z is false then X must also be false holds. *<verified>*
Step 8: Identify that in all rows where both premises are true, the conclusion also holds true. This means that there are no instances where the premises are true and the conclusion is false. *<verified>*
Step 9: Conclude that since there are no counterexamples where the premises are true and the conclusion is false, the argument is valid. *<verified>*
Step 10: Since the argument is valid, there is no need to select a counterexample from the options provided. The correct answer is that the argument is valid. *<verified>*"
100,100,formal_logic," Which of the given formulas of PL is the best symbolization of the following sentence?
Either England's importing beef is a sufficient condition for France's subsidizing agriculture, or China doesn't promote human rights when and only when South Africa supplies diamonds. The options are: A) (E ⊃ F) ∨ (~C ⊃ S), B) (F ⊃ E) ∨ (S ⊃ ~C, C) (E ⊃ F) ∨ ~(S ≡ C), D) (E ⊃ F) ∨ (~C ≡ S)",d,c,c,"['NO', 'NO', 'NO', 'NO', 'NO']","step 1: Break down the sentence into its logical components. The sentence has a main disjunction ('either...or') indicating two separate conditions. The first condition is 'England's importing beef is a sufficient condition for France's subsidizing agriculture', and the second condition is 'China doesn't promote human rights when and only when South Africa supplies diamonds'.
step 2: Symbolize the first condition. A sufficient condition can be symbolized using the material implication (⊃). Thus, 'England's importing beef is a sufficient condition for France's subsidizing agriculture' can be symbolized as E ⊃ F.
step 3: Symbolize the second condition. The phrase 'when and only when' indicates a biconditional relationship, symbolized by (≡). However, it's important to note the negation concerning China's action. Thus, 'China doesn't promote human rights when and only when South Africa supplies diamonds' translates to ~(C ≡ S), where the negation applies to the entire biconditional statement.
step 4: Combine the two conditions with the disjunction as indicated by the original sentence. This gives us (E ⊃ F) ∨ ~(C ≡ S).
step 5: Match the symbolization with the given options. The correct symbolization, (E ⊃ F) ∨ ~(C ≡ S), matches with option C.","step 1: Break down the sentence into its logical components. The sentence has a main disjunction ('either...or') indicating two separate conditions. The first condition is 'England's importing beef is a sufficient condition for France's subsidizing agriculture', and the second condition is 'China doesn't promote human rights when and only when South Africa supplies diamonds'.
step 2: Symbolize the first condition. A sufficient condition can be symbolized using the material implication (⊃). Thus, 'England's importing beef is a sufficient condition for France's subsidizing agriculture' can be symbolized as E ⊃ F.
step 3: Symbolize the second condition. The phrase 'when and only when' indicates a biconditional relationship, symbolized by (≡). However, it's important to note the negation concerning China's action. Thus, 'China doesn't promote human rights when and only when South Africa supplies diamonds' translates to ~(C ≡ S), where the negation applies to the entire biconditional statement.
step 4: Combine the two conditions with the disjunction as indicated by the original sentence. This gives us (E ⊃ F) ∨ ~(C ≡ S).
step 5: Match the symbolization with the given options. The correct symbolization, (E ⊃ F) ∨ ~(C ≡ S), matches with option C."
101,101,formal_logic," Construct a complete truth table for the following argument. Then, using the truth table, determine whether the argument is valid or invalid. If the argument is invalid, choose an option which presents a counterexample. (There may be other counterexamples as well.)
P ⊃ Q
Q · R / ~P · R The options are: A) Valid, B) Invalid. Counterexample when P, R, and Q are true, C) Invalid. Counterexample when P and Q are true and R is false, D) Invalid. Counterexample when R and Q are true and P is false",b,a,a,"['NO', 'NO', 'NO', 'NO', 'NO', 'NO', 'NO']","step 1: Identify the premises and conclusion. The premises are 'P ⊃ Q' (if P then Q) and 'Q · R' (Q and R). The conclusion is '~P · R' (not P and R).
step 2: Construct a truth table that includes all combinations of truth values for P, Q, and R. This will result in 2^3 = 8 rows because there are three variables.
step 3: For each row, calculate the truth value of the premises and the conclusion. 'P ⊃ Q' is false only when P is true and Q is false; otherwise, it is true. 'Q · R' is true only when both Q and R are true. '~P · R' is true when P is false and R is true.
step 4: Check if there are any rows where both premises are true and the conclusion is false. If such a row exists, the argument is invalid.
step 5: Analyze the truth table.
- When P is true, Q is true, and R is true, 'P ⊃ Q' is true, 'Q · R' is true, but '~P · R' is false because P is not false.
- When P is false, Q is true, and R is true, all conditions are satisfied, making the argument seem valid in this scenario.
- However, the argument's validity depends on finding a row where both premises are true and the conclusion is false.
step 6: Upon closer inspection, there is no row where both premises are true and the conclusion is false, because whenever 'Q · R' is true, and 'P ⊃ Q' is true, '~P · R' also turns out to be true if P is false.
step 7: Conclude that the argument is valid because there is no scenario (row in the truth table) where both premises are true and the conclusion is false.","step 1: Identify the premises and conclusion. The premises are 'P ⊃ Q' (if P then Q) and 'Q · R' (Q and R). The conclusion is '~P · R' (not P and R).
step 2: Construct a truth table that includes all combinations of truth values for P, Q, and R. This will result in 2^3 = 8 rows because there are three variables.
step 3: For each row, calculate the truth value of the premises and the conclusion. 'P ⊃ Q' is false only when P is true and Q is false; otherwise, it is true. 'Q · R' is true only when both Q and R are true. '~P · R' is true when P is false and R is true.
step 4: Check if there are any rows where both premises are true and the conclusion is false. If such a row exists, the argument is invalid.
step 5: Analyze the truth table.
- When P is true, Q is true, and R is true, 'P ⊃ Q' is true, 'Q · R' is true, but '~P · R' is false because P is not false.
- When P is false, Q is true, and R is true, all conditions are satisfied, making the argument seem valid in this scenario.
- However, the argument's validity depends on finding a row where both premises are true and the conclusion is false.
step 6: Upon closer inspection, there is no row where both premises are true and the conclusion is false, because whenever 'Q · R' is true, and 'P ⊃ Q' is true, '~P · R' also turns out to be true if P is false.
step 7: Conclude that the argument is valid because there is no scenario (row in the truth table) where both premises are true and the conclusion is false."
102,102,formal_logic,"Use indirect truth tables to determine whether the following argument is valid. If the argument is invalid, choose an option which presents a counterexample. (There may be other counterexamples as well.)
H ≡ (~I ∨ J)
H ∨ ~J / ~I The options are: A) Valid, B) Invalid. Counterexample when H, I, and J are false, C) Invalid. Counterexample when H and I are true and J is false, D) Invalid. Counterexample when I is true and H and J are false",d,d,d,"['NO', 'NO', 'NO', 'NO', 'NO', 'NO', 'NO', 'NO', 'NO', 'NO', 'NO', 'NO']","Step 1: Understand the argument structure. The argument is H ≡ (~I ∨ J), H ∨ ~J / ~I. This means if H is equivalent to (~I ∨ J), and either H or not J is true, then not I must be true.
Step 2: Set up the indirect truth table. We start by assuming the conclusion (~I) is false, meaning I is true. We're looking for a scenario where the premises are true but the conclusion is false, which would make the argument invalid.
Step 3: Since we've assumed I is true, for H ≡ (~I ∨ J) to hold, J must also be true because ~I is false (due to I being true), and for H to be equivalent to (~I ∨ J), J must be true if I is true.
Step 4: Given H ∨ ~J, and knowing J is true (from step 3), ~J is false. For the disjunction (H ∨ ~J) to be true, H must be true because ~J is false.
Step 5: Now, we have H is true, I is true, and J is true. This setup satisfies the premises but contradicts our assumption that the conclusion (~I) is true (since we assumed I is true, making ~I false).
Step 6: Since we found a scenario where the premises are true but the conclusion is false (contrary to our initial assumption), the argument is invalid.
Step 7: The counterexample that makes the argument invalid is when I is true and H and J are true, which does not match any of the provided options directly. However, the closest option that reflects an invalid scenario based on our analysis is 'Invalid. Counterexample when I is true and H and J are false', even though our analysis led to H and J being true for the argument to be invalid. It seems there was a mistake in the analysis as the correct interpretation should focus on finding a scenario that directly contradicts the conclusion while satisfying the premises.","Step 1: Understand the argument structure. The argument is H ≡ (~I ∨ J), H ∨ ~J / ~I. This means if H is equivalent to (~I ∨ J), and either H or not J is true, then not I must be true. *<verified>*
Step 2: Set up the indirect truth table. We start by assuming the conclusion (~I) is false, meaning I is true. We're looking for a scenario where the premises are true but the conclusion is false, which would make the argument invalid. *<verified>*
Step 3: Since we've assumed I is true, for H ≡ (~I ∨ J) to hold, it is not necessary for J to also be true. The condition (~I ∨ J) can be satisfied by either ~I being true or J being true. Since we have assumed I is true (making ~I false), the truth value of J does not directly influence the equivalence as long as H and the overall expression (~I ∨ J) maintain consistency with the truth values of I and J. *<verified>*
Step 4: Given that I is true, let's consider the premise H ∨ ~J. For this premise to be true, either H must be true or J must be false (since ~J would then be true). This premise does not directly determine the truth value of H but restricts J to being false if H is not true. *<verified>*
Step 5: If J is false and I is true, then the expression (~I ∨ J) evaluates to false. For H to be equivalent to (~I ∨ J), H must also be false under these conditions. *<verified>*
Step 6: With H false, I true, and J false, the premise H ∨ ~J is true (since ~J is true). The premise H ≡ (~I ∨ J) is also true because both sides of the equivalence are false. *<verified>*
Step 7: However, the conclusion we are trying to disprove is ~I, which we assumed to be false (meaning I is true). Under the conditions where H is false, I is true, and J is false, the premises are true and the conclusion (~I) is false, which does not indicate the argument is invalid. Instead, this scenario does not provide a counterexample to the argument's validity because it does not present a case where the premises are true and the conclusion is false simultaneously. Therefore, the argument might still be valid. *<verified>*
Step 8: To further test the argument's validity, we need to consider all possible truth values for H, I, and J that satisfy the premises but not the conclusion. However, the analysis in steps 1-7 has already shown a scenario where the premises are true and the conclusion is false is not found, suggesting the argument could be valid.
Step 9: Since the indirect truth table method involves looking for a counterexample to prove invalidity and no such counterexample has been found in the steps followed, the argument stands as potentially valid.
Step 10: Given the absence of a counterexample in the analysis, and considering the logical structure of the argument, it is reasonable to conclude that the argument is valid because it does not violate the conditions of logical validity.
Step 11: Reviewing the options provided for the answer, the correct choice would be the one that aligns with the argument being valid.
Step 12: Therefore, the correct option is A) Valid."
103,103,formal_logic,"Identify the antecedent of the following conditional proposition: The Bees win their first game only if either the Aardvarks or the Chipmunks do not win their first games. The options are: A) The Aardvarks do not win their first game., B) The Bees win their first game., C) The Chipmunks do not win their first game., D) Either the Aardvarks or the Chipmunks do not win their first games.",b,d,d,"['NO', 'NO', 'NO', 'NO', 'NO', 'NO', 'NO', 'NO', 'NO', 'NO']","step 1: Understand the structure of a conditional proposition, which is typically in the form 'If P, then Q', where P is the antecedent and Q is the consequent.
step 2: Identify the conditional proposition in the given statement: 'The Bees win their first game only if either the Aardvarks or the Chipmunks do not win their first games.'
step 3: Recognize that 'only if' indicates the condition necessary for the consequent to occur, making the part after 'only if' the consequent.
step 4: Determine that 'The Bees win their first game' is the part of the statement that depends on the condition, making it the consequent.
step 5: Conclude that the antecedent is the condition necessary for the consequent to happen, which is 'either the Aardvarks or the Chipmunks do not win their first games.'
step 6: Match the identified antecedent with the given options.","Step 1: Understand the structure of a conditional proposition, which is typically in the form 'If P, then Q', where P is the antecedent and Q is the consequent. *<verified>*
Step 2: Identify the conditional proposition in the given statement: 'The Bees win their first game only if either the Aardvarks or the Chipmunks do not win their first games.' *<verified>*
Step 3: Recognize that 'only if' indicates the condition necessary for the consequent to occur, making the part after 'only if' the consequent. *<verified>*
Step 4: Determine that 'Either the Aardvarks or the Chipmunks do not win their first games' is the condition necessary for the Bees to win their first game, making it the antecedent. *<verified>*
Step 5: Realize there was a misunderstanding in Step 4; 'only if' actually makes the statement before it the consequent, not the antecedent. *<verified>*
Step 6: Correctly identify 'The Bees win their first game' as the consequent of the conditional proposition. *<verified>*
Step 7: Correctly identify 'Either the Aardvarks or the Chipmunks do not win their first games' as the antecedent of the conditional proposition. *<verified>*
Step 8: Review the options provided in the question to match the antecedent identified in Step 7.
Step 9: Recognize that option D) 'Either the Aardvarks or the Chipmunks do not win their first games.' directly matches the antecedent identified.
Step 10: Conclude that option D is the correct answer as it accurately represents the antecedent of the conditional proposition."
