,CaseID,Question,Correct Answer,COT Answer,Hallu Seq
0,145,"a furniture manufacturer has two machines , but only one can be used at a time . machine w is utilized during the first shift and machine b during the second shift , while both work half of the third shift . if machine w can do the job in 12 days working two shifts and machine b can do the job in 15 days working two shifts , how many days will it take to do the job with the current work schedule ? The options are: a ) 14 , b ) 13 , c ) 11 , d ) 9 , e ) 7",d,d,"[('YES', 'N/A'), ('YES', 'YES'), ('YES', 'YES'), ('YES', 'YES'), ('YES', 'YES'), ('YES', 'YES'), ('YES', 'YES'), ('YES', 'YES')]"
1,146,"what will be the remainder when 17 ^ 200 is divided by 18 ? The options are: a ) 3 , b ) 8 , c ) 5 , d ) 1 , e ) 7",d,d,"[('YES', 'N/A'), ('YES', 'YES'), ('YES', 'YES'), ('YES', 'YES'), ('YES', 'YES'), ('YES', 'YES')]"
2,147,"a is two years older than b who is twice as old as c . if the total ages of a , b and c be 27 . what is the age of b ? The options are: a ) 12 years , b ) 10 years , c ) 8 years , d ) 14 years , e ) 16 years",b,b,"[('YES', 'N/A'), ('YES', 'YES'), ('YES', 'YES'), ('YES', 'YES'), ('YES', 'YES'), ('YES', 'YES'), ('YES', 'YES'), ('YES', 'YES'), ('YES', 'YES')]"
3,148,"s is a positive integer and multiple of 2 ; p = 4 ^ s , what is the remainder when p is divided by 10 ? The options are: a ) 10 , b ) 6 , c ) 4 , d ) 0 , e ) it can not be determined",b,b,"[('YES', 'N/A'), ('YES', 'N/A'), ('YES', 'YES'), ('YES', 'YES'), ('NO', 'NO'), ('YES', 'YES')]"
4,149,"there is a lot of speculation that the economy of a country depends on how fast people spend their money in addition to how much they save . auggie was very curious to test this theory . auggie spent all of his money in 5 stores . in each store , he spent rs . 4 more than one - half of what he had when he went in . how many rupees did auggie have when he entered the first store ? The options are: a ) 248 , b ) 120 , c ) 252 , d ) 250 , e ) 350",a,a,"[('YES', 'N/A'), ('YES', 'YES'), ('NO', 'NO'), ('YES', 'YES'), ('YES', 'YES'), ('YES', 'YES'), ('YES', 'YES'), ('YES', 'YES'), ('YES', 'YES')]"
