Category,Question,Correct_Answer,Output_Answer,Consistency,Cot,Final_Answer
moral_scenarios,"For which of these two scenarios does the main character (who uses I/me/my) do something clearly morally wrong, according to ordinary moral standards in the US as of 2020? Scenario 1 | I get good grades because I do my homework. Scenario 2 | My sister asked me not to wear her jersey, so I just left it in her closet. The options are: A) Wrong, Wrong, B) Wrong, Not wrong, C) Not wrong, Wrong, D) Not wrong, Not wrong",D,"D) Not wrong, Not wrong",True,,"D) Not wrong, Not wrong"
machine_learning,"Statement 1| We learn a classifier f by boosting weak learners h. The functional form of f’s decision boundary is the same as h’s, but with different parameters. (e.g., if h was a linear classifier, then f is also a linear classifier). Statement 2| Cross validation can be used to select the number of iterations in boosting; this procedure may help reduce overfitting. The options are: A) True, True, B) False, False, C) True, False, D) False, True",D,D,True,,D
abstract_algebra,"Statement 1 | If a R is an integral domain, then R[x] is an integral domain. Statement 2 | If R is a ring and f(x) and g(x) are in R[x], then deg (f(x)g(x)) = deg f(x) + deg g(x). The options are: A) True, True, B) False, False, C) True, False, D) False, True",C,A,True,,A
moral_scenarios,"For which of these two scenarios does the main character (who uses I/me/my) do something clearly morally wrong, according to ordinary moral standards in the US as of 2020? Scenario 1 | I took the fox into the woods and released it out of its cage. Scenario 2 | On my mom's birthday card I wrote she looked so old. The options are: A) Wrong, Wrong, B) Wrong, Not wrong, C) Not wrong, Wrong, D) Not wrong, Not wrong",C,C,True,,C
high_school_computer_science,"What is the output of ""abc""[-1] in Python 3? The options are: A) Error, B) a, C) b, D) c",D,D,True,,D
high_school_government_and_politics,"The term ""iron triangle"" refers to the interrelationship of the The options are: A) president, Congress, and the Supreme Court, B) electorate, Congress, and political action committees, C) local, state, and federal governments, D) federal bureaucracy, congressional committees, and lobbyists",D,D,True,,D
professional_law,"The police requested consent from a wife to search the mutual bedroom of her and her husband. The husband was out of town. The police were looking for evidence of the husband's suspected activities in a major drug trafficking plot. The wife gave her voluntary consent to the search. The police found a kilo of cocaine in a dresser drawer and various written notes that contained the names and phone numbers of co-conspirators. After the husband was arrested, he moved for suppression of all of the evidence seized in his bedroom. Will the court likely deny the motion due to the voluntary consent given by the wife? The options are: A) No, the search was unconstitutional because a wife cannot give consent for her husband., B) No, the search was unconstitutional because the items were under the husband's control and the wife therefore had no authority to give consent., C) Yes, the search was proper because one who possesses joint authority over property can validly consent on behalf of the absent occupant., D) The search was unconstitutional because the police did not have a search warrant.",C,C,True,,C
elementary_mathematics,"A store manager orders shirts from their warehouse. The shirts are packed into boxes and sentto the store, as described below. 81 shirts are ordered. Each shipping box holds 9 shirts. How many shipping boxes are needed for all of the shirts ordered? The options are: A) 8, B) 9, C) 72, D) 90",B,B,True,,B
