Category,Question,Correct_Answer,Output_Answer,Consistency,Cot,Final_Answer
Math,"the probability that event b occurs is 0.6 , and the probability that events a and b both occur is 0.25 . if the probability that either event a or event b occurs is 0.4 , what is the probability that event a will occur ? The options are: a ) 0.05 , b ) 0.15 , c ) 0.45 , d ) 0.5 , e ) 0.55",a,A,True,,a
Math,"how many of the positive factors of 10 , 16 and how many common factors are there in numbers ? The options are: a ) 1 , b ) 2 , c ) 3 , d ) 4 , e ) 5",c,b,True,,b
Math,"miller street begins at baker street and runs directly east for 4.5 kilometers until it ends when it meets turner street . miller street is intersected every 250 meters by a perpendicular street , and each of those streets other than baker street and turner street is given a number beginning at 1 st street ( one block east of baker street ) and continuing consecutively ( 2 nd street , 3 rd street , etc . . . ) until the highest - numbered street one block west of turner street . what is the highest - numbered street that intersects miller street ? The options are: a ) 15 th , b ) 16 th , c ) 17 th , d ) 18 th , e ) 19 th",c,C,False,"step 1: Identify the total length of Miller Street, which is 4.5 kilometers or 4500 meters.
step 2: Determine the distance between each intersecting street, which is 250 meters.
step 3: Calculate the number of sections created by these intersections. Since the first and last streets (Baker and Turner) are not numbered and the streets are 250 meters apart, divide the total length by the distance between intersections: 4500 meters / 250 meters = 18.
step 4: Realize that the calculation in step 3 gives the total number of sections, but since Baker and Turner streets are not numbered, the highest numbered street will be one less than the total number of sections.
step 5: Subtract 1 from the total number of sections to find the highest numbered street: 18 - 1 = 17.",b
Math,"the distance from steve ' s house to work is 40 km . on the way back steve drives twice as fast as he did on the way to work . altogether , steve is spending 6 hours a day on the roads . what is steve ' s speed on the way back from work ? The options are: a ) 5 . , b ) 10 . , c ) 14 . , d ) 15 . , e ) 20 .",e,e,True,,e
Math,"a leak in the bottom of a tank can empty the full tank in 6 hours . an inlet pipe fills water at the rate of 3 liters per minute . when the tank is full in inlet is opened and due to the leak the tank is empties in 8 hours . the capacity of the tank is ? The options are: a ) 5729 , b ) 5760 , c ) 2889 , d ) 2870 , e ) 4320",e,e,True,,e
Math,"a bucket contains 2 mixtures a and b in the ratio 3 : 2 . if 5 liters of the mixture is replaced by 5 liters of liquid b , then the ratio of the two liquids becomes 3 : 5 . how much of the liquid a was there in the bucket ? The options are: a ) 8 liters , b ) 10 liters , c ) 12 liters , d ) 15 liters , e ) 18 liters",a,d,False,"step 1: Let the initial quantities of mixtures A and B be 3x and 2x liters respectively, since the ratio is 3:2.
step 2: The total initial quantity in the bucket is 3x + 2x = 5x liters.
step 3: When 5 liters of the mixture is taken out, the quantity of A and B taken out will be in the same ratio of 3:2. So, 3 liters of A and 2 liters of B are taken out if we consider the 5 liters as being proportionate to the original ratio.
step 4: However, this step is incorrect because we don't know the exact amount of A and B taken out without knowing x. We should instead calculate the effect of adding 5 liters of B directly.
step 5: After removing 5 liters of the mixture, we add 5 liters of B, so the amount of B increases by 5 liters.
step 6: The new ratio of A to B is given as 3:5. Let's denote the new quantities of A and B as A' and B' respectively.
step 7: Since the quantity of A does not change when B is added, A' = 3x.
step 8: The new quantity of B, B' = 2x + 5.
step 9: The new ratio 3:5 can be represented as A'/B' = 3/5. Substituting A' and B' gives 3x / (2x + 5) = 3/5.
step 10: Solving the equation 3x / (2x + 5) = 3/5 gives x = 5. Therefore, the initial quantity of A was 3x = 3*5 = 15 liters.",A
Math,"a contractor undertook to make 15 km of roadway in 40 weeks . in 10 weeks , 3 km was complete by 180 men working 8 hours a day . the men then agreed to work 1 hour a day overtime , and some boys were engaged to assist them , the work was finished in the stipulated time ( 40 weeks ) . how many boys were employed , if the work of 3 boys is equal to that of 2 men ? The options are: a ) 48 , b ) 50 , c ) 22 , d ) 27 , e ) 221",b,b,True,,b
Math,"Claudia has 122 ounces of water and is filling up cups. She has 8-ounce glasses, 5-ounce glasses, and 4-ounce glasses. If she fills six 5 ounce glasses and four 8 ounce glasses, how many 4 ounce glasses can she fill with the remaining water?",15,15,True,,15
Math,"81 , 64 , 27 , 16 . . . The options are: a ) 12 , b ) 4 , c ) 9 , d ) 3 , e ) 1",c,e,False,"step 1: Observe the given sequence: 81, 64, 27, 16, ....
step 2: Notice that these numbers are all perfect cubes or squares: 81 (9^2), 64 (8^2 or 4^3), 27 (3^3), 16 (4^2).
step 3: Identify the pattern in the sequence. The sequence alternates between squares and cubes: square (9^2), cube (4^3), cube (3^3), square (4^2).
step 4: Recognize that the sequence is decreasing and alternates between the square of a number and the cube of a smaller number.
step 5: Predict the next term in the sequence. Since the last number given is 16 (4^2), the next number should be a cube.
step 6: Determine the next smaller cube after 27 (3^3), which is 8 (2^3).
step 7: Realize that step 6 was incorrect in predicting the pattern, as the sequence actually follows a pattern of decreasing perfect squares and cubes without repeating the base number. The correct next step is to find the square or cube smaller than 16 (4^2) that follows the pattern.
step 8: Since the pattern involves decreasing numbers and the last number is a square, the next number should be a cube smaller than 16. The cube smaller than 16 is 8 (2^3), but it does not fit the alternating pattern correctly. The correct observation is that after 16 (4^2), we should look for a square smaller than 16, which is 9 (3^2), but 9 does not fit as it breaks the sequence of unique bases. The correct approach is to recognize the mistake in the pattern analysis and correctly identify that after 16, the sequence should logically continue with a smaller number that fits the observed pattern of squares and cubes. The correct next term, following the corrected understanding of the pattern, is actually 1 (1^1 or 1^2 or 1^3), as it is the next perfect power (square or cube) that follows the descending order.
step 9: Correct the analysis to conclude that the next number in the sequence, following the corrected pattern of descending perfect powers, is 1.",c
Math,"a circular path of 13 m radius has marginal walk 2 m wide all round it . find the cost of leveling the walk at 25 p per m 2 ? The options are: a ) rs . 48 , b ) rs . 64 , c ) rs . 44 , d ) rs . 46 , e ) rs . 34",c,b,True,,b
Math,"a and b can do a work in 6 days , b and c in 2 days and c and a in 8 days . in how many days will the work be completed , if all three of them work together ? The options are: a ) 12 / 24 , b ) 48 / 63 , c ) 45 / 56 , d ) 48 / 19 , e ) 28 / 12",d,d,True,,d
Math,"a train 600 m long can cross an over brdge of 100 m long in 70 sec and then find the speed of the train ? The options are: a ) 79 , b ) 30 , c ) 36 , d ) 66 , e ) 12",c,c,True,,c
Math,"what is the smallest integer n for which 25 ^ n > 5 ^ 12 ? The options are: a ) 6 , b ) 7 , c ) 8 , d ) 9 , e ) 10",b,b,True,,b
Math,"if money is invested at r percent interest , compounded annually , the amount of investment will double in approximately 70 / r years . if pat ' s parents invested $ 8000 in a long term bond that pays 4 percent interest , compounded annually , what will be the approximate total amount of investment 36 years later , when pat is ready for college ? The options are: a ) $ 20000 , b ) $ 15000 , c ) $ 32000 , d ) $ 10000 , e ) $ 9000",c,c,True,,c
Math,"2 ^ 46655 mod 9 = ? The options are: a ) 4 , b ) 5 , c ) 6 , d ) 7 , e ) 8",b,e,False,"step 1: Recognize that the problem asks for the remainder when 2^46655 is divided by 9.
step 2: Recall Euler's theorem, which states that for any integer a coprime with n, a^φ(n) ≡ 1 (mod n), where φ(n) is Euler's totient function. However, since 2 and 9 are not coprime (they share a common factor, which is 1), we cannot directly apply Euler's theorem.
step 3: Notice that we can simplify the problem by finding a pattern in the powers of 2 modulo 9. Start by calculating the first few powers of 2 mod 9: 2^1 mod 9 = 2, 2^2 mod 9 = 4, 2^3 mod 9 = 8, 2^4 mod 9 = 7, 2^5 mod 9 = 5, 2^6 mod 9 = 1, and then it repeats.
step 4: Observe that the powers of 2 modulo 9 cycle every 6 steps: 2, 4, 8, 7, 5, 1.
step 5: Since the cycle repeats every 6 steps, we can find the remainder of 46655 divided by 6 to determine where in the cycle 2^46655 falls. 46655 mod 6 = 3.
step 6: According to our cycle, the third number in the sequence is 8. Therefore, 2^46655 mod 9 = 8.",e
Math,"in a forest 140 deer were caught , tagged with electronic markers , then released . a week later , 50 deer were captured in the same forest . of these 50 deer , it was found that 5 had been tagged with the electronic markers . if the percentage of tagged deer in the second sample approximates the percentage of tagged deer in the forest , and if no deer had either left or entered the forest over the preceding week , what is the approximate number of deer in the forest ? The options are: a ) 150 , b ) 750 , c ) 1,250 , d ) 1,400 , e ) 2,500",d,D,True,,d
Math,"evaluate : 11 + sqrt ( - 4 + 6 × 4 ÷ 3 ) The options are: a ) 9 , b ) 10 , c ) 11 , d ) 12 , e ) 13",e,e,True,,e
Math,"a tank with a volume of 30 cubic feet has one inlet pipe and 2 outlet pipes . the inlet pipe fills water into the tank at the rate of 3 cubic inches / min and the 2 outlet pipes empty it out at the rates of 12 cubic inches / min and 6 cubic inches / min respectively . if all 3 pipes are opened when the tank is full , how many minutes does it take to empty the tank ? ( 1 foot = 12 inches ) The options are: ['a ) 2345', 'b ) 3456', 'c ) 4567', 'd ) 5678', 'e ) 6789']",b,b,False,"step 1: Convert the volume of the tank from cubic feet to cubic inches because the rates are given in cubic inches. There are 12 inches in a foot, so 1 cubic foot is 12*12*12 = 1728 cubic inches. Therefore, 30 cubic feet is 30*1728 cubic inches.
step 2: Calculate the total volume of the tank in cubic inches. 30*1728 = 51840 cubic inches.
step 3: Calculate the net rate of water flowing out of the tank. The inlet pipe adds water at a rate of 3 cubic inches/min, and the two outlet pipes remove water at rates of 12 cubic inches/min and 6 cubic inches/min respectively.
step 4: The net rate of water flowing out = (Rate of outlet 1 + Rate of outlet 2) - Rate of inlet = (12 + 6) - 3 = 15 cubic inches/min.
step 5: Calculate the time it takes to empty the tank. Time = Volume / Rate = 51840 cubic inches / 15 cubic inches/min.
step 6: Perform the division to find the time in minutes. 51840 / 15 = 3456 minutes.
step 7: Match the calculated time with the given options. The correct option is 'b ) 3456'.",b ) 3456
Math,"in a class of 87 students 41 are taking french , 22 are taking german . of the students taking french or german , 9 are taking both courses . how many students are not enrolled in either course ? The options are: a ) 6 , b ) 15 , c ) 24 , d ) 33 , e ) 54",d,d,True,,d
Math,"a rectangular with dimensions 35 inches by 45 inches is to be divided into squares of equal size . which of the following could be a length of a side of the squares ? The options are: ['a ) a ) 4 inches', 'b ) b ) 6 inches', 'c ) c ) 5 inches', 'd ) d ) 8 inches', 'e ) e ) 10 inches']",c,c ) 5 inches,True,,c ) 5 inches
Math,"a man â € ™ s current age is ( 2 / 5 ) of the age of his father . after 10 years , he will be ( 1 / 2 ) of the age of his father . what is the age of father at now ? The options are: a ) 40 , b ) 45 , c ) 38 , d ) 50 , e ) 39",d,d,True,,d
Math,"an empty fuel tank is filled with brand z gasoline . when the tank is 3 / 4 empty , it is filled with brand x gasoline . when the tank is half empty again , it is filled with brand z gasoline . when the tank is half empty again , it is filled with brand x gasoline . at this time , what percent of the gasoline in the tank is brand z ? The options are: a ) 41 % , b ) 42 % , c ) 43 % , d ) 43.75 % , e ) 44 %",d,,False,test,The calculation provided contains errors in understanding the sequence of refills and the final proportion of brand Z gasoline. A correct step-by-step calculation is needed to accurately determine the final answer.
Math,"in 2008 , the profits of company n were 10 percent of revenues . in 2009 , the revenues of company n fell by 20 percent , but profits were 12 percent of revenues . the profits in 2009 were what percent of the profits in 2008 ? The options are: a ) 80 % , b ) 105 % , c ) 120 % , d ) 96 % , e ) 138 %",d,d,True,,d
Math,"a train length 100 m going with speed 10 m / sec another train 150 m long going with speed 15 m / sec . the distance between two train is 50 m . then how much time second train will take to cross the first train ? The options are: a ) 60 sec , b ) 40 sec , c ) 30 sec , d ) 45 sec , e ) 1 min 10 sec",a,a,True,,a
Math,"it takes 40 identical printing presses 15 hours to print 500,000 papers . how many hours would it take 30 of these printing presses to print 500,000 papers ? The options are: a ) 16 , b ) 18 , c ) 20 , d ) 21 , e ) 24",c,b,False,"step 1: Calculate the total work done by 40 printing presses in 15 hours, which is 500,000 papers.
step 2: Determine the work rate of one printing press by dividing the total work by the number of presses, i.e., 500,000 papers divided by 40 presses.
step 3: Calculate the work done by one press in one hour, which is the result from step 2.
step 4: Since the work rate of one press is known, calculate the total work rate of 30 presses by multiplying the work rate of one press by 30.
step 5: To find the time it takes for 30 presses to print 500,000 papers, divide the total work (500,000 papers) by the total work rate of 30 presses obtained in step 4.
step 6: The result from step 5 gives the number of hours it would take for 30 presses to print 500,000 papers.",c
Math,"andrew purchased 10 kg of grapes at the rate of 82 per kg and 6 kg of mangoes at the rate of 62 per kg . how much amount did he pay to the shopkeeper ? The options are: a ) 1000 , b ) 1055 , c ) 1378 , d ) 1075 , e ) 1080",c,None of the options match the calculated total of 1192.,True,,None of the options match the calculated total of 1192.
Math,"a container holding 12 ounces of a solution that is 1 part alcohol to 2 parts water is added to a container holding 4 ounces of a solution that is 1 part alcohol to 3 parts water . what is the ratio of alcohol to water in the resulting solution ? The options are: a ) 2 : 5 , b ) 3 : 7 , c ) 3 : 5 , d ) 5 : 11 , e ) 7 : 3",d,d,True,,d
Math,"10 % people of a village in sri lanka died by bombardment , 20 % of the remainder left the village on account of fear . if now the population is reduced to 4500 , how much was it in the beginning ? The options are: a ) 5999 , b ) 6788 , c ) 6250 , d ) 4559 , e ) 6989",c,c,True,,c
Math,"of the families in city x in 1992 , 60 percent owned a personal computer . the number of families in city x owning a computer in 1993 was 50 percent greater than it was in 1992 , and the total number of families in city x was 3 percent greater in 1993 than it was in 1992 . what percent of the families in city x owned a personal computer in 1993 ? The options are: a ) 68.99 % , b ) 66.55 % , c ) 91.23 % , d ) 77.77 % , e ) 87.37 %",e,e,True,,e
Math,"A dance studio offers lessons to students. It costs $25 per session to rent the studio plus $1.50 per student per session. At present, the dance studio has 10 students and is rented 3 days a week. How much are the expected earnings of the dance studio in a month?",480,,False,test,480
Math,"how many times will the digit 5 be written when listing the integers from 1 to 1000 ? The options are: a ) 300 , b ) 380 , c ) 180 , d ) 415 , e ) 264",a,a,True,,a
Math,"a man sells an article at a profit of 25 % . if he had bought it at 20 % less and sold it for rs . 14.70 less , he would have gained 30 % . find the cost of the article . The options are: a ) 30 , b ) 40 , c ) 50 , d ) 60 , e ) 70",e,e,False,"step 1: Let the original cost price of the article be 'x'.
step 2: The man sells the article at a profit of 25%, so the selling price is x + 25% of x = 1.25x.
step 3: If he had bought it at 20% less, the new cost price would be x - 20% of x = 0.8x.
step 4: He would have sold it for Rs. 14.70 less, so the new selling price is 1.25x - 14.70.
step 5: At this new selling price, he would have gained 30%, so the new selling price is 0.8x + 30% of 0.8x = 1.3 * 0.8x.
step 6: Equate the two expressions for the new selling price: 1.25x - 14.70 = 1.3 * 0.8x.
step 7: Simplify the equation: 1.25x - 14.70 = 1.04x.
step 8: Subtract 1.04x from both sides: 0.21x = 14.70.
step 9: Solve for x: x = 14.70 / 0.21 = 70.",70
Math,"two boats are heading towards each other at constant speeds of 5 miles / hr and 21 miles / hr respectively . they begin at a distance 20 miles from each other . how far are they ( in miles ) one minute before they collide ? The options are: a ) 1 / 12 , b ) 5 / 12 , c ) 1 / 6 , d ) 13 / 30 , e ) 1 / 5",d,d,True,,b ) 5 / 12
Math,"Michael has a chicken farm. His chickens increase in number by 150 chickens annually. If the number of chickens on his farm now is 550, how many will he have after 9 years?",1900,1900,True,,1900
Math,"on rainy mornings , mo drinks exactly n cups of hot chocolate ( assume that n is an integer ) . on mornings that are not rainy , mo drinks exactly 5 cups of tea . last week mo drank a total of 22 cups of tea and hot chocolate together . if during that week mo drank 8 more tea cups than hot chocolate cups , then how many rainy days were there last week ? The options are: a ) 2 , b ) 4 , c ) 3 , d ) 5 , e ) 6",b,b,False,"step 1: Let's denote the number of rainy days as 'r' and the number of non-rainy days as 'nr'.
step 2: Since Mo drinks n cups of hot chocolate on rainy days, the total cups of hot chocolate drunk in a week is 'n*r'.
step 3: On non-rainy days, Mo drinks exactly 5 cups of tea, so the total cups of tea drunk in a week is '5*nr'.
step 4: We are given that Mo drank a total of 22 cups of tea and hot chocolate together, which gives us the equation: n*r + 5*nr = 22.
step 5: We are also given that Mo drank 8 more cups of tea than hot chocolate, which gives us the equation: 5*nr = n*r + 8.
step 6: Since there are 7 days in a week, we have another equation: r + nr = 7.
step 7: From step 5, we can simplify to nr = r + 8/5, but since nr and r must be integers, this equation seems incorrect in the context. Correcting the interpretation: the correct equation from the given information is 5*nr - n*r = 8.
step 8: Substituting nr = 7 - r into the equation from step 7 gives us 5*(7 - r) - n*r = 8. However, realizing the mistake in step 7, we should directly use the information to solve the problem without misinterpreting the equations.
step 9: Correct approach: Let's use the information directly. Total drinks = 22, and tea cups are 8 more than hot chocolate cups. If we let 't' be the number of tea cups and 'h' be the number of hot chocolate cups, we have t + h = 22 and t = h + 8. Solving these equations gives us t = 15 and h = 7. Since Mo drinks 5 cups of tea on non-rainy days, nr = 15/5 = 3. Therefore, r = 7 - 3 = 4 rainy days.
step 10: Correcting the mistake in step 7 and following the correct approach in step 9 leads us to the correct number of rainy days.",c
Math,"if the radius of a circle is decreased 50 % , what happens to the area ? The options are: a ) 10 % decrease , b ) 20 % decrease , c ) 75 % decrease , d ) 40 % decrease , e ) 50 % decrease",c,c,True,,c
Math,"what is the dividend ? the divisor is 17 , the quotient is 4 and the remainder is 8 . The options are: a ) 76 , b ) 67 , c ) 176 , d ) 671 , e ) 0",a,a,True,,a
Math,"a man whose speed is 7 kmph in still water rows to a certain upstream point and back to the starting point in a river which flows at 1.5 kmph , find his average speed for the total journey ? The options are: a ) 6.7 , b ) 4 , c ) 6 , d ) 9 , e ) 3",a,a,False,"step 1: Identify the speed of the man in still water, which is 7 kmph.
step 2: Identify the speed of the river, which is 1.5 kmph.
step 3: Calculate the effective speed of the man upstream, which is the speed in still water minus the speed of the river, i.e., 7 - 1.5 = 5.5 kmph.
step 4: Calculate the effective speed of the man downstream, which is the speed in still water plus the speed of the river, i.e., 7 + 1.5 = 8.5 kmph.
step 5: Assume the distance to the certain point and back is 'D' km each way, so the total distance for the round trip is 2D km.
step 6: Calculate the time taken to travel upstream, which is Distance/Speed = D/5.5 hours.
step 7: Calculate the time taken to travel downstream, which is Distance/Speed = D/8.5 hours.
step 8: Calculate the total time for the journey, which is the sum of the time taken upstream and downstream = D/5.5 + D/8.5 hours.
step 9: Calculate the average speed for the total journey, which is Total Distance / Total Time = 2D / (D/5.5 + D/8.5).
step 10: Simplify the expression for average speed and solve for the value, which gives 2D / (D*(1/5.5 + 1/8.5)) = 2 / (1/5.5 + 1/8.5) = 2 / ((8.5 + 5.5) / (5.5*8.5)) = 2 / (14 / 46.75) = 2 * (46.75 / 14) = 93.5 / 14 = 6.67857142857 kmph.",c
Math,"excluding stoppages , the speed of the bus is 54 kms / hr and with stoppages , it is 45 kmph . for how many minutes does the bus stop per hour ? The options are: a ) 9 , b ) 10 , c ) 11 , d ) 12 , e ) 20",b,b,True,,b
Math,"Toby’s father gave him $343 for passing the test. Toby decided to share it with his two brothers, so he gave each of them 1/7 of $343. How many dollars are left for Toby?",245,245,True,,245
Math,"the cricket team of 11 members is 26 yrs old & the wicket keeper is 3 yrs older . if the ages ofthese 2 are excluded , the average age of the remainingplayers is 1 year less than the average age of the whole team . what is the average age of the team ? The options are: a ) 18 , b ) 21 , c ) 23 , d ) 25 , e ) 27",c,,False,test,e ) 27
Math,"heinz produces tomato puree by boiling tomato juice . the tomato puree has only 20 % water while the tomato juice has 90 % water . how many liters of tomato puree will be obtained from 80 litres of tomato juice ? The options are: a ) 2.8 liters . , b ) 2.5 liters . , c ) 8.5 liters . , d ) 2.6 liters . , e ) 10 liters .",e,e,False,"step 1: Identify the amount of water and solid content in the tomato juice. Since the tomato juice is 90% water, it means 10% of it is solid content.
step 2: Calculate the amount of solid content in 80 liters of tomato juice. Since 10% of it is solid, 80 liters * 10% = 8 liters of solid content.
step 3: Understand that the process of boiling tomato juice into puree only removes water, so the amount of solid content remains the same.
step 4: Since the tomato puree has 20% water, it means 80% of it is solid content.
step 5: Set up an equation to find out how many liters of tomato puree will contain 8 liters of solid content, knowing that this solid content represents 80% of the total puree volume. Let x be the total volume of the puree. Therefore, 80% of x = 8 liters.
step 6: Solve the equation for x. 0.80 * x = 8 liters, which simplifies to x = 8 / 0.80.
step 7: Calculate the value of x. x = 10 liters.
step 8: Compare the calculated value of x with the given options.",b ) 2.5 liters .
Math,"excluding stoppages , the speed of a bus is 50 kmph and including stoppages , it is 42 kmph . for how many minutes does the bus stop per hour ? The options are: a ) 10 min , b ) 7 min , c ) 8.2 min , d ) 9.6 min , e ) 40 min",d,d,True,,d
Math,"in 2008 , the profits of company n were 10 percent of revenues . in 2009 , the revenues of company n fell by 20 percent , but profits were 10 percent of revenues . the profits in 2009 were what percent of the profits in 2008 ? The options are: a ) 80 % , b ) 105 % , c ) 120 % , d ) 124.2 % , e ) 138 %",a,a,True,,a
Math,"Tina saved $27 in June, $14 in July, and $21 in August. Then Tina spent $5 on books and $17 on new shoes. How much money does Tina have left?",40,40,True,,40
Math,"the length of a room is 6 m and width is 4.75 m . what is the cost of paying the floor by slabs at the rate of rs . 900 per sq . metre . The options are: a ) 25650 , b ) 25750 , c ) 26550 , d ) 26750 , e ) 25725",a,a,True,,a
Math,"a work as fast as b . if b can complete a work in 16 days independently , the number of days in which a and b can together finish the work in ? The options are: a ) 2 days , b ) 3 days , c ) 4 days , d ) 5 1 / 3 days , e ) 6 days",d,,False,test,"The calculation indicates 8 days, but this is not among the provided options, suggesting a misunderstanding or an error in the calculation process. Re-evaluation is necessary."
Math,"what distance will be covered by a city bus moving at 72 kmph in 30 seconds ? The options are: a ) 200 m , b ) 300 m , c ) 600 m , d ) 500 m , e ) 400 m",c,c,True,,c
Math,"in 1998 the profits of company n were 10 percent of revenues . in 1999 , the revenues of company n fell by 30 percent , but profits were 14 percent of revenues . the profits in 1999 were what percent of the profits in 1998 ? The options are: a ) 80 % , b ) 105 % , c ) 120 % , d ) 124.2 % , e ) 98 %",e,E,True,,e
